region,type,symbol,name
Korea,Mutual Fund,KR5206361499.KOR,"Kiwoom Frontier Long-term Housing Bond Balanced"
Korea,Mutual Fund,KR5206522181.KOR,"Kiwoom Frontier New IdxAlp Eq-Drv F1 A1"
Korea,Mutual Fund,KR5206522777.KOR,"Kiwoom Frontier New IdxAlp Eq-Drv F1 CW"
Korea,Mutual Fund,KR5206604070.KOR,"Kiwoom Frontier New IdxAlp Eq-Drv F1 Ae"
Korea,Mutual Fund,KR5206632782.KOR,"Kiwoom SK Group Blue Chip Plus Equity 1"
Korea,Mutual Fund,KR5206730750.KOR,"Kiwoom BWK Superior Corp Plus Eq 1 A1"
Korea,Mutual Fund,KR5206730776.KOR,"Kiwoom BWK Superior Corp Plus Eq 1 Ce"
Korea,Mutual Fund,KR5206767422.KOR,"Kiwoom Milestone Private Real Estate 12"
Korea,Mutual Fund,KR5206960944.KOR,"Kiwoom Frontier New IdxAlp Eq-Drv F1 C2"
Korea,Mutual Fund,KR5206960951.KOR,"Kiwoom Frontier New IdxAlp Eq-Drv F1 C3"
Korea,Mutual Fund,KR5206960977.KOR,"Kiwoom Frontier New IdxAlp Eq-Drv F1 C5"
Korea,Mutual Fund,KR5206AB3096.KOR,"Kiwoom 1.5 Leverage Index Master Equity-Derivatives"
Korea,Mutual Fund,KR5206AQ7397.KOR,"Kiwoom Frontier New IdxAlp Eq-Drv F1 S"
Korea,Mutual Fund,KR5206AX5830.KOR,"Kiwoom Pohang Clean Water Love Private Special Asset Infra Business"
Korea,Mutual Fund,KR5207794623.KOR,"KyoboAXA Power Index Equity-Derivatives 1"
Korea,Mutual Fund,KR5207AA6222.KOR,"KyoboAXA Great S-MCap Val Fdr BdBal 1 CP"
Korea,Mutual Fund,KR5207AG2647.KOR,"KyoboAXA Asset-building Balance Feeder Bond Balanced"
Korea,Mutual Fund,KR5207AP7314.KOR,"KyoboAXA Pwr Plus LT Ddct Fdr Eq Bal C"
Korea,Mutual Fund,KR5207AP7330.KOR,"KyoboAXA Pwr Plus LT Ddct Fdr Eq Bal ST"
Korea,Mutual Fund,KR5207AY2538.KOR,"KyoboAXA Pwr GIb Index Fdr Eq Bal-Deriv A"
Korea,Mutual Fund,KR5210611202.KOR,"SHBNPP Asia 4 Stars Feeder Eq-FoF A Hdgd"
Korea,Mutual Fund,KR5210A62174.KOR,"SHBNPP Private Yeosu Integrated Energy Special Asset Infra Business"
Korea,Mutual Fund,KR5210AH3649.KOR,"SHBNPP BujeonMasan Double Track Railway BTL Private Special Asset Infra Bus"
Korea,Mutual Fund,KR5210AH7905.KOR,"SHBNPP Hppy LP Chn RQFII Fdr Eq 1 C1 Hdg"
Korea,Mutual Fund,KR5210AH7913.KOR,"SHBNPP Hppy LP Chn RQFII Fdr Eq 1 Ce Hdg"
Korea,Mutual Fund,KR5210AJ6392.KOR,"SHBNPP Busan New Port Private Special Asset Infra Business"
Korea,Mutual Fund,KR5210AO4234.KOR,"SHBNPP Korea Long Short Feeder Equity"
Korea,Mutual Fund,KR5210AP8242.KOR,"SHBNPP HppyLf Pens Convs Fdr Eq Bal 1 SP"
Korea,Mutual Fund,KR5210AW9100.KOR,"SHBNPP Gyeonggi Highway Private Special Asset Infra Business"
Korea,Mutual Fund,KR5212672111.KOR,"Macquarie Catchup with Theme Fdr Eq 1 A"
Korea,Mutual Fund,KR5212961324.KOR,"Macquarie Catch up with Theme Feeder Equity 1"
Korea,Mutual Fund,KR5213489978.KOR,"Hanwha Jeju Ocean Science Museum Private Special Asset SOC 1"
Korea,Mutual Fund,KR5213990793.KOR,"Hanwha Gwangju Belt-Highway Private Special Asset Infra 1"
Korea,Mutual Fund,KR5213A76756.KOR,"Hanwha 3 Gyeong-In Highway Private Special Asset Infra 1"
Korea,Mutual Fund,KR5213AK8285.KOR,"NH-CA Pinetree Private Equity 28"
Korea,Mutual Fund,KR5213AM0462.KOR,"Hanwha Seoul Subway Line No.9 Private Special Asset Infra 1"
Korea,Mutual Fund,KR5213AW9149.KOR,"Hanwha Gyeonggi Highway Private Special Asset Infra 2"
Korea,Mutual Fund,KR5214469664.KOR,"KIM Private E-land Portfolio Real Estate"
Korea,Mutual Fund,KR5214777652.KOR,"Eugene G-Best Feeder Equity A"
Korea,Mutual Fund,KR5214777660.KOR,"Eugene G-Best Feeder Equity C"
Korea,Mutual Fund,KR5214781738.KOR,"Eugene G-Best Feeder Equity"
Korea,Mutual Fund,KR5214AP8875.KOR,"Eugene G-Best Tax Deduction Fdr Eq C"
Korea,Mutual Fund,KR5214AP8883.KOR,"Eugene G-Best Tax Deduction Feeder Equity"
Korea,Mutual Fund,KR5216959878.KOR,"DB China Nihao Conversion Equity 1"
Korea,Mutual Fund,KR5217A48400.KOR,"Templeton M-DIS Global Feeder Bond-Fund of Funds"
Korea,Mutual Fund,KR5217A48418.KOR,"Templeton M-DIS Global Feeder Bd-FoF C"
Korea,Mutual Fund,KR5217A48426.KOR,"Templeton M-DIS Global Feeder Bd-FoF Ce"
Korea,Mutual Fund,KR5217AE0047.KOR,"Franklin MthDist US Inc Fdr EqBal-FoF C"
Korea,Mutual Fund,KR5217AE0054.KOR,"Franklin MthDist US Inc Fdr EqBal-FoF Ce"
Korea,Mutual Fund,KR5223161104.KOR,"KB MKF Commodity Special Asset Master Commodity-Derivatives"
Korea,Mutual Fund,KR5223161112.KOR,"KB MKF Commodity Spec Asst Fdr Deriv A"
Korea,Mutual Fund,KR5223161138.KOR,"KB MKF Commodity Spec Asst Fdr Deriv C"
Korea,Mutual Fund,KR5223161146.KOR,"KB MKF Commodity Special Asset Feeder Commodity-Derivatives"
Korea,Mutual Fund,KR5223568241.KOR,"KB Gyeonggi Love BTL Private Special Asset"
Korea,Mutual Fund,KR5223690342.KOR,"KB Gyeonggi Hope BTL Private Special Asset"
Korea,Mutual Fund,KR5223980230.KOR,"KB MKF Commodity Spec Asst Fdr Deriv C2"
Korea,Mutual Fund,KR5223980255.KOR,"KB MKF Commodity Spec Asst Fdr Deriv C3"
Korea,Mutual Fund,KR5223980263.KOR,"KB MKF Commodity Spec Asst Fdr Deriv C4"
Korea,Mutual Fund,KR5223988977.KOR,"KB Sosawonsi Rail Project Private Special Asset Equity"
Korea,Mutual Fund,KR5223A81086.KOR,"KB Pohang Water Recycling Project Private Special Asset Money Bond"
Korea,Mutual Fund,KR5223A81284.KOR,"KB RPS FOCUS Private Special Asset Money Bond"
Korea,Mutual Fund,KR5223AA4250.KOR,"KB Emerging Govt Bd Inc Fdr Bd C-MP"
Korea,Mutual Fund,KR5223AB5595.KOR,"KB Samsung and HMC Group Plus Fdr Eq C4"
Korea,Mutual Fund,KR5223AJ7320.KOR,"KB Eulsukdo Bridge Private Speical Asset SOC"
Korea,Mutual Fund,KR5223AK2211.KOR,"KB Private Real Estate NPL 2"
Korea,Mutual Fund,KR5223AN2549.KOR,"KB Lombard Odie Glbl CB Fdr Bd Bal-FoF A"
Korea,Mutual Fund,KR5224850762.KOR,"Heungkuk Highclass Private Equity"
Korea,Mutual Fund,KR5224AB6980.KOR,"Heungkuk Infra Private Special Asset BTO 2"
Korea,Mutual Fund,KR5224AT2336.KOR,"Heungkuk High Class Private Bond 401"
Korea,Mutual Fund,KR5225558331.KOR,"MiraeAsset Retirement Plan KRX100 Index Stable 30 Feeder Balanced 1"
Korea,Mutual Fund,KR5225620982.KOR,"MiraeAsset Rogers Agrclt Index SA Deriv B"
Korea,Mutual Fund,KR5225730104.KOR,"MiraeAsset e-Ocean BRICs Index Fdr Eq 1 Ae"
Korea,Mutual Fund,KR5225730112.KOR,"MiraeAsset e-Ocean BRICs Index Fdr Eq 1 Ce"
Korea,Mutual Fund,KR5225828551.KOR,"MiraeAssetMAPS Premium RCF Private Equity Balanced-Derivatives 1"
Korea,Mutual Fund,KR5225978547.KOR,"MiraeAsset Rogers Agrclt Index SA Deriv CW"
Korea,Mutual Fund,KR5225A81180.KOR,"Hana Alternative Investment Land Chip QWL Private REITs 1"
Korea,Mutual Fund,KR5225A88359.KOR,"MiraeAssetMAPS Uijeongbu Light Rail Private Money Bond 1"
Korea,Mutual Fund,KR5226962458.KOR,"HDC Hyundai Hero-Best Dividend Equity C5"
Korea,Mutual Fund,KR5228275404.KOR,"Allianz Pimco Glbl IG Fdr Bd-FoF A Hdgd"
Korea,Mutual Fund,KR5232158570.KOR,"NH-Amundi 4th Industrial Revolution Master Equity"
Korea,Mutual Fund,KR5232534689.KOR,"NH-Amundi Small-Mid Cap Master Equity 1"
Korea,Mutual Fund,KR5232672083.KOR,"NH-Amundi Chindia Plus Equity 1 A"
Korea,Mutual Fund,KR5232720007.KOR,"NH-CA Value Private Equity 1"
Korea,Mutual Fund,KR5232752877.KOR,"NH-Amundi Latin America Forte Equity Ce"
Korea,Mutual Fund,KR5232849699.KOR,"NH-CA Pinetree Private Equity 12-1"
Korea,Mutual Fund,KR5232854012.KOR,"NH-CA Pinetree Private Equity 12-2"
Korea,Mutual Fund,KR5232855860.KOR,"NH-CA Pinetree Private Equity 12-3"
Korea,Mutual Fund,KR5232912620.KOR,"NH-Amundi China Forte Feeder Equity Ae"
Korea,Mutual Fund,KR5232948541.KOR,"NH-Amundi e-Premier Index Feeder Equity-Derivatives 1"
Korea,Mutual Fund,KR5232960389.KOR,"NH-Amundi Long-term Grwth Rep Comp Eq C2"
Korea,Mutual Fund,KR5232AJ3906.KOR,"NH-CA Pinetree Private Equity 6"
Korea,Mutual Fund,KR5232AP8071.KOR,"NH-Amundi HighFive Inc Ddct FdrEq Bal C"
Korea,Mutual Fund,KR5232AP8089.KOR,"NH-Amundi HighFive Inc Ddct FdrEq Bal ST"
Korea,Mutual Fund,KR5232AT9752.KOR,"NH-Amundi Allset T-Bd 10yr Index FdrBd A"
Korea,Mutual Fund,KR5232AT9760.KOR,"NH-Amundi Allset T-Bd 10yr Index FdrBd C"
Korea,Mutual Fund,KR5232AT9786.KOR,"NH-Amundi Allset T-Bd 10yr Index FdrBd Ae"
Korea,Mutual Fund,KR5232AT9794.KOR,"NH-Amundi Allset T-Bd 10yr Index FdrBd Ce"
Korea,Mutual Fund,KR5232AT9919.KOR,"NH-Amundi e-Premier Index Eq-Deriv 1 CP1"
Korea,Mutual Fund,KR5232AT9927.KOR,"NH-Amundi e-Premier Index Eq-Deriv 1 CP2"
Korea,Mutual Fund,KR5232AU9460.KOR,"NH-Amundi Reverse Index Equity-Deriv A"
Korea,Mutual Fund,KR5232AY2206.KOR,"NH-Amundi Allset Smart Beta+ Equity Ci"
Korea,Mutual Fund,KR5232AY7544.KOR,"NH-CA Pinetree Private Equity 19"
Korea,Mutual Fund,KR5233191794.KOR,"Consus Kyeorae Infra Private Special Asset Loan 1"
Korea,Mutual Fund,KR5233725260.KOR,"Consus Tashkent JSK Private Real Estate 1"
Korea,Mutual Fund,KR5233978034.KOR,"Consus Muju Pinestone Private Real Estate"
Korea,Mutual Fund,KR5233A98402.KOR,"Consus Yecheon Sewer Pipe Private Special Asset Loan Bond 1"
Korea,Mutual Fund,KR5233AF3503.KOR,"Consus Ilsan Private Real Estate"
Korea,Mutual Fund,KR5233AM8701.KOR,"Consus Discorery NPL Private Real Estate 1"
Korea,Mutual Fund,KR5233AN7447.KOR,"Consus Discorery NPL Private Real Estate 2"
Korea,Mutual Fund,KR5233AX3972.KOR,"Consus the Second Part of Busan Harber Road Private Special Asset SOC 1"
Korea,Mutual Fund,KR5233AY8590.KOR,"Consus Moonhak Mt. Tunnel Private Special Asset Loan 1"
Korea,Mutual Fund,KR5234676140.KOR,"IBK Gold Mining Master Equity"
Korea,Mutual Fund,KR5234972259.KOR,"IBK China Continent Equity-FoF C2"
Korea,Mutual Fund,KR5234AH1785.KOR,"IBK Dokdo is our land Feeder Equity A"
Korea,Mutual Fund,KR5234AH1835.KOR,"IBK Dokdo is our land Feeder Equity C4"
Korea,Mutual Fund,KR5234AH1843.KOR,"IBK Dokdo is our land Feeder Equity Ce"
Korea,Mutual Fund,KR5234AN9079.KOR,"IBK Pure Stock Balanced Private Equity 1"
Korea,Mutual Fund,KR5235AC9659.KOR,"FK European HiYld PRS Cnvt Fdr Bd-FoF C"
Korea,Mutual Fund,KR5236562876.KOR,"KIVAM 10 Year Investment Equity 1 C"
Korea,Mutual Fund,KR5236A51966.KOR,"KIVAM 10 Year Investment Equity 1 C"
Korea,Mutual Fund,KR5236A93059.KOR,"KIVAM 10 Year Balance Equity 1 A"
Korea,Mutual Fund,KR5236A93067.KOR,"KIVAM 10 Year Balance Equity 1 AE"
Korea,Mutual Fund,KR5236A93075.KOR,"KIVAM 10 Year Balance Equity 1 C"
Korea,Mutual Fund,KR5236A93083.KOR,"KIVAM 10 Year Investment Balance Feeder Equity 1"
Korea,Mutual Fund,KR5236A93091.KOR,"KIVAM 10 Year Balance Equity 1 C3"
Korea,Mutual Fund,KR5236A93109.KOR,"KIVAM 10 Year Balance Equity 1 C4"
Korea,Mutual Fund,KR5237188051.KOR,"JPMorgan China Feeder Equity UCE"
Korea,Mutual Fund,KR5237188127.KOR,"JPMorgan Middle East&Africa Fdr Eq UCE"
Korea,Mutual Fund,KR5238AL9150.KOR,"Richmond Private Doonsan Movie Theater Real Estate"
Korea,Mutual Fund,KR5239A19058.KOR,"HyundaiInvestment VEXA Value Compression Target Conversion Equity Balanced "
Korea,Mutual Fund,KR5239AE2344.KOR,"HyundaiInvestment CVCCLO Private Special Asset CLO 1"
Korea,Mutual Fund,KR5239AE2351.KOR,"HyundaiInvestment CVCCLO Private Special Asset CLO 2"
Korea,Mutual Fund,KR5239AH0386.KOR,"HyundaiInvestment INGCLO Private Special Asset CLO"
Korea,Mutual Fund,KR5243AJ4802.KOR,"How Busan Seomyun Hotel Private Real Estate"
Korea,Mutual Fund,KR5243AN7270.KOR,"How the 3rd QWL Vally Private Real Estate"
Korea,Mutual Fund,KR5301864942.KOR,"MiraeAsset Glb GrtCnsmr30 Fdr Bd Bal1 A"
Korea,Mutual Fund,KR5301940882.KOR,"MiraeAsset Glb GrtCnsmr30 Fdr Bd Bal1 Ae"
Korea,Mutual Fund,KR5301940908.KOR,"MiraeAsset Glb GrtCnsmr30 Fdr Bd Bal1 Ce"
Korea,Mutual Fund,KR5301985168.KOR,"MiraeAsset For Wife Global Emerging Feeder Equity 1"
Korea,Mutual Fund,KR5301985382.KOR,"MiraeAsset MyChild Make 300 Million Feeder Equity G1"
Korea,Mutual Fund,KR5301AB7414.KOR,"MiraeAsset e-Ocean BRICs Index Feeder Equity 1"
Korea,Mutual Fund,KR5301AI7821.KOR,"MiraeAsset RP Grw Prms S-M Cap Fdr Eq 1C"
Korea,Mutual Fund,KR5301AL0656.KOR,"MiraeAsset Asia GrtCnsmr Fdr Eq-FoF 1 A"
Korea,Mutual Fund,KR5301AL0664.KOR,"MiraeAsset Asia GrtCnsmr Fdr Eq-FoF 1 Ae"
Korea,Mutual Fund,KR5301AL0672.KOR,"MiraeAsset Asia GrtCnsmr Fdr Eq-FoF 1 C1"
Korea,Mutual Fund,KR5301AL0680.KOR,"MiraeAsset Asia GrtCnsmr Fdr Eq-FoF 1 C2"
Korea,Mutual Fund,KR5301AM0283.KOR,"MiraeAsset VUL Advantage Equity 1"
Korea,Mutual Fund,KR5301AQ0362.KOR,"MiraeAsset TxDct LT Grw SMCap Fdr Eq 1 C"
Korea,Mutual Fund,KR5301AQ3499.KOR,"MiraeAsset Pns Sv Smrt LS Fdr Eq Bl 1 Ce"
Korea,Mutual Fund,KR5301AR0072.KOR,"MiraeAsset Rogers Agrclt Index SA Deriv S"
Korea,Mutual Fund,KR5301AT2019.KOR,"MiraeAsset GlbInc SwtAnty Fdr BdBal 1 Ce"
Korea,Mutual Fund,KR5301AT2027.KOR,"MiraeAsset GlbInc SwtAnty Fdr BdBal 1 SP"
Korea,Mutual Fund,KR5301AT7794.KOR,"MiraeAssetMAPS Frontier NPL Private Real Estate 1"
Korea,Mutual Fund,KR5301AU2982.KOR,"MiraeAssetMAPS Mt.Chunma Tunnel Private Special Asset Monetary Bond 1"
Korea,Mutual Fund,KR5303AC4368.KOR,"MIDAS Plus Private Equity Balanced"
Korea,Mutual Fund,KR5303AQ1285.KOR,"MIDAS Turtle 70 Tax Ddct Fdr Eq 1 Ce"
Korea,Mutual Fund,KR5306781794.KOR,"KTB Expert Asset Allocation Eq Bal A"
Korea,Mutual Fund,KR5306AE9909.KOR,"KTB QWL Vally Private Real Estate 1"
Korea,Mutual Fund,KR5306AL5981.KOR,"KTB Alpha Interest Rate Sector Rotation Private Bond Balanced-Fund of Funds"
Korea,Mutual Fund,KR5307167514.KOR,"Yurie Global Nat Gas Fdr Deriv A Unhdgd"
Korea,Mutual Fund,KR5307543508.KOR,"Yurie Small Beauty Plus Equity"
Korea,Mutual Fund,KR5307AQ4897.KOR,"Yurie Global Exchange Feeder 1 Ae"
Korea,Mutual Fund,KR5309655946.KOR,"GoldenBridge NHN Online Game Private Special Asset 1"
Korea,Mutual Fund,KR5310AS6366.KOR,"Koreit NPL Private Real Estate AP2-1"
Korea,Mutual Fund,KR5310AY3563.KOR,"Koreit NPL Private Real Estate AP3"
Korea,Mutual Fund,KR5310AY8190.KOR,"Koreit LCS Private Special Asset"
Korea,Mutual Fund,KR5321618005.KOR,"AlphaAsset Busan Queendom Private Special Asset 1"
Korea,Mutual Fund,KR5345727717.KOR,"Hana Alternative Investment New Leader Kyrgyzstan Private REITs 14"
Korea,Mutual Fund,KR5345AG0297.KOR,"Hana Alternative Investment Land Chip Melbourne Private REITs 49"
Korea,Mutual Fund,KR5363A25780.KOR,"Truston Jegalkongmyung Equity A"
Korea,Mutual Fund,KR5363A25798.KOR,"Truston Jegalkongmyung Equity C1"
Korea,Mutual Fund,KR5363A25806.KOR,"Truston Jegalkongmyung Equity"
Korea,Mutual Fund,KR5363A25814.KOR,"Truston Jegalkongmyung Equity C3"
Korea,Mutual Fund,KR5363A25822.KOR,"Truston Jegalkongmyung Equity Ce"
Korea,Mutual Fund,KR5363A25830.KOR,"Truston Jegalkongmyung Equity W"
Korea,Mutual Fund,KR5363A25848.KOR,"Truston Jegalkongmyung Equity I"
Korea,Mutual Fund,KR5363A29352.KOR,"Truston Jegalkongmyung Equity C4"
Korea,Mutual Fund,KR5363AG1219.KOR,"Truston Jaehyoung Dynamic Korea 50 Feeder Equity Balanced"
Korea,Mutual Fund,KR5363AH8445.KOR,"Truston Jegalkongmyung Pension Fdr Eq C"
Korea,Mutual Fund,KR5363AH8452.KOR,"Truston Jegalkongmyung Pension Fdr Eq Ce"
Korea,Mutual Fund,KR5364848295.KOR,"ASSETPLUS China Rich Together Master Equity"
Korea,Mutual Fund,KR5364AH9426.KOR,"ASSETPLUS China Rich Together pension 1 Equity"
Korea,Mutual Fund,KR5364AK3747.KOR,"Assetplus HppyDrm Pens Fdr Eq Bal 1 C"
Korea,Mutual Fund,KR5364AQ2149.KOR,"Assetplus HppyDrm Pens Fdr Eq Bal 1 SP"
Korea,Mutual Fund,KR5364AS1537.KOR,"Assetplus Korea Rich Togthr Fdr Eq 1 F"
Korea,Mutual Fund,KR5365AR2832.KOR,"Meritz DHW Private Special Asset Ship"
Korea,Mutual Fund,KR5365AW5630.KOR,"Meritz AI-A380 Private Special Asset Aircraft"
Korea,Mutual Fund,KR5366952616.KOR,"BlackRock USD High Yield Bd-FoF A Hdgd"
Korea,Mutual Fund,KR5366AP0316.KOR,"BlackRock USD High Yield Bd-FoF S Hdgd"
Korea,Mutual Fund,KR5371266747.KOR,"Asia Seocho Office Facilities Private Real Estate"
Korea,Mutual Fund,KR5372AV9451.KOR,"Samchully Midstream Professional Private Special Asset 3-2"
Korea,Mutual Fund,KR5373149214.KOR,"Hyundai AnntySav60 Convt Fdr Eq-Bal 1 A"
Korea,Mutual Fund,KR5373AO7693.KOR,"Hyundai AnntySav60 Convt Fdr Eq-Bal 1 SP"
Korea,Mutual Fund,KR5381286560.KOR,"Koramco Yeongjong Xi Private Real Estate 1"
Korea,Mutual Fund,KR5391982315.KOR,"Kiwoom Vivid e-Alpha Index Equity 1"
Korea,Mutual Fund,KR5395AC9911.KOR,"Aju KTM Private Real Estate 1"
Korea,Mutual Fund,KR5453AL6535.KOR,"DarbyHana Injae Military BTL Private Special Asset Infra Business"
Korea,Mutual Fund,KR5453AW8926.KOR,"DarbyHana Gyeonggi Highway Private Special Asset Infra Business"
Korea,Mutual Fund,KR5501576270.KOR,"Meritz e-Korea Equity"
Korea,Mutual Fund,KRL223AQ9767.KOR,"KB Wise Star 1st Private Real Estate Investment LLC"
Korea,Mutual Fund,KRL223AQ9775.KOR,"KB Wise Star 2nd Private Real Estate Investment LLC"
Korea,Mutual Fund,KRL231AX9701.KOR,"Deutsche Office No.3 Private Real Estate Investment LLC"
Korea,Mutual Fund,KRL34000BI25.KOR,"MiraeAsset Equity Balanced Asset Allocation_W210"
Korea,Mutual Fund,KRL34000BI32.KOR,"MiraeAsset Equity Growth_W402"
Korea,Mutual Fund,KRL34000BI61.KOR,"MiraeAsset Global Market Equity_N400"
Korea,Mutual Fund,KRL34000BI66.KOR,"MiraeAsset Aisa Pecific Consumer Equity_N230"
Korea,Mutual Fund,KRL34000I101.KOR,"MiraeAsset EuBRICS Equity Stable Growth Asset Allocation_U609"
Korea,Mutual Fund,KRL383AN3017.KOR,"IGIS NG No.28 Private Real Investment Limited Liability Company"
Korea,Mutual Fund,KRL383AR8533.KOR,"IGIS TDH32 Privat Real Estate Investment Limited Liability Company"
Korea,Mutual Fund,KRL384AK1187.KOR,"Capstone Hyundai 41 Private Real Estate Investment Limited Liability Compan"
Korea,Mutual Fund,KRL384AZ1891.KOR,"Capstone Soraemol Private Real Estate LLC"
Korea,Mutual Fund,KRM103567140.KOR,"Hanwha Income Plus 10 Feeder Bond Balanced 4"
Korea,Mutual Fund,KRM105649110.KOR,"Samsung Index Premium Equity-Deriv A"
Korea,Mutual Fund,KRM213AN5495.KOR,"Hanwha Energy Infra MLP SA Fdr FoF Ce"
Korea,Mutual Fund,KRM213AN5545.KOR,"Hanwha QtrDiv EnrgInfra MLP SA Fdr FoF A"
Korea,Mutual Fund,KRM226A18647.KOR,"HDC Bond Plus Alpha No.1 Bond Balanced A"
Korea,Mutual Fund,KRM242AO9830.KOR,"RG HVL Private Overseas Resources Development Special Asset 1"
Korea,Mutual Fund,KRM453607959.KOR,"DarbyHana Private Emerging Infrastructure Fund"
