region,type,symbol,name
Korea,Mutual Fund,F000001K97.KOR,"UBSHana LC 2020 Feeder Bd Bal 1 LH-CE"
Korea,Mutual Fund,F000001K9F.KOR,"UBSHana LC 2030 Feeder Eq Bal 1 LH-C"
Korea,Mutual Fund,F000001K9H.KOR,"UBSHana LC 2030 Fdr Eq Bal-FoF 1 LH-A"
Korea,Mutual Fund,F000001K9I.KOR,"UBSHana LC 2030 Feeder Eq Bal 1 LH-CE"
Korea,Mutual Fund,F000001KY4.KOR,"UBSHana Umbrella Reverse Index Equity-Derivatives K1"
Korea,Mutual Fund,F000001KZE.KOR,"TongYang MoaDrm Samsung Grp Fdr Eq 1 A"
Korea,Mutual Fund,F000001L1P.KOR,"TongYang MoaDrm Samsung Grp Fdr Eq 1 C"
Korea,Mutual Fund,F000001L1T.KOR,"Kiwoom My Bear Market Equity-Derivatives 1"
Korea,Mutual Fund,F000001L5H.KOR,"Kiwoom BWK Superior Corp Plus Eq 1 A1"
Korea,Mutual Fund,F000001L6I.KOR,"Kiwoom BWK Superior Corp Plus Eq 1 Ce"
Korea,Mutual Fund,F000001LH6.KOR,"MiraeAsset Rogers Agrclt Index SA Deriv B"
Korea,Mutual Fund,F000001LID.KOR,"MiraeAsset e-Ocean BRICs Index Fdr Eq 1 Ce"
Korea,Mutual Fund,F000001LM5.KOR,"MiraeAsset e-Ocean BRICs Index Fdr Eq 1 Ae"
Korea,Mutual Fund,F0000029FT.KOR,"SHBNPP Focus Agriculture Mstr Bd-Deriv"
Korea,Mutual Fund,F000002B3T.KOR,"UBSHana i-Love RSP Bond Balanced 1 C"
Korea,Mutual Fund,F000002CQW.KOR,"Meritz e-Korea Equity"
Korea,Mutual Fund,F000002DTR.KOR,"NH-Amundi RP S-M Cap Fdr Bd Bal 1 C"
Korea,Mutual Fund,F000002FKX.KOR,"MultiAsset JimRogers Agri Fdr Bd-Drv1 A"
Korea,Mutual Fund,F000002FTL.KOR,"UBSHana LC 2020 Fdr Bd Bal-FoF 1 LH-A"
Korea,Mutual Fund,F000002FTS.KOR,"UBSHana LC 2040 Feeder Eq Bal 1 LH-CE"
Korea,Mutual Fund,F000002G91.KOR,"SHBNPP Enrgy&Agri Index Fdr Bd-Deriv 1 A"
Korea,Mutual Fund,F000002GA0.KOR,"Eugene G-Best Feeder Equity C"
Korea,Mutual Fund,F000002GA4.KOR,"Eugene G-Best Feeder Equity"
Korea,Mutual Fund,F000002GBD.KOR,"Eugene G-Best Feeder Equity A"
Korea,Mutual Fund,F000002GC8.KOR,"SHBNPP Foc Agriculture Fdr Bd-Deriv 1 C1"
Korea,Mutual Fund,F000005KJ0.KOR,"BlackRock USD High Yield Bd-FoF C Hdgd"
Korea,Mutual Fund,F000005KTX.KOR,"Hyundai AnntySav60 Convt Fdr Eq-Bal 1 A"
Korea,Mutual Fund,F000005LB1.KOR,"NH-Amundi e-Premier Index Feeder Equity-Derivatives 1"
Korea,Mutual Fund,F00000H3IB.KOR,"Yurie MKF Wealth Total Index Fdr Eq Ce"
Korea,Mutual Fund,F00000JV4S.KOR,"NH-Amundi Daihanminkook SecRepPens FdrEq"
Korea,Mutual Fund,F00000LHTW.KOR,"KTB Market Star Equity C4"
Korea,Mutual Fund,F00000LIDP.KOR,"DB China Nihao Conversion Equity 1"
Korea,Mutual Fund,F00000LLAR.KOR,"KIM China Consmp Grw Bnfc Fdr Eq A Hdgd"
Korea,Mutual Fund,F00000LLAW.KOR,"KIM China Consmp Grw Bnfc Fdr Eq C Hdgd"
Korea,Mutual Fund,F00000LOKP.KOR,"Kiwoom Vivid e-Alpha Index Equity 1"
Korea,Mutual Fund,F00000LOOJ.KOR,"KIM China Consmp Grw Bnfc Fdr Eq Ce Hdgd"
Korea,Mutual Fund,F00000LXBW.KOR,"KB MKF Commodity Special Asset Master Commodity-Derivatives"
Korea,Mutual Fund,F00000MD4H.KOR,"HyundaiInvestment VEXA Value Compression Target Conversion Equity Balanced "
Korea,Mutual Fund,F00000MIU6.KOR,"Franklin MthDist US Hi Yield Fdr Bd-FoF A"
Korea,Mutual Fund,F00000MQ16.KOR,"Templeton M-DIS Global Feeder Bd-FoF C"
Korea,Mutual Fund,F00000MQ18.KOR,"Templeton M-DIS Global Feeder Bond-Fund of Funds"
Korea,Mutual Fund,F00000MRPZ.KOR,"FK Emerg Market Debt MthlyInc Fdr Bd-FoF C"
Korea,Mutual Fund,F00000MZCI.KOR,"Templeton M-DIS Global Feeder Bd-FoF Ce"
Korea,Mutual Fund,F00000N0GK.KOR,"MultiAsset Monthly Pmt Safe Bd-Deriv 1"
Korea,Mutual Fund,F00000NDX8.KOR,"KIM China Consmp Grw Bnfc Fdr Eq C2 Hdgd"
Korea,Mutual Fund,F00000NEHB.KOR,"MiraeAsset For Wife Global Emerging Feeder Equity 1"
Korea,Mutual Fund,F00000NSE3.KOR,"Daishin Private Ravallo Special Asset H3"
Korea,Mutual Fund,F00000NSN2.KOR,"MyAsset Private Ocean Blue Real Estate"
Korea,Mutual Fund,F00000NUMJ.KOR,"KB Pohang Water Recycling Project Private Special Asset Money Bond"
Korea,Mutual Fund,F00000NUMN.KOR,"KB RPS FOCUS Private Special Asset Money Bond"
Korea,Mutual Fund,F00000NUMP.KOR,"KB Sosawonsi Rail Project Private Special Asset Equity"
Korea,Mutual Fund,F00000NUNO.KOR,"KB Gyeonggi Hope BTL Private Special Asset"
Korea,Mutual Fund,F00000NUYF.KOR,"GoldenBridge NHN Online Game Private Special Asset 1"
Korea,Mutual Fund,F00000NV1A.KOR,"Hana Alternative Investment New Leader Kyrgyzstan Private REITs 14"
Korea,Mutual Fund,F00000NVJ2.KOR,"TongYang Busan Seomyeon Misojium Private Real Estate 1"
Korea,Mutual Fund,F00000NVTS.KOR,"MiraeAssetMAPS Jeju Town Sewer Pipe BTL Private Special Asset Money Bond 1"
Korea,Mutual Fund,F00000NW7E.KOR,"SHBNPP Private Yeosu Integrated Energy Special Asset Infra Business"
Korea,Mutual Fund,F00000NWAB.KOR,"Asia Seocho Office Facilities Private Real Estate"
Korea,Mutual Fund,F00000NWL7.KOR,"KIM Private E-land Portfolio Real Estate"
Korea,Mutual Fund,F00000NWN2.KOR,"Consus Kyeorae Infra Private Special Asset Loan 1"
Korea,Mutual Fund,F00000NWNH.KOR,"Consus Tashkent JSK Private Real Estate 1"
Korea,Mutual Fund,F00000NWNP.KOR,"Consus Muju Pinestone Private Real Estate"
Korea,Mutual Fund,F00000NWZ9.KOR,"Hi Gyonggi University Private Real Estate 1"
Korea,Mutual Fund,F00000NWZF.KOR,"Hi Bobos Private Real Estate 1"
Korea,Mutual Fund,F00000NX00.KOR,"KIM Private KPHF Portfolio Equity Balanced-Fund of Funds 1"
Korea,Mutual Fund,F00000NX6Y.KOR,"Hanwha Jeju Ocean Science Museum Private Special Asset SOC 1"
Korea,Mutual Fund,F00000NX74.KOR,"Hanwha Gwangju Belt-Highway Private Special Asset Infra 1"
Korea,Mutual Fund,F00000O18A.KOR,"MiraeAssetMAPS Uijeongbu Light Rail Private Money Bond 1"
Korea,Mutual Fund,F00000O1MY.KOR,"Consus Yecheon Sewer Pipe Private Special Asset Loan Bond 1"
Korea,Mutual Fund,F00000O26M.KOR,"KIVAM 10 Year Balance Equity 1 C"
Korea,Mutual Fund,F00000O7P8.KOR,"KB Emerging Govt Bd Inc Fdr Bd C-MP"
Korea,Mutual Fund,F00000OHZ9.KOR,"Consus Education BTL Private Special Asset Loan 1"
Korea,Mutual Fund,F00000OK9P.KOR,"MiraeAsset e-Ocean BRICs Index Feeder Equity 1"
Korea,Mutual Fund,F00000OKHZ.KOR,"KyoboAXA Great S-MCap Val Fdr BdBal 1 CP"
Korea,Mutual Fund,F00000OT8M.KOR,"Aju KTM Private Real Estate 1"
Korea,Mutual Fund,F00000OTQB.KOR,"SHBNPP KPOST Overseas Bond Professional Private Feeder Bond-Derivatives 1"
Korea,Mutual Fund,F00000P2XA.KOR,"HyundaiInvestment CVCCLO Private Special Asset CLO 1"
Korea,Mutual Fund,F00000P2XD.KOR,"HyundaiInvestment CVCCLO Private Special Asset CLO 2"
Korea,Mutual Fund,F00000PEFY.KOR,"Samsung Chn Brnd Top50 A Mstr Eq-Deriv 1"
Korea,Mutual Fund,F00000PEG0.KOR,"Samsung Chn Brnd Top50 A Mstr Eq-Deriv 2"
Korea,Mutual Fund,F00000PGDP.KOR,"Franklin MthDist US Inc Fdr EqBal-FoF A"
Korea,Mutual Fund,F00000PGK3.KOR,"Consus Ilsan Private Real Estate"
Korea,Mutual Fund,F00000PIQ1.KOR,"Hana Alternative Investment Land Chip Melbourne Private REITs 49"
Korea,Mutual Fund,F00000PN7E.KOR,"TongYang WA MoaDrm 50 Fdr BdBal-Deriv 1"
Korea,Mutual Fund,F00000PNU0.KOR,"TongYang WA MoaDrm S-G 50 Fdr Bd Bal 1"
Korea,Mutual Fund,F00000PQXZ.KOR,"HyundaiInvestment INGCLO Private Special Asset CLO"
Korea,Mutual Fund,F00000PSE5.KOR,"Franklin MthDist US Inc Fdr EqBal-FoF C"
Korea,Mutual Fund,F00000PSE8.KOR,"Franklin MthDist US Inc Fdr EqBal-FoF Ce"
Korea,Mutual Fund,F00000PTPF.KOR,"Yurie Preferred Stock Arbitrge Trading Private Equity Balanced-Derivatives "
Korea,Mutual Fund,F00000PUYB.KOR,"IBK Dokdo is our land Feeder Equity A"
Korea,Mutual Fund,F00000PV6I.KOR,"IBK Dokdo is our land Feeder Equity Ce"
Korea,Mutual Fund,F00000Q3GZ.KOR,"KB Eulsukdo Bridge Private Speical Asset SOC"
Korea,Mutual Fund,F00000Q4I3.KOR,"SHBNPP Busan New Port Private Special Asset Infra Business"
Korea,Mutual Fund,F00000Q6WI.KOR,"SHBNPP BujeonMasan Double Track Railway BTL Private Special Asset Infra Bus"
Korea,Mutual Fund,F00000Q8UE.KOR,"Capstone Hyundai 41 Private Real Estate Investment Limited Liability Compan"
Korea,Mutual Fund,F00000QDVU.KOR,"Heungkuk High Class Private Special Asset Beneficiary Right 38"
Korea,Mutual Fund,F00000QE9H.KOR,"Assetplus HppyDrm Pens Fdr Eq Bal 1 C"
Korea,Mutual Fund,F00000QHDW.KOR,"TongYang MoaDrm Samsung Grp Fdr Eq 1 CP1"
Korea,Mutual Fund,F00000QI2J.KOR,"Daishin TCK World Private Feeder Equity Balanced-Fund of Funds 1 Hedged"
Korea,Mutual Fund,F00000QIHA.KOR,"DarbyHana Injae Military BTL Private Special Asset Infra Business"
Korea,Mutual Fund,F00000QJ7M.KOR,"Richmond Private Doonsan Movie Theater Real Estate"
Korea,Mutual Fund,F00000QK1G.KOR,"MiraeAsset Ann Glb GrtCnsmr Swt Fdr Eq 1"
Korea,Mutual Fund,F00000QSYI.KOR,"Consus Discorery NPL Private Real Estate 1"
Korea,Mutual Fund,F00000S7MF.KOR,"KIM China Consmp Grw Bnfc Fdr Eq C4 Hdgd"
Korea,Mutual Fund,F00000SA5V.KOR,"Richmond Private Jeju Hotel Real Estate"
Korea,Mutual Fund,F00000SA6C.KOR,"How the 3rd QWL Vally Private Real Estate"
Korea,Mutual Fund,F00000SCMW.KOR,"IGIS NG No.28 Private Real Investment Limited Liability Company"
Korea,Mutual Fund,F00000SSD5.KOR,"UBSHana In-best Pension Global Long Short Feeder Equity Balanced-Fund of Fu"
Korea,Mutual Fund,F00000SSTW.KOR,"UBSHana In-best Pension Europe Focus Feeder Equity-Fund of Funds"
Korea,Mutual Fund,F00000T0T5.KOR,"MultiAsset Korea Index Tax Ddctn Fdr Eq C"
Korea,Mutual Fund,F00000T0T7.KOR,"NH-Amundi HighFive Inc Ddct FdrEq Bal C"
Korea,Mutual Fund,F00000T0T9.KOR,"KyoboAXA Pwr Plus LT Ddct Fdr Eq Bal C"
Korea,Mutual Fund,F00000T0TA.KOR,"TongYang MD Sgrp LT TxDct Fdr Eq Bal 1 C"
Korea,Mutual Fund,F00000T0TU.KOR,"SHBNPP Goodmrng Hope TxDct Fdr Eq C1"
Korea,Mutual Fund,F00000T0U5.KOR,"Eugene G-Best Tax Deduction Feeder Equity"
Korea,Mutual Fund,F00000T4VN.KOR,"MIDAS Turtle 70 Tax Ddct Fdr Eq 1 Ce"
Korea,Mutual Fund,F00000T6O7.KOR,"KTB China 1st Grade Stock Master Equity"
Korea,Mutual Fund,F00000T6R2.KOR,"HDC Good Governance Equity 1 S"
Korea,Mutual Fund,F00000T6RK.KOR,"KB MKF Commodity Spec Asst Fdr Deriv S"
Korea,Mutual Fund,F00000T6TP.KOR,"TongYang MoaDrm Samsung Grp Fdr Eq 1 S"
Korea,Mutual Fund,F00000T7H4.KOR,"Hyundai AnntySav60 Convt Fdr Eq-Bal 1 SP"
Korea,Mutual Fund,F00000T8NK.KOR,"MiraeAsset Rogers Agrclt Index SA Deriv S"
Korea,Mutual Fund,F00000TET9.KOR,"Meritz DHW Private Special Asset Ship"
Korea,Mutual Fund,F00000THH4.KOR,"MiraeAsset Aisa Pecific Consumer Equity_N230"
Korea,Mutual Fund,F00000THI3.KOR,"MiraeAsset EuBRICS Equity Stable Growth Asset Allocation_U609"
Korea,Mutual Fund,F00000THPH.KOR,"UBSHana i-Love Regular Savings Plan Feeder Bond Balanced 1"
Korea,Mutual Fund,F00000TIR0.KOR,"MultiAsset Jim Rogers Agri Mstr Bd-Deriv"
Korea,Mutual Fund,F00000TO6V.KOR,"Richmond Private Dongdaemoon Theater Real Estate"
Korea,Mutual Fund,F00000TO6W.KOR,"IGIS TDH32 Privat Real Estate Investment Limited Liability Company"
Korea,Mutual Fund,F00000TO72.KOR,"KIM Private HCS Bond Balanced 1"
Korea,Mutual Fund,F00000TVAN.KOR,"MIDAS HF Professional Private Bond 1"
Korea,Mutual Fund,F00000TW3X.KOR,"MiraeAsset GlbInc SwtAnty Fdr BdBal 1 SP"
Korea,Mutual Fund,F00000TWR5.KOR,"UBSHana IPO & Govce Invmt Fdr Bd Bal A"
Korea,Mutual Fund,F00000TWR6.KOR,"UBSHana IPO & Govce Invmt Fdr Bd Bal C"
Korea,Mutual Fund,F00000U73P.KOR,"MiraeAssetMAPS Mt.Chunma Tunnel Private Special Asset Monetary Bond 1"
Korea,Mutual Fund,F00000UH27.KOR,"UBSHana Number One Variable Insurance Feeder Equity"
Korea,Mutual Fund,F00000UI7H.KOR,"KB Gwangju SRF Plant Private Special Asset SOC"
Korea,Mutual Fund,F00000UIRB.KOR,"Meritz AI-A380 Private Special Asset Aircraft"
Korea,Mutual Fund,F00000UJDQ.KOR,"UBSHana IPO & Govce Invmt Fdr Bd Bal AE"
Korea,Mutual Fund,F00000ULP3.KOR,"UBSHana IPO & Govce Invmt Fdr Bd Bal CE"
Korea,Mutual Fund,F00000UM47.KOR,"DarbyHana Gangwon Wind Power Private Special Asset Infra Business"
Korea,Mutual Fund,F00000UMCW.KOR,"NH-Amundi e-Premier Index Eq-Deriv 1 CP2"
Korea,Mutual Fund,F00000UO64.KOR,"UBSHana IPO & Govce Invmt Fdr Bd Bal CP"
Korea,Mutual Fund,F00000UO65.KOR,"UBSHana IPO & Govce Invmt Fdr Bd Bal W"
Korea,Mutual Fund,F00000UOE2.KOR,"IBK Value Long Short 40 Feeder Bd Bal S"
Korea,Mutual Fund,F00000UP5Z.KOR,"HyundaiInvmt Platinum PF Bd-Deriv 4"
Korea,Mutual Fund,F00000UPR3.KOR,"Kiwoom Pohang Clean Water Love Private Special Asset Infra Business"
Korea,Mutual Fund,F00000V3GI.KOR,"UBSHana Hpy kh Pen Glb Eq Fdr Eq-FoF CE"
Korea,Mutual Fund,F00000V4CA.KOR,"UBSHana Hpy kh Pen Glb Eq Fdr Eq-FoF CP2"
Korea,Mutual Fund,F00000V5ZC.KOR,"Consus Moonhak Mt. Tunnel Private Special Asset Loan 1"
Korea,Mutual Fund,F00000V7G9.KOR,"SHBNPP China ML RQFII Fdr Eq 1 Ce Hdgd"
Korea,Mutual Fund,F00000VBA3.KOR,"Daishin GlbSt MA Fdr EqBal-FoF2 Ce Unhdg"
Korea,Mutual Fund,F00000VEDX.KOR,"Capstone Soraemol Private Real Estate LLC"
Korea,Mutual Fund,F00000VHX8.KOR,"Meritz AI-ROKCMS Private DLS-Derivatives 1"
Korea,Mutual Fund,F00000VHXA.KOR,"Meritz AI-ROKCMS PF DLS-Derivatives 1 C"
Korea,Mutual Fund,F00000VQL8.KOR,"MiraeAsset GlbInc SwtAnty Fdr BdBal 1 Ce"
Korea,Mutual Fund,F00000VS9C.KOR,"Samsung RP POP Fund Rttn Fdr Bd Bal-FoF"
Korea,Mutual Fund,F00000VT0N.KOR,"IBK LifePlanDavos Glb HiDiv Pens Fdr EqC"
Korea,Mutual Fund,F00000VZ08.KOR,"KB Haeoreum Priavte Equity 47"
Korea,Mutual Fund,F00000W12F.KOR,"RyukyungPSG Seocho Discount Store Private Real Estate"
Korea,Mutual Fund,F00000W1J3.KOR,"Hana Alternative Investment Land Chip Private Real Eatate 67"
Korea,Mutual Fund,F00000W2F4.KOR,"KIM Pension Savings L-T Val Fdr Eq C"
Korea,Mutual Fund,F00000W3JU.KOR,"Heungkuk PensChn MIFdr EqBal-FoF Cp Hdgd"
Korea,Mutual Fund,F00000W4KO.KOR,"SHBNPP One Belt One Road Feeder Eq 1 Ce"
Korea,Mutual Fund,F00000W7L2.KOR,"RyukyungPSG Private Real Estate GMK1"
Korea,Mutual Fund,F00000W8JO.KOR,"Koramco US Debt Strategy Private Real Estate Bond-Fund of Funds 1"
Korea,Mutual Fund,F00000W9G5.KOR,"KIM Sinjong for Inst Investors MMF15 CMJ"
Korea,Mutual Fund,F00000WBXF.KOR,"MiraeAsset Sol40 Cnvs FdrBd Bal-FoF 1 CP"
Korea,Mutual Fund,F00000WC4P.KOR,"NH-Amundi Allset Amundi SlvAge Eq-FoF A"
Korea,Mutual Fund,F00000WC8N.KOR,"Dongbu China ML RQFII Fdr Eq S-P Unhdgd"
Korea,Mutual Fund,F00000WCX9.KOR,"NH-Amundi Allset Amundi SlvAge Eq-FoF C"
Korea,Mutual Fund,F00000WD4W.KOR,"ADF KIP Private Real Estate 1"
Korea,Mutual Fund,F00000WEST.KOR,"DarbyHana Japan Solar Power Private Special Asset Infra"
Korea,Mutual Fund,F00000WF8L.KOR,"ADF GIP Private Reral Estate A1"
Korea,Mutual Fund,F00000WF8O.KOR,"ADF GIP Private Reral Estate A2"
Korea,Mutual Fund,F00000WG5O.KOR,"MiraeAsset RP BstColl20 FdrBd Bal-FoF1 C"
Korea,Mutual Fund,F00000WG64.KOR,"Meritz CJS Private Special Asset Loan"
Korea,Mutual Fund,F00000WGAU.KOR,"Meritz AI-SingA330 Private Special Asset Aircraft 1"
Korea,Mutual Fund,F00000WGP4.KOR,"Truston L-T Hi Dividend 40 Fdr Bd Bal C"
Korea,Mutual Fund,F00000WH01.KOR,"Truston L-T Hi Dividend 40 Fdr Bd Bal Cp2"
Korea,Mutual Fund,F00000WIWH.KOR,"Hi HFI Professional Private Real Estate"
Korea,Mutual Fund,F00000WKI2.KOR,"NH-Amundi Allset Amundi SlvAge Eq-FoF Ae"
Korea,Mutual Fund,F00000WP18.KOR,"Truston L-T Hi Dividend 40 Fdr Bd Bal Ce"
Korea,Mutual Fund,F00000WP8Q.KOR,"Hi Ocean PCTC PF Special Asset Ship 2"
Korea,Mutual Fund,F00000WV9O.KOR,"Samsung Aberdeen US SM Fdr EqFoF C UH"
Korea,Mutual Fund,F00000WVAD.KOR,"Samsung Aberdeen US SM Fdr EqFoF Cp UH"
Korea,Mutual Fund,F00000WZXM.KOR,"MiraeAsset Rogers Agrclt Index SA Deriv CW"
Korea,Mutual Fund,F00000X1CD.KOR,"Daishin Dividend Ahpha 30 Bond Bal C"
Korea,Mutual Fund,F00000X1CE.KOR,"Daishin Dividend Ahpha 30 Bond Bal A"
Korea,Mutual Fund,F00000X1IO.KOR,"SHBNPP Overseas Scndry Prof PF Eq-FoF 1"
Korea,Mutual Fund,F00000X1MV.KOR,"KyoboAXA Tomorrow L-T Govt Bd Fdr Bd CW"
Korea,Mutual Fund,F00000X28O.KOR,"SHBNPP Overseas Scndry Prof PF Eq-FoF 2"
Korea,Mutual Fund,F00000X4B2.KOR,"SHBNPP Oversea Scndry Prof PF Eq-FoF 3"
Korea,Mutual Fund,F00000X4B3.KOR,"SHBNPP Oversea Scndry Prof PF Eq-FoF 6"
Korea,Mutual Fund,F00000X51Q.KOR,"Samsung Kor TDF 2040 Eq Bal-FoF Cf Hdgd"
Korea,Mutual Fund,F00000X6Y6.KOR,"SHBNPP Oversea Scndry Prof PF Eq-FoF 4"
Korea,Mutual Fund,F00000X75J.KOR,"Kiwoom Qrtrbck Glb RoboAdv Bd Bal-FoF SP"
Korea,Mutual Fund,F00000X773.KOR,"IBK Dokdo is our land Feeder Equity C4"
Korea,Mutual Fund,K55101AZ9016.KOR,"KIM Private BTL Infra Special Asset Money Bond 40"
Korea,Mutual Fund,K55101B38284.KOR,"KIM Pension Savings L-T Val Fdr Eq C"
Korea,Mutual Fund,K55101B72036.KOR,"KIM Sinjong for Inst Investors MMF15 CMJ"
Korea,Mutual Fund,K55104B84613.KOR,"Hi HFI Professional Private Real Estate"
Korea,Mutual Fund,K55104B97623.KOR,"Hi Ocean PCTC Private Special Asset Ship 2"
Korea,Mutual Fund,K55105B01135.KOR,"Samsung Glb Strat Dividend Fdr Bd-FoF C-P Hdg"
Korea,Mutual Fund,K55105B21935.KOR,"Samsung Pinr Eur SM Fdr Eq-FoF C-P Hdgd"
Korea,Mutual Fund,K55105B22032.KOR,"Samsung Pinr Eur SM Fdr Eq-FoF C-P Unhdg"
Korea,Mutual Fund,K55105B25001.KOR,"Samsung RP POP Fund Rttn Fdr Bd Bal-FoF"
Korea,Mutual Fund,K55105B83901.KOR,"Samsung Glb Dev Cntry Fdr Eq C-P Unhdgd"
Korea,Mutual Fund,K55105B89858.KOR,"Samsung Pictet GM Fdr Eq-FoF C-P Unhdgd"
Korea,Mutual Fund,K55105BA0910.KOR,"Samsung Aberdeen US SM Fdr EqFoF C UH"
Korea,Mutual Fund,K55105BA0977.KOR,"Samsung Aberdeen US SM Fdr EqFoF Cp UH"
Korea,Mutual Fund,K55105BA2783.KOR,"Samsung RP US Rep Eq 40 FdrBdBal C Unhdg"
Korea,Mutual Fund,K55203B29808.KOR,"Daishin GlbSt MA Fdr EqBal-FoF2 CP Unhdg"
Korea,Mutual Fund,K55203B81114.KOR,"Daishin GlbSt MA Fdr EqBal-FoF2 CP2Unhdg"
Korea,Mutual Fund,K55207B38941.KOR,"KyoboAXA Enterprise Love Private Bond Balanced"
Korea,Mutual Fund,K55207B42497.KOR,"KyoboAXA Choice Up Private Bond Balanced"
Korea,Mutual Fund,K55207B65894.KOR,"KyoboAXA Neo Value Equity Master Equity"
Korea,Mutual Fund,K55210B33235.KOR,"SHBNPP Hppy LP Chn RQFII Fdr Eq 1 Cr Hdg"
Korea,Mutual Fund,K55213B76337.KOR,"Hanwha 100yr RP Smrt Sel FdrBd Bal-FoF C"
Korea,Mutual Fund,K55213BA8888.KOR,"Hanwha Korea Legend S-M Cap Fdr Eq S"
Korea,Mutual Fund,K55216B12475.KOR,"Dongbu China ML RQFII Fdr Eq S-P Unhdgd"
Korea,Mutual Fund,K55223B42734.KOR,"KB TIF Core Infra Professional Private Special Asset Infra-Fund of Funds 1"
Korea,Mutual Fund,K55223B47568.KOR,"KB Haeoreum Priavte Equity 47"
Korea,Mutual Fund,K55230B58370.KOR,"Schroder DM S-M Cap Fdr Eq-FoF Ae Hdgd"
Korea,Mutual Fund,K55230B58396.KOR,"Schroder DM S-M Cap Fdr Eq-FoF Ce Hdgd"
Korea,Mutual Fund,K55232B30946.KOR,"NH-Amundi Allset Short-term Government Feeder Bond"
Korea,Mutual Fund,K55232B55810.KOR,"NH-CA Pinetree Private Equity 23"
Korea,Mutual Fund,K55232B57329.KOR,"NH-Amundi Allset Amundi SlvAge Eq-FoF A"
Korea,Mutual Fund,K55232B57337.KOR,"NH-Amundi Allset Amundi SlvAge Eq-FoF Ae"
Korea,Mutual Fund,K55232B57345.KOR,"NH-Amundi Allset Amundi SlvAge Eq-FoF C"
Korea,Mutual Fund,K55232B57402.KOR,"NH-Amundi Allset Amundi SlvAge Eq-FoFCP1"
Korea,Mutual Fund,K55232B57410.KOR,"NH-Amundi Allset Amundi SlvAge Eq-FoFCP2"
Korea,Mutual Fund,K55232B68086.KOR,"NH-Amundi Allset Grw SM20 Fdr Bd-Bal Ae"
Korea,Mutual Fund,K55232B68094.KOR,"NH-Amundi Allset Grw SM 20 Fdr Bd-Bal C"
Korea,Mutual Fund,K55232B68102.KOR,"NH-Amundi Allset Grw SM20 Fdr Bd-Bal Ce"
Korea,Mutual Fund,K55232B68151.KOR,"NH-Amundi Allset Grw SM 40 Fdr Bd-Bal A"
Korea,Mutual Fund,K55232B68177.KOR,"NH-Amundi Allset Grw SM 40 Fdr Bd-Bal C"
Korea,Mutual Fund,K55232B68185.KOR,"NH-Amundi Allset Grw SM40 Fdr Bd-Bal Ce"
Korea,Mutual Fund,K55232B69118.KOR,"NH-CA Pinetree Private Equity 27"
Korea,Mutual Fund,K55232B70918.KOR,"NH-CA Pinetree Private Equity 25"
Korea,Mutual Fund,K55232B75552.KOR,"NH-Amundi Allset Grw SM20 Fdr Bd-Bal CP1"
Korea,Mutual Fund,K55232B75560.KOR,"NH-Amundi Allset Grw SM20 Fdr Bd-Bal CP2"
Korea,Mutual Fund,K55232B75578.KOR,"NH-Amundi Allset Grw SM40 Fdr Bd-Bal CP1"
Korea,Mutual Fund,K55232B81683.KOR,"NH-Amundi Allset Gr SM 10 Fdr Bd-Bal A"
Korea,Mutual Fund,K55232B93126.KOR,"NH-Amundi Allset T-Bd 10yr Index FdrBd Cw"
Korea,Mutual Fund,K55234B26213.KOR,"IBK LifePlanDavos Glb HiDiv Pens Fdr EqC"
Korea,Mutual Fund,K55234B71888.KOR,"IBK Short-term Government Bond Master Bond"
Korea,Mutual Fund,K55236B43973.KOR,"KIVAM 10 Year Investment Dividend Master Equity"
Korea,Mutual Fund,K55241B79936.KOR,"JB QWL Private Real Estate 3"
Korea,Mutual Fund,K55301B58569.KOR,"MiraeAsset India S-M Foc Fdr Eq 1 Ae"
Korea,Mutual Fund,K55301B83492.KOR,"MiraeAsset Emerg$ Corp FdrBd 1 CPe Unhdg"
Korea,Mutual Fund,K55301B95215.KOR,"MiraeAsset Asia GrtCnsmr Fdr Eq-FoF1 Cpe"
Korea,Mutual Fund,K55301B95314.KOR,"MiraeAsset Glb GrtCnsmr30 FdrBd Bal1 Cpe"
Korea,Mutual Fund,K55305B47407.KOR,"RyukyungPSG Seocho Discount Store Private Real Estate"
Korea,Mutual Fund,K55305B61408.KOR,"RyukyungPSG Private Real Estate GMK1"
Korea,Mutual Fund,K55306AZ7682.KOR,"KTB IPO Separate Taxation HY Bd Bal A"
Korea,Mutual Fund,K55306AZ7690.KOR,"KTB IPO Separate Taxation High Yield Bond Balanced"
Korea,Mutual Fund,K55306B40368.KOR,"KTB China Plus Chance Bond Balanced CP"
Korea,Mutual Fund,K55310B41467.KOR,"Koreit NPL Private Real Estate AP3-2A"
Korea,Mutual Fund,K55345B44376.KOR,"Hana Alternative Investment Land Chip Private Real Eatate 67"
Korea,Mutual Fund,K55363B09356.KOR,"Truston L-T Hi Dividend 40 Fdr Bd Bal C"
Korea,Mutual Fund,K55363B53339.KOR,"Truston L-T Hi Dividend 40 Fdr Bd Bal Ce"
Korea,Mutual Fund,K55363B53388.KOR,"Truston L-T Hi Dividend 40 Fdr Bd Bal Cp2"
Korea,Mutual Fund,K55365B13155.KOR,"Meritz AI-ROKCMS PF DLS-Derivatives 1 C"
Korea,Mutual Fund,K55365B13171.KOR,"Meritz AI-ROKCMS Private DLS-Derivatives 1"
Korea,Mutual Fund,K55365B84644.KOR,"Meritz CJS Private Special Asset Loan"
Korea,Mutual Fund,K55365B84750.KOR,"Meritz AI-SingA330 Private Special Asset Aircraft 1"
Korea,Mutual Fund,K55365B84768.KOR,"Meritz AI-SingA330 Private Special Asset Aircraft 2"
Korea,Mutual Fund,K55366B24374.KOR,"BlackRock Global Bond Opprtnty Bd-FoF C"
Korea,Mutual Fund,K55381B36138.KOR,"Koramco US Value Add Strategy Private Real Estate 1"
Korea,Mutual Fund,K55381B60500.KOR,"Koramco US Debt Strategy Private Real Estate Bond-Fund of Funds 1"
Korea,Mutual Fund,K55381B83221.KOR,"Koramco Per Step Private Real Estate 31"
Korea,Mutual Fund,K55381B83247.KOR,"Koramco Per Step Private Real Estate 32"
Korea,Mutual Fund,K553D0B64445.KOR,"ADF GIP Private Reral Estate A1"
Korea,Mutual Fund,K553D0B64486.KOR,"ADF GIP Private Reral Estate A2"
Korea,Mutual Fund,K553D0B76506.KOR,"ADF KIP Private Real Estate 1"
Korea,Mutual Fund,K55453B50938.KOR,"DarbyHana BLT PF SA Infra Business 3"
Korea,Mutual Fund,KR5101967408.KOR,"KIM Private Busan University BTO Infra Special Asset Money Bond 1"
Korea,Mutual Fund,KR5101974461.KOR,"KIM China Consmp Grw Bnfc Fdr Eq A Hdgd"
Korea,Mutual Fund,KR5101974479.KOR,"KIM China Consmp Grw Bnfc Fdr Eq C Hdgd"
Korea,Mutual Fund,KR5101974487.KOR,"KIM China Consmp Grw Bnfc Fdr Eq C2 Hdgd"
Korea,Mutual Fund,KR5101974503.KOR,"KIM China Consmp Grw Bnfc Fdr Eq C4 Hdgd"
Korea,Mutual Fund,KR5101974511.KOR,"KIM China Consmp Grw Bnfc Fdr Eq Ce Hdgd"
Korea,Mutual Fund,KR5101988008.KOR,"KIM Private BTL Infra Special Asset Money Bond 3"
Korea,Mutual Fund,KR5101A80359.KOR,"KIM Private KPHF Portfolio Equity Balanced-Fund of Funds 1"
Korea,Mutual Fund,KR5101AI2071.KOR,"KIM Private Gwangkyo Complex REITs"
Korea,Mutual Fund,KR5102483819.KOR,"UBSHana i-Love RSP Bond Balanced 1 C"
Korea,Mutual Fund,KR5102733494.KOR,"UBSHana LC 2020 Fdr Bd Bal-FoF 1 LH-CE"
Korea,Mutual Fund,KR5102734385.KOR,"UBSHana LC 2030 Fdr Eq Bal-FoF 1 LH-A"
Korea,Mutual Fund,KR5102734393.KOR,"UBSHana LC 2030 Fdr Eq Bal-FoF 1 LH-C"
Korea,Mutual Fund,KR5102737636.KOR,"UBSHana LC 2020 Fdr Bd Bal-FoF 1 LH-A"
Korea,Mutual Fund,KR5102AM8501.KOR,"UBSHana In-best Pension Europe Focus Feeder Equity-Fund of Funds"
Korea,Mutual Fund,KR5102AN7908.KOR,"UBSHana In-best Pension Global Long Short Feeder Equity Balanced-Fund of Fu"
Korea,Mutual Fund,KR5102AN7916.KOR,"UBSHana Inbest Pens GLS Fdr EqBal-FoF C"
Korea,Mutual Fund,KR5102AR2244.KOR,"UBSHana i-Love Regular Savings Plan Feeder Bond Balanced 1"
Korea,Mutual Fund,KR5102AR8308.KOR,"UBSHana i-Love RSP Bond Balanced 1 C"
Korea,Mutual Fund,KR5102AV0044.KOR,"UBSHana Number One Variable Insurance Feeder Equity"
Korea,Mutual Fund,KR5102AX4648.KOR,"UBSHana Hpy kh Pen Glb Eq Fdr Eq-FoF CE"
Korea,Mutual Fund,KR5102AX4655.KOR,"UBSHana Hpy kh Pen Glb Eq Fdr Eq-FoF CP2"
Korea,Mutual Fund,KR5104277300.KOR,"Hi Gyonggi University Private Real Estate 1"
Korea,Mutual Fund,KR5105175644.KOR,"Samsung J-REITs Real Estate REITs-Fund of Funds 1"
Korea,Mutual Fund,KR5105354751.KOR,"Samsung Value Life Plan 35 Conversion Feeder Bood Balanced 1"
Korea,Mutual Fund,KR5105594653.KOR,"Samsung J-REITs Real Estate FoF 1 B"
Korea,Mutual Fund,KR5105597649.KOR,"Samsung J-REITs Real Estate FoF 1 A"
Korea,Mutual Fund,KR5105938041.KOR,"Samsung KOSPI200 Invrs Index Bd-Deriv 1 A"
Korea,Mutual Fund,KR5105AP8596.KOR,"Samsung Kor SM50 LT TxDct Fdr Bd Bal1 Ce"
Korea,Mutual Fund,KR5105AP8604.KOR,"Samsung Kor SM50 LT TxDct Fdr Bd Bal1 ST"
Korea,Mutual Fund,KR5105AP9529.KOR,"Samsung Kor LT TxDct Fdr Eq-Deriv 1 C"
Korea,Mutual Fund,KR5105AP9545.KOR,"Samsung Kor LT TxDct Fdr Eq-Deriv 1 ST"
Korea,Mutual Fund,KR5107572715.KOR,"TongYang Busan Seomyeon Misojium Private Real Estate 1"
Korea,Mutual Fund,KR5107594115.KOR,"TongYang MoaDrm Samsung Grp Fdr Eq 1 A"
Korea,Mutual Fund,KR5107AH3959.KOR,"TongYang MoaDrm Samsung Grp Fdr Eq 1 CP1"
Korea,Mutual Fund,KR5107AP2522.KOR,"TongYang MoaDrm Samsung Grp Fdr Eq 1 S"
Korea,Mutual Fund,KR5107AP4551.KOR,"TongYang Pwr Pens Sav RV 60 EqBal 1 C"
Korea,Mutual Fund,KR5107AP9634.KOR,"TongYang SM HD LT TxDct Fdr Eq Bal 1 Ce"
Korea,Mutual Fund,KR5107AP9642.KOR,"TongYang SM HD LT TxDct Fdr Eq Bal 1 ST"
Korea,Mutual Fund,KR5107AP9667.KOR,"TongYang MD Sgrp LT TxDct Fdr Eq Bal 1 C"
Korea,Mutual Fund,KR5203833227.KOR,"Daishin Private Ravallo Special Asset H3"
Korea,Mutual Fund,KR5203AL6553.KOR,"Daishin TCK World Private Feeder Equity Balanced-Fund of Funds 1 Hedged"
Korea,Mutual Fund,KR5203AZ3695.KOR,"Daishin GlbSt MA Fdr EqBal-FoF2 A Unhdg"
Korea,Mutual Fund,KR5203AZ3703.KOR,"Daishin GlbSt MA Fdr EqBal-FoF2 Ae Unhdg"
Korea,Mutual Fund,KR5203AZ3729.KOR,"Daishin GlbSt MA Fdr EqBal-FoF2 C2 Unhdg"
Korea,Mutual Fund,KR5203AZ3752.KOR,"Daishin GlbSt MA Fdr EqBal-FoF2 Ce Unhdg"
Korea,Mutual Fund,KR5205798444.KOR,"MultiAsset JimRogers Agri Fdr Bd-Drv1 C1"
Korea,Mutual Fund,KR5205AQ0609.KOR,"MultiAsset Korea Index Tax Ddctn Fdr Eq C"
