region,type,symbol,name
Stuttgart,Mutual Fund,0GKA.STG,"G.V.L.E. Gesellschaft ZERT.03.1"
Stuttgart,Mutual Fund,0GUA.STG,"UBS AG, London Branch 3.5% RVCV 26-09-2018 EUR"
Stuttgart,Mutual Fund,0LNA.STG,"XBT Provider AB O.E. 15(unl.) B"
Stuttgart,Mutual Fund,0LNB.STG,"XBT Provider AB O.E. 15(unl.) B"
Stuttgart,Mutual Fund,0LND.STG,"XBT Provider AB O.E. 17(unl.) E"
Stuttgart,Mutual Fund,10AJ.STG,"AIS-Amundi Id.FTSE EPRA NAR.GlN"
Stuttgart,Mutual Fund,10AM.STG,"AIS-Amundi Id.BARCL.G.AGG 500MA"
Stuttgart,Mutual Fund,18M0.STG,"Amundi ETF G.Bd EMTS B.IG 7-10A"
Stuttgart,Mutual Fund,18M1.STG,"Amundi ETF Cash 3 Mt.EOM.In.G.A"
Stuttgart,Mutual Fund,18MD.STG,"Amundi ETF Lev.EO STOXX 50 Da.A"
Stuttgart,Mutual Fund,18MM.STG,"AIS-Am.Idx.-MSCI Pacific ex JPA"
Stuttgart,Mutual Fund,18MS.STG,"Amundi ETF Short EOSTXX 50 Da.A"
Stuttgart,Mutual Fund,18MX.STG,"Amundi ETF G.Bd EMTS Br.IG 1-3A"
Stuttgart,Mutual Fund,2B7A.STG,"iShsV-S&P 500 Ut.Sector U.ETF R"
Stuttgart,Mutual Fund,2B7N.STG,"iShsIII-MSCI T.UK R.Est.U.ETF R"
Stuttgart,Mutual Fund,2IMB.STG,"PI Global Value Fund Inhaber-An"
Stuttgart,Mutual Fund,36BY.STG,"iShsII-JPX-N.400EUR H.U.ETF AcR"
Stuttgart,Mutual Fund,3DEL.STG,"Boost Issuer PLC LevDAX 3xLev.E"
Stuttgart,Mutual Fund,3PT3.STG,"SGKB (Lux)-Danube Tiger (EUR) I"
Stuttgart,Mutual Fund,4GLD.STG,"Xetra-Gold"
Stuttgart,Mutual Fund,540P.STG,"Am.ETF Sh.Gv Bd EOM.B.I.G.D.UEA"
Stuttgart,Mutual Fund,5X63.STG,"ComStage Commerzbank Bund-Fut DblShrtETF"
Stuttgart,Mutual Fund,5XM1.STG,"MCF S.UCITS Fd-QUANTUM CapitalN"
Stuttgart,Mutual Fund,6PSC.STG,"I.M.III-I.FTSE RAFI Europ.UETFR"
Stuttgart,Mutual Fund,6PSH.STG,"I.M.III-I.Dynamic US Mkts UETFR"
Stuttgart,Mutual Fund,ABD0.STG,"Aberdeen Gl.-Sel.Emerg.Mkts BdA"
Stuttgart,Mutual Fund,ABD3.STG,"Aberdeen Gl.-Sel.EO Hgh Yield BdA"
Stuttgart,Mutual Fund,ABD8.STG,"ABERDEEN GLOBAL S.-AUSTRALA.EQA"
Stuttgart,Mutual Fund,AEF2.STG,"Aberdeen Global-Indian Equity A"
Stuttgart,Mutual Fund,AEF6.STG,"Aberdeen Global-Chinese EquityA"
Stuttgart,Mutual Fund,AEFE.STG,"Aberdeen Global-Asian Sm. Cos A"
Stuttgart,Mutual Fund,AEMD.STG,"Amundi Ind.Sol.-A.In.MSCI E.M.A"
Stuttgart,Mutual Fund,AICA.STG,"AVANA IndexTrend Europ.DynamicI"
Stuttgart,Mutual Fund,AICB.STG,"AVANA IndexTrend Europ.ControlI"
Stuttgart,Mutual Fund,ALQD.STG,"Xtr.II USD Asia x Jap.Corp.Bd I"
Stuttgart,Mutual Fund,AMEA.STG,"AIS-Amundi MSCI EM ASIA Namens-"
Stuttgart,Mutual Fund,AMED.STG,"AIS-Amundi Index MSCI EMU Act.N"
Stuttgart,Mutual Fund,AXK2.STG,"AXA Rosenb.Eq.A.Tr.-Pan E.Equ.R"
Stuttgart,Mutual Fund,AXKA.STG,"AXA R.Eq.A.T.-Jap.Sm.Cap.Al.FdR"
Stuttgart,Mutual Fund,AXKC.STG,"AXA Rosenb.Eq.A.Tr.-US Equity R"
Stuttgart,Mutual Fund,AXKD.STG,"AXA Ros.Eq.A.Tr.-Glob.Eq.AlphaR"
Stuttgart,Mutual Fund,B4N1.STG,"BNP Paribas Issuance B.V. OPEN "
Stuttgart,Mutual Fund,B4N9.STG,"BNP Paribas Issuance B.V. OPEN "
Stuttgart,Mutual Fund,BNQA.STG,"BNP Paribas Issuance B.V. OPEN "
Stuttgart,Mutual Fund,BNQB.STG,"BNP Paribas Issuance B.V. OPEN "
Stuttgart,Mutual Fund,BNQC.STG,"BNP Paribas Issuance B.V. OPEN "
Stuttgart,Mutual Fund,BNQD.STG,"BNP Paribas Issuance B.V. OPEN "
Stuttgart,Mutual Fund,BNQR.STG,"BNP Paribas Issuance B.V. OPEN "
Stuttgart,Mutual Fund,BNQS.STG,"BNP Paribas Issuance B.V. OPEN "
Stuttgart,Mutual Fund,BYQA.STG,"Barings Gl-Eastern Europe FundR"
Stuttgart,Mutual Fund,BYQB.STG,"Barings Intl-Hong Kong China Re"
Stuttgart,Mutual Fund,BYQC.STG,"Barings Gl-Eastern Europe FundR"
Stuttgart,Mutual Fund,BYQD.STG,"Barings Intl-Europa Fund Regist"
Stuttgart,Mutual Fund,BYQE.STG,"Barings Intl-Europa Fund Regist"
Stuttgart,Mutual Fund,BYQM.STG,"Barings Latin America Fund Regi"
Stuttgart,Mutual Fund,BYQN.STG,"Barings Gl-Global Resources FdR"
Stuttgart,Mutual Fund,BYQU.STG,"Barings Latin America Fund Regi"
Stuttgart,Mutual Fund,C053.STG,"ComStage EURO STOXX 50 Daily Lvrg ETF"
Stuttgart,Mutual Fund,C1GM.STG,"CBK-SGB Geldmarktfonds Inhaber-"
Stuttgart,Mutual Fund,CBC.STG,"CB GELDMARKT DEUTSCHLAND I Inha"
Stuttgart,Mutual Fund,CCME.STG,"Commerzb.CCBI RQFII M.Mk.U.ETFR"
Stuttgart,Mutual Fund,CEBB.STG,"iShs VII-MSCI RU ADR-GDR U.ETFR"
Stuttgart,Mutual Fund,CEBP.STG,"iShs VII-MSCI EMU DL H.U.ETF AR"
Stuttgart,Mutual Fund,CEM1.STG,"iShsIII-MSCI T.USA R.Est.U.ETFR"
Stuttgart,Mutual Fund,CFE5.STG,"C WorldWide-C Wo.Wi.Gl Eq.Eth.A"
Stuttgart,Mutual Fund,CFPA.STG,"DNB Fund-Asian Small Cap Inhabe"
Stuttgart,Mutual Fund,CFPM.STG,"DNB Fd-DNB Technology Act. Nomi"
Stuttgart,Mutual Fund,CFPN.STG,"DNB Fd-DNB Renewable Energy Act"
Stuttgart,Mutual Fund,CXWB.STG,"Allianz EuropaVision Inhaber-An"
Stuttgart,Mutual Fund,CXWC.STG,"Fondis Inhaber-Anteile A"
Stuttgart,Mutual Fund,CXWP.STG,"NRNBERGER Euroland A Inhaber-An"
Stuttgart,Mutual Fund,D5BH.STG,"Xtrackers MSCI Canada Inhaber-A"
Stuttgart,Mutual Fund,DBPB.STG,"DB Platinum Commodity Euro Inha"
Stuttgart,Mutual Fund,DBPD.STG,"Xtr.ShortDAX x2 Daily Swap Inha"
Stuttgart,Mutual Fund,DBXA.STG,"Xtrackers MSCI Europe Inhaber-A"
Stuttgart,Mutual Fund,DBXB.STG,"Xtr.II Euroz.Gov.Bond 7-10 Inha"
Stuttgart,Mutual Fund,DBXC.STG,"Xtr.II Eurozone Gov.Bond 10-15I"
Stuttgart,Mutual Fund,DBZB.STG,"Xtrackers II Global Gov.Bond In"
Stuttgart,Mutual Fund,DEDA.STG,"DekaStruktur: 4 ErtragPlus Inha"
Stuttgart,Mutual Fund,DEDB.STG,"DekaLux-Geldmarkt: USD Inhaber-"
Stuttgart,Mutual Fund,DEDC.STG,"DEKA-FLEX: EURO Inh.-Ant. Klass"
Stuttgart,Mutual Fund,DI7H.STG,"Allianz Geldmarktfonds SpezialI"
Stuttgart,Mutual Fund,DJFA.STG,"All.Vermgensb.Deutschland Inhab"
Stuttgart,Mutual Fund,DJFC.STG,"Allianz Euro Rentenfonds K Inha"
Stuttgart,Mutual Fund,DJFD.STG,"Kapital Plus Inhaber-Anteile A "
Stuttgart,Mutual Fund,DJL0.STG,"AGIF VI-Allianz Korea Fund Regi"
Stuttgart,Mutual Fund,DJL3.STG,"AGIF V-Allianz Global InsightsI"
Stuttgart,Mutual Fund,DJL4.STG,"AGIF V-Allianz Japan Small.CosI"
Stuttgart,Mutual Fund,DJL5.STG,"AGIF V-Allianz East.Europe Eq.I"
Stuttgart,Mutual Fund,DJLB.STG,"AGIF VII-Allianz Emerg.Mkts BdI"
Stuttgart,Mutual Fund,DJLC.STG,"AGIF VI-Allianz Korea Fund Regi"
Stuttgart,Mutual Fund,DJLD.STG,"AGIF V-Allianz US Equity Inhabe"
Stuttgart,Mutual Fund,DKE4.STG,"DKB ASIEN FONDS Inhaber-Anteile"
Stuttgart,Mutual Fund,DKEA.STG,"DKB EUROPA FONDS Inhaber-Anteil"
Stuttgart,Mutual Fund,DNRA.STG,"AIS-AM.ID. MSCI North America A"
Stuttgart,Mutual Fund,DWSC.STG,"DWS Invest-Top Asia Inhaber-Ant"
Stuttgart,Mutual Fund,DWWB.STG,"DWS Qi LowVol Europe Inhaber-An"
Stuttgart,Mutual Fund,DWWC.STG,"DWS US Equities Typ O Inhaber-A"
Stuttgart,Mutual Fund,DX1.STG,"Candriam Equities L-Em.MarketsI"
Stuttgart,Mutual Fund,DX1B.STG,"Candriam Equities L-Em.MarketsI"
Stuttgart,Mutual Fund,DX1E.STG,"Candriam Equities L-Em.MarketsI"
Stuttgart,Mutual Fund,DXET.STG,"Xtrackers Euro Stoxx 50 Inhaber"
Stuttgart,Mutual Fund,DXQF.STG,"DKO-Aktien Deutschland Inhaber-"
Stuttgart,Mutual Fund,DXSA.STG,"Xtr.Euro Stoxx Qual.Dividend In"
Stuttgart,Mutual Fund,DXSB.STG,"Xtr.Stoxx Gbl Sel.Div.100 SwapI"
Stuttgart,Mutual Fund,DXSC.STG,"Xtrackers - Stoxx Europe 600 Basic Resources Swap UCITS ETF"
Stuttgart,Mutual Fund,DXSD.STG,"Xtrackers - Stoxx Europe 600 Oil & Gas Swap UCITS ETF"
Stuttgart,Mutual Fund,DXSV.STG,"Xtr.II Eur.Gov.Bd Sh.Da.Swap In"
Stuttgart,Mutual Fund,DXWA.STG,"Candr.Bds-Candr.Bds Euro Div. I"
Stuttgart,Mutual Fund,DZ7J.STG,"DWS INTERNAT.RENTEN TYP O Inhab"
Stuttgart,Mutual Fund,ECBD.STG,"SI UCITS-UC TR Bal.Eu.C.B.U.E.N"
Stuttgart,Mutual Fund,EFQ8.STG,"Deka iB.EO Liq.Non-Fin.D.U.ETFI"
Stuttgart,Mutual Fund,EHDV.STG,"I.M.III-I.EO S.H.Div.L.Vo.UETFR"
Stuttgart,Mutual Fund,EHEN.STG,"ETFS Hedged Comm.Sec.Ltd. ZT12-"
Stuttgart,Mutual Fund,EHF1.STG,"AIS-Amundi MSCI EUROPE H.D.FA.N"
Stuttgart,Mutual Fund,EJP5.STG,"ETFS Foreign Exchange Ltd. Dt.Z"
Stuttgart,Mutual Fund,EL49.STG,"Deka iB.EO Liq.Corp.Div.U.ETF I"
Stuttgart,Mutual Fund,EL4C.STG,"Deka STOXX Eu.Str.Gr.20 U.ETF I"
Stuttgart,Mutual Fund,ELFA.STG,"Deka EURO STOX.50 (thes.)U.ETFI"
Stuttgart,Mutual Fund,ELFB.STG,"Deka Oekom Euro Nachhal.UC.ETFI"
Stuttgart,Mutual Fund,ELFC.STG,"Deka EURO iST.ex Fi.Div.+U.ETFI"
Stuttgart,Mutual Fund,ELFD.STG,"Deka Euroz.Rendi.Pl.1-10 U.ETFI"
Stuttgart,Mutual Fund,ERDD.STG,"BGF - Latin American Fund Act. "
Stuttgart,Mutual Fund,ERDN.STG,"BGF - World Energy Fund Act. No"
Stuttgart,Mutual Fund,ERDU.STG,"BGF - World Healthscience Fd Ac"
Stuttgart,Mutual Fund,ETBB.STG,"BNP P.E.FR-EURO STOXX 50 U.ETFA"
Stuttgart,Mutual Fund,ETDD.STG,"BNP P.E.FR-EURO STOXX 50 U.ETFA"
Stuttgart,Mutual Fund,ETL0.STG,"L&G-L&G LOIM EM L.G.Bd F.U.ETFR"
Stuttgart,Mutual Fund,ETL3.STG,"L&G-L&G LOIM Gl.Gov.Bd F.U.ETFR"
Stuttgart,Mutual Fund,ETL6.STG,"L&G-L&G LOIM Eur.Cor.Bd.F.UETFR"
Stuttgart,Mutual Fund,EUL3.STG,"ETFS Equity Securities Ltd. Dt."
Stuttgart,Mutual Fund,EUN0.STG,"iShs VI-E.MSCI Eur.Min.Vol.U.ER"
Stuttgart,Mutual Fund,EUNT.STG,"iShsIII-EO Corp Bd 1-5yr U.ETFR"
Stuttgart,Mutual Fund,EUPE.STG,"OSS.Shill.Barc.C.Eu.Sec.Val.TRI"
Stuttgart,Mutual Fund,EXH7.STG,"iSh.ST.Eu.600 Pe.&H.G.U.ETF DEI"
Stuttgart,Mutual Fund,EXHA.STG,"iSh.eb.r.Gover.Germ.U.ETF DE In"
Stuttgart,Mutual Fund,EXHB.STG,"iS.eb.r.Go.G.1.5-2.5y U.ETF DEI"
Stuttgart,Mutual Fund,EXHC.STG,"iS.eb.r.Go.G.2.5-5.5y U.ETF DEI"
Stuttgart,Mutual Fund,EXHD.STG,"iS.eb.r.G.G.5.5-10.5y U.ETF DEI"
Stuttgart,Mutual Fund,EXI5.STG,"iSh.ST.Eu.600 Real Es.U.ETF DEI"
Stuttgart,Mutual Fund,EXSA.STG,"iSh.STOXX Europe 600 U.ETF DE I"
Stuttgart,Mutual Fund,EXSB.STG,"iShares DivDAX UCITS ETF DE Inh"
Stuttgart,Mutual Fund,EXSC.STG,"iSh.ST.Euro.Large 200 U.ETF DEI"
Stuttgart,Mutual Fund,EXSD.STG,"iSh.ST.Europe Mid 200 U.ETF DEI"
Stuttgart,Mutual Fund,EXV4.STG,"iSh.ST.Eu.600 Healt.C.U.ETF DEI"
Stuttgart,Mutual Fund,EXW1.STG,"iShares EURO STOXX 50 (DE)"
Stuttgart,Mutual Fund,EXXW.STG,"iSh.DJ Asia Pa.S.D.30 U.ETF DEI"
Stuttgart,Mutual Fund,EZEX.STG,"I.M.-I.STOXX Euroz.Export.UETFR"
Stuttgart,Mutual Fund,EZT4.STG,"ODDO BHF AccuZins Inhaber-Antei"
Stuttgart,Mutual Fund,FBGA.STG,"F&C Fd-F&C HVB Stiftungsfonds A"
Stuttgart,Mutual Fund,FGKB.STG,"Magna Umb.Fd-Magna East.Europ.R"
Stuttgart,Mutual Fund,FGMD.STG,"DWS Global Value Inhaber-Anteil"
Stuttgart,Mutual Fund,FGUC.STG,"Ve-RI Equities Europe Inhaber-A"
Stuttgart,Mutual Fund,FGVB.STG,"Jan.Hend.-J.H.Continent.Europ.A"
Stuttgart,Mutual Fund,FGZA.STG,"UBS(L)Bd-Sh.Ter.EUR Corp.(EUR)I"
Stuttgart,Mutual Fund,FGZB.STG,"UBS(L)Bd-EUR Corporates (EUR) A"
Stuttgart,Mutual Fund,FH76.STG,"BNY MGF-BNY M.US Dyn.Value Fd R"
Stuttgart,Mutual Fund,FH7U.STG,"BNY MGF-BNY M.US Dyn.Value Fd R"
Stuttgart,Mutual Fund,FHDD.STG,"Amundi Austria Stock Inh.-Ant. "
Stuttgart,Mutual Fund,FHFA.STG,"AXA World Fds II-Europ.Opp.Eq.A"
Stuttgart,Mutual Fund,FHJC.STG,"UBS (Lux) BF-EO H. Yield [EUR]I"
Stuttgart,Mutual Fund,FHJD.STG,"UBS (Lux) BF-EO H. Yield [EUR]I"
Stuttgart,Mutual Fund,FHQC.STG,"Robeco High Yield Bonds Act. No"
Stuttgart,Mutual Fund,FHUA.STG,"LBBW Dividenden Strat.EurolandI"
Stuttgart,Mutual Fund,FHUJ.STG,"FVB-Deutscher Aktienfonds Inhab"
Stuttgart,Mutual Fund,FJ22.STG,"Fidelity Fds-International Fd.R"
Stuttgart,Mutual Fund,FJ2B.STG,"Fidelity Fds-Europ. Growth Fd.R"
Stuttgart,Mutual Fund,FJ2G.STG,"Fidelity Fds-Greater China Fd.R"
Stuttgart,Mutual Fund,FJ7A.STG,"Adviser I-Albrech&Cie Optisel.I"
Stuttgart,Mutual Fund,FJAA.STG,"UBS (LUX) MED.TERM BD FD - EURI"
Stuttgart,Mutual Fund,FJAB.STG,"UBS (LUX) MED.TERM BD FD - EURI"
Stuttgart,Mutual Fund,FJF0.STG,"C-QUADRAT ACTIVE ETF SelectionI"
Stuttgart,Mutual Fund,FJFA.STG,"ACC Alpha select AMI Inhaber-An"
Stuttgart,Mutual Fund,FJJ1.STG,"UniImmo: Global Inhaber-Anteile"
Stuttgart,Mutual Fund,FJJA.STG,"UniImmo: Deutschland Inhaber-An"
Stuttgart,Mutual Fund,FJJB.STG,"UniImmo: Europa Inhaber-Anteile"
Stuttgart,Mutual Fund,FJRA.STG,"Fidelity Fds-Thailand Fund Reg."
Stuttgart,Mutual Fund,FJRB.STG,"FIDELITY FDS-US DOLLAR BOND FDR"
Stuttgart,Mutual Fund,FJRD.STG,"Fidelity Fds-Eur.Larg.Cos.Fd. R"
Stuttgart,Mutual Fund,FJRP.STG,"Fidelity Funds SICAV-India Fo.B"
Stuttgart,Mutual Fund,FJRV.STG,"BGF-Japan Sm.&MidCap Opportun.A"
Stuttgart,Mutual Fund,FK4B.STG,"Jan.Hend.C.-J.H.Gbl Life Sc.FdR"
Stuttgart,Mutual Fund,FK8V.STG,"Deka Aktienfds RheinEdition oAI"
Stuttgart,Mutual Fund,FKND.STG,"DWS Con.DJE Alpha Rent.Global I"
Stuttgart,Mutual Fund,FLPC.STG,"BNPP L1-Equity Euro Inhaber-Ant"
Stuttgart,Mutual Fund,FMUA.STG,"MEAG EURORENT Inhaber-Anteile A"
Stuttgart,Mutual Fund,FMUC.STG,"MEAG ProInvest Inhaber-Anteile"
Stuttgart,Mutual Fund,FP7N.STG,"DWS Concept Kaldemorgen Inhaber"
Stuttgart,Mutual Fund,FP7P.STG,"DWS Concept Kaldemorgen Inhaber"
Stuttgart,Mutual Fund,FPGB.STG,"FIDELITY FDS-TAIWAN FUND Reg.Sh"
Stuttgart,Mutual Fund,FPGC.STG,"Fidelity Fds-Fi.Select.Int.Fd.R"
Stuttgart,Mutual Fund,FPJA.STG,"First Private Europa Akt. ULM I"
Stuttgart,Mutual Fund,FPJD.STG,"First Private Aktien Global Inh"
Stuttgart,Mutual Fund,FT94.STG,"Fr.Temp.Inv.Fds-T.Asian Sm.CosN"
Stuttgart,Mutual Fund,FT9M.STG,"Fr.Temp.Inv.Fds -T.Gl.Bd Fd Nam"
Stuttgart,Mutual Fund,FT9N.STG,"Fr.Temp.Inv.Fds-T.Gl.Tot.Ret. N"
Stuttgart,Mutual Fund,FUSA.STG,"Fidelity US Quality Income ETFR"
Stuttgart,Mutual Fund,FUSD.STG,"Fidelity US Quality Income ETFR"
Stuttgart,Mutual Fund,FVUI.STG,"Franklin Liberty USD IG CB ETFR"
Stuttgart,Mutual Fund,G2XJ.STG,"V.E.Vect.Junior Gold Min.U.ETFR"
Stuttgart,Mutual Fund,G4MA.STG,"Gamax Fds-Asia Pacific Inhaber-"
Stuttgart,Mutual Fund,GGV.STG,"BARING GERMAN GROWTH TRUST Reg."
Stuttgart,Mutual Fund,GGVA.STG,"BARING EUROPE SELECT TRUST Reg."
Stuttgart,Mutual Fund,GGW.STG,"Sauren Global Growth Inhaber-An"
Stuttgart,Mutual Fund,GGWC.STG,"Sauren Global Defensiv Inhaber-"
Stuttgart,Mutual Fund,GGWD.STG,"Sauren Emerg.Markets Balanced I"
Stuttgart,Mutual Fund,GH5A.STG,"Generali Geldmarkt Euro Inhaber"
Stuttgart,Mutual Fund,GIQB.STG,"Mori Umb.Fd-Mori East.EuropeanR"
Stuttgart,Mutual Fund,GLXB.STG,"GL.ADV.FDS-M.M.HIGH V.T. Action"
Stuttgart,Mutual Fund,GLXC.STG,"Gl.Adv.Fds-Emerg.Mkts High V. A"
Stuttgart,Mutual Fund,GMVM.STG,"V.E.Vect.Morn.USWide Moat U.E.R"
Stuttgart,Mutual Fund,GMXB.STG,"Falcon Gold Equity Fund"
Stuttgart,Mutual Fund,GOLD.STG,"EUWAX Gold ETC"
Stuttgart,Mutual Fund,GQC.STG,"F&C Ptfs Fd-F&C Japanese Equ. A"
Stuttgart,Mutual Fund,GQCC.STG,"BMO(LU)I-BMO European Equity Ac"
Stuttgart,Mutual Fund,GQEA.STG,"Lazard European HighYield Inhab"
Stuttgart,Mutual Fund,GQGC.STG,"Swiss Life Fds (L)-Equity EuroA"
Stuttgart,Mutual Fund,GQHC.STG,"NESTOR-Fds-NESTOR Europa FondsI"
Stuttgart,Mutual Fund,GQHH.STG,"NESTOR-Fonds-NESTOR Gold FondsI"
Stuttgart,Mutual Fund,GQKA.STG,"GAM Multicash-Money Market EO A"
Stuttgart,Mutual Fund,GSDE.STG,"BNP P.Easy-Energy&Met.Enh.RollN"
Stuttgart,Mutual Fund,GSW4.STG,"G.SACHS FDS-GS EUR.CORE EQU.P.R"
Stuttgart,Mutual Fund,GSWK.STG,"G.SACHS FDS-GS US CORE EQ.PTF R"
Stuttgart,Mutual Fund,GZUR.STG,"ETFS Physical Swiss Gold ETC"
Stuttgart,Mutual Fund,H2SF.STG,"VCH Expert Natural Resources In"
Stuttgart,Mutual Fund,H410.STG,"HSBC MSCI Em.Markts. UCITS ETFB"
Stuttgart,Mutual Fund,H411.STG,"HSBC MSCI AC F.E.ex JAP.UC.ETFB"
Stuttgart,Mutual Fund,H4ZH.STG,"HSBC MSCI PAC. ex JP UCITS ETFB"
Stuttgart,Mutual Fund,H4ZI.STG,"HSBC MSCI EM FAR EAST UC. ETF B"
Stuttgart,Mutual Fund,H4ZS.STG,"HSBC MSCI MEX.CAPPED UCITS ETFB"
Stuttgart,Mutual Fund,H4ZW.STG,"HSBC MSCI EM LAT.AM. UCITS ETFB"
Stuttgart,Mutual Fund,HDLV.STG,"I.M.III-I.S&P 500 H.D.L.V.UETFR"
Stuttgart,Mutual Fund,HJUB.STG,"DWS Telemedia Typ O Inhaber-Ant"
Stuttgart,Mutual Fund,HJUD.STG,"DWS Top World Inhaber-Anteile"
Stuttgart,Mutual Fund,HJVC.STG,"Allianz Adifonds Inhaber-Anteil"
Stuttgart,Mutual Fund,HJVD.STG,"Fondak Inhaber-Anteile A"
Stuttgart,Mutual Fund,HLXA.STG,"HELLERICH Sachwertaktien Inhabe"
Stuttgart,Mutual Fund,HVJ9.STG,"DWS Concept Kaldemorgen Inhaber"
Stuttgart,Mutual Fund,HVJD.STG,"ARERO - Der Weltfonds Inhaber-A"
Stuttgart,Mutual Fund,HVJZ.STG,"DWS Inv.-New Resources Inhaber-"
Stuttgart,Mutual Fund,HVLQ.STG,"Amundi Total Return Inhaber-Ant"
Stuttgart,Mutual Fund,HZBA.STG,"KanAM US-grundinvest Fonds Inha"
Stuttgart,Mutual Fund,HZBB.STG,"KANAM GRUNDINVEST FONDS Inhaber"
Stuttgart,Mutual Fund,IBCG.STG,"iShsV-MSCI Jap.EUR Hdg U-ETF AR"
Stuttgart,Mutual Fund,IBCH.STG,"iShsV-MSCI W.EUR Hgd U.ETF AccR"
Stuttgart,Mutual Fund,IBCQ.STG,"iShsVI-Gl.CorpBd EO H.U.ETF D R"
Stuttgart,Mutual Fund,IBCZ.STG,"iShsIV-Edge MSCI Wo.Mult.U.ETFR"
Stuttgart,Mutual Fund,IFUA.STG,"LBBW BALANCE CR75 Inhaber-Antei"
Stuttgart,Mutual Fund,IFUB.STG,"LBBW BALANCE CR40 Inhaber-Antei"
Stuttgart,Mutual Fund,IM2A.STG,"BNP P.Easy-FTSE E.-N.Euro.Cap.N"
Stuttgart,Mutual Fund,IPGD.STG,"Fidelity Fds-Japan Sm.Cos.Fd. R"
Stuttgart,Mutual Fund,IQQB.STG,"iShs MSCI Brazil U.ETF USD(D) R"
Stuttgart,Mutual Fund,IQQC.STG,"iShares China Large Cap ETF USD Dist"
Stuttgart,Mutual Fund,IQQD.STG,"iShs-UK Dividend UCITS ETF Regi"
Stuttgart,Mutual Fund,IQQF.STG,"iShs MSCI AC F.East.xJap.U.ETFR"
Stuttgart,Mutual Fund,IQQK.STG,"iShs-MSCI Korea U.ETF USD (D) R"
Stuttgart,Mutual Fund,IS05.STG,"iShsIV-EO Go.Bd 20yr T.D.U.ETFR"
Stuttgart,Mutual Fund,IUGA.STG,"Invesco Pan European Equity FdA"
Stuttgart,Mutual Fund,IUGB.STG,"Invesco Pan European Small CapA"
Stuttgart,Mutual Fund,IUGF.STG,"Inv.Fds-Inv.Eur.Ultr.Sh.T.DebtA"
Stuttgart,Mutual Fund,IUGH.STG,"Invesco Greater China Equity Ac"
Stuttgart,Mutual Fund,IUGX.STG,"Invesco Fds-Inv.India Eq. Fd Ac"
Stuttgart,Mutual Fund,IUGZ.STG,"Invesco Fds-Euro Corporate Bd A"
Stuttgart,Mutual Fund,IUKC.STG,"HSBC Sector Rotation Inhaber-An"
Stuttgart,Mutual Fund,IUP1.STG,"UBS(Lux)Money Market Inv.-EUR I"
Stuttgart,Mutual Fund,IUS9.STG,"iShsII-MSCI AC FE exJ.SC U.ETFR"
Stuttgart,Mutual Fund,IUSA.STG,"iShares S&P 500 ETF USD Dist"
Stuttgart,Mutual Fund,IUSB.STG,"iShsII-G.Timber&Forestry U.ETFR"
Stuttgart,Mutual Fund,IUSC.STG,"iShsII-MSCI EM Lat.Am.U.ETF Reg"
Stuttgart,Mutual Fund,IUSD.STG,"iShsII-MSCI Wld Islamic U.ETF R"
Stuttgart,Mutual Fund,IWMB.STG,"AXA Renten Euro Inhaber-Anteile"
Stuttgart,Mutual Fund,IWT1.STG,"ESPA RESERVE EURO PLUS Inh.-Ant"
Stuttgart,Mutual Fund,IWT6.STG,"ESPA STOCK ISTANBUL Inh.-Ant.EU"
Stuttgart,Mutual Fund,IWTA.STG,"Erste Bond Emerging Markets Inh"
Stuttgart,Mutual Fund,IWTC.STG,"ESPA STOCK EUROPE EMERGING Inh."
Stuttgart,Mutual Fund,IWTD.STG,"ESPA STOCK BIOTEC Inh.-Ant.EUR "
Stuttgart,Mutual Fund,JEXE.STG,"I.M.-I.STOXX Japan Export.UETFR"
Stuttgart,Mutual Fund,JHSA.STG,"HSBC GIF-European Equity Namens"
Stuttgart,Mutual Fund,JHSB.STG,"HSBC GIF-Chinese Equity Namens-"
Stuttgart,Mutual Fund,JHSD.STG,"HSBC GIF-European Equity Namens"
Stuttgart,Mutual Fund,JI9C.STG,"GAM Multistock-Euroland Va.Eq.A"
Stuttgart,Mutual Fund,JI9D.STG,"GAM Multistock-Euroland Va.Eq.A"
Stuttgart,Mutual Fund,JPJA.STG,"JPMorgan-America Equity Fund A."
Stuttgart,Mutual Fund,JPJC.STG,"JPMorgan-Europe Dynamic Fund A."
Stuttgart,Mutual Fund,JPJQ.STG,"JPMorgan-Emerging Europe Eq.FdA"
Stuttgart,Mutual Fund,JPPS.STG,"JPM ICAV-DL Ultra-Sh.Inc.U.ETFR"
Stuttgart,Mutual Fund,JSGB.STG,"HSBC GIF-Asia ex Japan Equity N"
Stuttgart,Mutual Fund,JYJ0.STG,"JPMorgan Funds - Emerging Markets Small Cap Fund"
Stuttgart,Mutual Fund,JYJA.STG,"JPMorgan-Europe Strategic GwthA"
Stuttgart,Mutual Fund,JYJR.STG,"JPMorgan-Global Focus Fund Acti"
Stuttgart,Mutual Fund,JYK2.STG,"IJII-Jyske Inv.Stabl.Strat.CL B"
Stuttgart,Mutual Fund,LCUK.STG,"Lx.IF-L.Co.Morn.UK NT (DR)U.E.A"
Stuttgart,Mutual Fund,LCVB.STG,"Lyx.IF-Lyx.EuroMTS C.Bd Ag.U.EA"
Stuttgart,Mutual Fund,LDCE.STG,"PFIS ETF-P.L.D.EO C.Bd S.U.ETFR"
Stuttgart,Mutual Fund,LEUB.STG,"ETFS Foreign Exchange Ltd. Dt.Z"
Stuttgart,Mutual Fund,LGWU.STG,"Lyxor IF-L.MSCI EMU SC(DR)U.E.A"
Stuttgart,Mutual Fund,LHAD.STG,"Deutsche Lufthansa Aktiengesellschaft"
Stuttgart,Mutual Fund,LHZ1.STG,"Lazard Gl.Act.Fds-Laz.Eur.Eq. R"
Stuttgart,Mutual Fund,LLX.STG,"LiLux Convert Inhaber-Anteile o"
Stuttgart,Mutual Fund,LLXA.STG,"Swiss Rock Sicav"
Stuttgart,Mutual Fund,LLXB.STG,"Swiss Rock Sicav"
Stuttgart,Mutual Fund,LLXC.STG,"Swiss Rock Sicav"
Stuttgart,Mutual Fund,LM53.STG,"LMGF-LM QSMV As.P.e.J.E.G.a.I.N"
Stuttgart,Mutual Fund,LMWE.STG,"L. I. Fd - L. F. E.-N. Gl. D.Ac"
Stuttgart,Mutual Fund,LNOE.STG,"ETFS Long NOK Short EUR"
Stuttgart,Mutual Fund,LOH3.STG,"LO Fds-World Gold Expertise FdN"
Stuttgart,Mutual Fund,LPJD.STG,"Lupus alpha Fds-Sma.German Ch.I"
Stuttgart,Mutual Fund,LSK7.STG,"Lyx.EURO STXX50 D.(-1x)I.U.ETFA"
Stuttgart,Mutual Fund,LWCR.STG,"AIS-Amundi Id.Eq.Glo.Low Carb.A"
Stuttgart,Mutual Fund,LXAP.STG,"All.GI Fd.III-All.Emerg.EuropeI"
Stuttgart,Mutual Fund,LXF6.STG,"ko-Aktienfonds Actions au Porte"
Stuttgart,Mutual Fund,LXFA.STG,"LOYS - LOYS Global Inhaber-Ante"
Stuttgart,Mutual Fund,LYEB.STG,"Mu.Un.L.-Lyx.EO Corp.Bd UC.ETFN"
Stuttgart,Mutual Fund,LYEU.STG,"L. I. Fd - L. F. E.-N. US Act. "
Stuttgart,Mutual Fund,LYM7.STG,"Lyxor MSCI Emerging Mkts U.ETFA"
Stuttgart,Mutual Fund,LYMA.STG,"Lyx.STOXX Eu.600 Fin.Ser.U.ETFA"
Stuttgart,Mutual Fund,LYMB.STG,"Lyxor ETF ST.Eur.600 Oil & GasA"
Stuttgart,Mutual Fund,LYMC.STG,"Lyxor MSCI Korea UCITS ETF Acti"
Stuttgart,Mutual Fund,LYMD.STG,"Lyxor MSCI India UCITS ETF Acti"
Stuttgart,Mutual Fund,LYMG.STG,"Lyxor MSCI Brazil UCITS ETF Act"
Stuttgart,Mutual Fund,LYPA.STG,"MUL-LYX.MSCI W.Con.Dis.UC.ETF I"
Stuttgart,Mutual Fund,LYPB.STG,"MUL-LYX.MSCI W.Con.St.TR U.ETFI"
Stuttgart,Mutual Fund,LYPC.STG,"MUL-LYX.MSCI Wd.Ener.TR UC.ETFI"
Stuttgart,Mutual Fund,LYPD.STG,"MUL-LYX.MSCI Wd.Fin.TR UC.ETF I"
Stuttgart,Mutual Fund,LYPG.STG,"MUL-LYX.MSCI Wd.IN.T.TR UC.ETFI"
Stuttgart,Mutual Fund,LYPH.STG,"MUL-LYX.MSCI Wd.Mats TR UC.ETFI"
Stuttgart,Mutual Fund,LYPI.STG,"MUL-LYX.MSCI W.Com.Ser.TR UETFI"
Stuttgart,Mutual Fund,LYPP.STG,"Lyx.FTSE EPRA-NAREIT G.D.U.ETFA"
Stuttgart,Mutual Fund,LYQD.STG,"Lyxor MSCI Taiwan UCITS ETF Act"
Stuttgart,Mutual Fund,LYQS.STG,"L. I. Fd - L. I. DL Li. EM S.Ac"
Stuttgart,Mutual Fund,LYSX.STG,"LYXOR EURO ST.50 (DR)UCITS ETFA"
Stuttgart,Mutual Fund,LYSZ.STG,"Lyxor MSCI Indonesia UCITS ETFA"
Stuttgart,Mutual Fund,LYXA.STG,"MUL-LYX.EuroMTS H.R.M.-W.G.B. I"
Stuttgart,Mutual Fund,LYXC.STG,"MUL-LYX.EuroMTS 5-7Y Inv.GradeI"
Stuttgart,Mutual Fund,LYY0.STG,"MUL-Lyx.MSCI All C.Worl.UC.ETFN"
Stuttgart,Mutual Fund,LYY5.STG,"Lyxor MSCI Europe(DR)UCITS ETFA"
Stuttgart,Mutual Fund,LYYA.STG,"Lyxor MSCI World UCITS ETF Acti"
Stuttgart,Mutual Fund,LYYC.STG,"Lyxor MSCI AC As.Pa.x Ja.U.ETFA"
Stuttgart,Mutual Fund,LYYH.STG,"Lyxor C.TR-C.CRB E.-E.TR U.ETFA"
Stuttgart,Mutual Fund,M9SD.STG,"M.A.-NYSE Ar.Gold Bgs In.U.ETFI"
Stuttgart,Mutual Fund,MI97.STG,"BGF - World Mining Fund Act. No"
Stuttgart,Mutual Fund,MI98.STG,"BGF-Japan Sm.&MidCap Opportun.A"
Stuttgart,Mutual Fund,MIVA.STG,"AIS-Amundi MSCI EUROPE M.V.FA.N"
Stuttgart,Mutual Fund,MSJA.STG,"Mor.St.Inv.-Euro Strategic Bd A"
Stuttgart,Mutual Fund,MSJD.STG,"MS Invt Fds-Global Brands Actio"
Stuttgart,Mutual Fund,MSJJ.STG,"Mor.St.Inv.-Eur.Curr.High Y.BdA"
Stuttgart,Mutual Fund,MZRA.STG,"M&G Corporate Bond Fund Reg. Ac"
Stuttgart,Mutual Fund,MZRD.STG,"M&G Europ.High Yield Bond FundR"
Stuttgart,Mutual Fund,NDJB.STG,"Nordea 1-North Am.Value Fund Ac"
Stuttgart,Mutual Fund,NDJG.STG,"Nordea 1-Asian Focus Equity FdA"
Stuttgart,Mutual Fund,NGXL.STG,"Boost Issuer PLC ETP 05.12.62 3"
Stuttgart,Mutual Fund,NGXS.STG,"Boost Issuer PLC NatGas 3xSh.ET"
Stuttgart,Mutual Fund,NK4L.STG,"M.U.L.-Lyx.B.Fl.R.EO 0-7Y U.E.N"
Stuttgart,Mutual Fund,NLUD.STG,"M & W Privat FCP Inhaber-Anteil"
Stuttgart,Mutual Fund,NLUE.STG,"LBBW Equity Select Inhaber-Ante"
Stuttgart,Mutual Fund,NQ65.STG,"Amundi Discount Balanced Inhabe"
Stuttgart,Mutual Fund,OESA.STG,"ETFS Oil Securities Ltd. DT.ZT0"
Stuttgart,Mutual Fund,OESB.STG,"ETFS Oil Securities Ltd. DT.ZT0"
Stuttgart,Mutual Fund,OG7U.STG,"ARIDEKA Inhaber-Anteile CF"
Stuttgart,Mutual Fund,OG8C.STG,"BL-Corporate Bd Opportunities I"
Stuttgart,Mutual Fund,OG8D.STG,"BL-Corporate Bd Opportunities I"
Stuttgart,Mutual Fund,OG8Q.STG,"BL - BL-Equities Dividend Inhab"
Stuttgart,Mutual Fund,OOEA.STG,"ETFS Commodity Securities Ltd.D"
Stuttgart,Mutual Fund,OOEB.STG,"ETFS Commodity Securities Ltd.D"
Stuttgart,Mutual Fund,OOEC.STG,"ETFS Commodity Securities Ltd.D"
Stuttgart,Mutual Fund,OSX2.STG,"OSS.US Min.Var.ESG NRUCIT.ETF I"
Stuttgart,Mutual Fund,OSXA.STG,"OSSIAM World Min. Variance NR I"
Stuttgart,Mutual Fund,OSXM.STG,"OSS.Gl.Multi-Ass. Risk-ControlN"
Stuttgart,Mutual Fund,OXM0.STG,"DWS Qi Eurozone Equity Inhaber-"
Stuttgart,Mutual Fund,OXMC.STG,"DWS Concept GS&P Food Inhaber-A"
Stuttgart,Mutual Fund,OZWA.STG,"Multipartner-RobecoS.Su.Wat.FdA"
Stuttgart,Mutual Fund,P6Q1.STG,"JSS M.L.-New Energy Fd EO Namen"
Stuttgart,Mutual Fund,PBFA.STG,"Pictet - Small Cap Europe Namen"
Stuttgart,Mutual Fund,PBFC.STG,"Pictet-European Sustain.Equit.N"
Stuttgart,Mutual Fund,PCFC.STG,"Boost Issuer PLC EOSTXX 3xSh.ET"
Stuttgart,Mutual Fund,PCFD.STG,"Boost Issuer PLC EOSTXX 3xLev.E"
Stuttgart,Mutual Fund,PIMA.STG,"Pictet-EUR Short-Mid Term Bds N"
Stuttgart,Mutual Fund,PIMB.STG,"Pictet-EUR Short-Mid Term Bds N"
Stuttgart,Mutual Fund,PJAA.STG,"Pictet-Global Emerging Debt Nam"
Stuttgart,Mutual Fund,PJAB.STG,"Pictet-Emerg.Local Curr.Debt Na"
Stuttgart,Mutual Fund,PJAC.STG,"Pictet-Emerg.Local Curr.Debt Na"
Stuttgart,Mutual Fund,PJAD.STG,"Pictet-Euroland Index Namens-An"
Stuttgart,Mutual Fund,PJEU.STG,"I.M.III-I.EuroMTS Ca.3 Mo.UETFR"
Stuttgart,Mutual Fund,PPFB.STG,"iShares Physical Metals PLC OPE"
Stuttgart,Mutual Fund,PPFC.STG,"iShares Physical Metals PLC OPE"
Stuttgart,Mutual Fund,PPFD.STG,"iShares Physical Metals PLC OPE"
Stuttgart,Mutual Fund,PSWD.STG,"I.M.III-I.FTSE R.A.W.3000 UETFR"
Stuttgart,Mutual Fund,QDVA.STG,"iShsIV-Edge MSCI USA M.F.U.ETFR"
Stuttgart,Mutual Fund,QDVB.STG,"iShsIV-Edge MSCI USA Q.F.U.ETFR"
Stuttgart,Mutual Fund,QDVC.STG,"iShsIV-Edge MSCI USA S.F.U.ETFR"
Stuttgart,Mutual Fund,QDVD.STG,"iShsII-iShs MSCI USA Q.D.U.ETFR"
Stuttgart,Mutual Fund,QDVG.STG,"iShsV-S&P 500 He.Ca.Sec.U.ETF R"
Stuttgart,Mutual Fund,RIXD.STG,"MB Fund - Max Value Inhaber-Ant"
Stuttgart,Mutual Fund,RKCA.STG,"Raiffeisen-Nachhaltigkeit-Akt.I"
Stuttgart,Mutual Fund,RKCB.STG,"Raiffeisen-Energie-Aktien (R) I"
Stuttgart,Mutual Fund,RKCC.STG,"Raiffeisen-EmergingMarkets-Re.I"
Stuttgart,Mutual Fund,RQFI.STG,"Xtrackers Harvest CSI300 Inhabe"
Stuttgart,Mutual Fund,SBDA.STG,"UBS (Lux) Money Market Fd-AUD I"
Stuttgart,Mutual Fund,SBQ4.STG,"StarCapital FCP - Priamos Inhab"
Stuttgart,Mutual Fund,SC0D.STG,"I.M.-I.EURO STOXX 50 UETF Regis"
