region,type,symbol,name
United States,ETF,IGIB,"iShares Intermediate-Term Corp Bd ETF"
United States,ETF,IGIH,"Xtrackers Inv Grd Bd Intst Rt Hdg ETF"
United States,ETF,IGLB,"iShares Long-Term Corporate Bond ETF"
United States,ETF,IGM,"iShares North American Tech ETF"
United States,ETF,IGN,"iShares North Amer Tech-Multimd Ntwk ETF"
United States,ETF,IGOV,"iShares International Treasury Bond ETF"
United States,ETF,IGRO,"iShares International Dividend Gr ETF"
United States,ETF,IGV,"iShares North American Tech-Software ETF"
United States,ETF,IGVT,"Xtrackers Barclays Intl Trs Bd Hdg ETF"
United States,ETF,IHE,"iShares US Pharmaceuticals ETF"
United States,ETF,IHF,"iShares US Healthcare Providers ETF"
United States,ETF,IHI,"iShares US Medical Devices ETF"
United States,ETF,IHRMF,"iShares Public Limited Company - iShares MSCI Japan UCITS ETF USD (Dist)"
United States,ETF,IHSFF,"iShares II Public Limited Company - iShares $ TIPS UCITS ETF"
United States,ETF,IHYD,"Invesco Corporate Income Defensive ETF"
United States,ETF,IIGD,"Invesco Investment Grade Defensive ETF"
United States,ETF,IJH,"iShares Core S&P Mid-Cap ETF"
United States,ETF,IJJ,"iShares S&P Mid-Cap 400 Value ETF"
United States,ETF,IJK,"iShares S&P Mid-Cap 400 Growth ETF"
United States,ETF,IJR,"iShares Core S&P Small-Cap ETF"
United States,ETF,IJS,"iShares S&P Small-Cap 600 Value ETF"
United States,ETF,IJT,"iShares S&P Small-Cap 600 Growth ETF"
United States,ETF,ILF,"iShares Latin America 40 ETF"
United States,ETF,ILTB,"iShares Core 10+ Year USD Bond ETF"
United States,ETF,IMFC,"Invesco Multi-Factor Core Fixed Inc ETF"
United States,ETF,IMFD,"Invesco Multi-Fac Defesv Cor Fxd Inc ETF"
United States,ETF,IMFI,"Invesco Multi-Factor Income ETF"
United States,ETF,IMFP,"Invesco Multi-Factor Cor Pls fxd Inc ETF"
United States,ETF,IMLP,"iPath S&P MLP ETN"
United States,ETF,IMTB,"iShares Core 5-10 Year USD Bond ETF"
United States,ETF,IMTM,"iShares Edge MSCI Intl Momentum Fctr ETF"
United States,ETF,INDA,"iShares MSCI India ETF"
United States,ETF,INDS,"Pacer Benchmark Industrial RE SCTR ETF"
United States,ETF,INKM,"SPDR SSgA Income Allocation ETF"
United States,ETF,INR,"Market Vectors Indian Rupee-USD ETN"
United States,ETF,INXX,"Columbia India Infrastructure ETF"
United States,ETF,IOO,"iShares Global 100 ETF"
United States,ETF,IPAC,"iShares Core MSCI Pacific ETF"
United States,ETF,IPAY,"ETFMG Prime Mobile Payments ETF"
United States,ETF,IPB,"Merrill Lynch Depositor Inc. 6.0518% Index Plus Trust Series 2003-1"
United States,ETF,IPE,"SPDR Blmbg Barclays TIPS ETF"
United States,ETF,IPFF,"iShares International Preferred Stk ETF"
United States,ETF,IPKW,"Invesco Intl BuyBack Achiev ETF"
United States,ETF,IPO,"Renaissance IPO ETF"
United States,ETF,IPOS,"Renaissance International IPO ETF"
United States,ETF,IQDF,"FlexShares Intl Qual Dividend ETF"
United States,ETF,IQLT,"iShares Edge MSCI Intl Quality Fctr ETF"
United States,ETF,IRBO,"iShares Robotics and Artfcl Intlgc ETF"
United States,ETF,ISCF,"iShares Edge MSCI Mltfct Intl SmCp ETF"
United States,ETF,ISHG,"iShares 1-3 Year International TrsBd ETF"
United States,ETF,ISMD,"Inspire Small-Mid Cap Impact ETF"
United States,ETF,ISRA,"VanEck Vectors Israel ETF"
United States,ETF,ISTB,"iShares Core 1-5 Year USD Bond ETF"
United States,ETF,ISZE,"iShares Edge MSCI Intl Size Factor ETF"
United States,ETF,ITA,"iShares US Aerospace & Defense ETF"
United States,ETF,ITB,"iShares US Home Construction ETF"
United States,ETF,ITE,"SPDR Blmbg Barclays Interm Term Trs ETF"
United States,ETF,ITEQ,"BlueStar Israel Technology ETF"
United States,ETF,ITM,"VanEck Vectors AMT-Free Interm Muni ETF"
United States,ETF,ITOT,"iShares Core S&P Total US Stock Market ETF"
United States,ETF,IUSB,"iShares Core Total USD Bond Market ETF"
United States,ETF,IUSG,"iShares Core S&P US Growth ETF"
United States,ETF,IUSV,"iShares Core S&P US Value ETF"
United States,ETF,IUTCF,"iShares S&P-TSX Global Gold Index ETF"
United States,ETF,IUTSF,"iShares S&P-TSX 60 Index ETF"
United States,ETF,IVAL,"Alpha Architect Intl Quant Val ETF"
United States,ETF,IVE,"iShares S&P 500 Value ETF"
United States,ETF,IVLU,"iShares Edge MSCI Intl Value Factor ETF"
United States,ETF,IVV,"iShares Core S&P 500 ETF"
United States,ETF,IVW,"iShares S&P 500 Growth ETF"
United States,ETF,IWB,"iShares Russell 1000 ETF"
United States,ETF,IWC,"iShares Micro-Cap ETF"
United States,ETF,IWD,"iShares Russell 1000 Value ETF"
United States,ETF,IWF,"iShares Russell 1000 Growth ETF"
United States,ETF,IWL,"iShares Russell Top 200 ETF"
United States,ETF,IWM,"iShares Russell 2000 ETF"
United States,ETF,IWN,"iShares Russell 2000 Value ETF"
United States,ETF,IWO,"iShares Russell 2000 Growth ETF"
United States,ETF,IWP,"iShares Russell Mid-Cap Growth ETF"
United States,ETF,IWR,"iShares Russell Mid-Cap ETF"
United States,ETF,IWS,"iShares Russell Mid-Cap Value ETF"
United States,ETF,IWV,"iShares Russell 3000 ETF"
United States,ETF,IWX,"iShares Russell Top 200 Value ETF"
United States,ETF,IWY,"iShares Russell Top 200 Growth ETF"
United States,ETF,IXC,"iShares Global Energy ETF"
United States,ETF,IXG,"iShares Global Financials ETF"
United States,ETF,IXJ,"iShares Global Healthcare ETF"
United States,ETF,IXN,"iShares Global Tech ETF"
United States,ETF,IXP,"iShares Global Comm Services ETF"
United States,ETF,IXUS,"iShares Core MSCI Total Intl Stk ETF"
United States,ETF,IYC,"iShares US Consumer Services ETF"
United States,ETF,IYE,"iShares US Energy ETF"
United States,ETF,IYF,"iShares US Financials ETF"
United States,ETF,IYG,"iShares US Financial Services ETF"
United States,ETF,IYH,"iShares US Healthcare ETF"
United States,ETF,IYJ,"iShares US Industrials ETF"
United States,ETF,IYK,"iShares US Consumer Goods ETF"
United States,ETF,IYLD,"iShares Morningstar Multi-Asset Inc ETF"
United States,ETF,IYM,"iShares US Basic Materials ETF"
United States,ETF,IYR,"iShares US Real Estate ETF"
United States,ETF,IYT,"iShares Transportation Average ETF"
United States,ETF,IYW,"iShares US Technology ETF"
United States,ETF,IYY,"iShares Dow Jones US ETF"
United States,ETF,IYZ,"iShares US Telecommunications ETF"
United States,ETF,IZRL,"ARK Israeli Innovation ETF Hdg"
United States,ETF,JBRI,"James Biblically Responsible Inv ETF"
United States,ETF,JDIV,"JPMorgan US Dividend ETF"
United States,ETF,JDST,"Direxion Daily Jr Gld Mnrs Bear 3X ETF"
United States,ETF,JETS,"US Global Jets ETF"
United States,ETF,JHEM,"John Hancock Multifactor Em Mkts ETF"
United States,ETF,JHMA,"JHancock Multifactor Materials ETF"
United States,ETF,JHMC,"JHancock Multifactor Cnsmr Discret ETF"
United States,ETF,JHMD,"JHancock Multifactor Developed Intl ETF"
United States,ETF,JHME,"JHancock Multifactor Energy ETF"
United States,ETF,JHMF,"JHancock Multifactor Financials ETF"
United States,ETF,JHMH,"JHancock Multifactor Health Care ETF"
United States,ETF,JHML,"JHancock Multifactor Large Cap ETF"
United States,ETF,JHMM,"JHancock Multifactor Mid Cap ETF"
United States,ETF,JHMS,"JHancock Multifactor Consumer Stapl ETF"
United States,ETF,JHMT,"JHancock Multifactor Technology ETF"
United States,ETF,JHMU,"JHancock Multifactor Utilities ETF"
United States,ETF,JHSC,"JHancock Multifactor Small Cap ETF"
United States,ETF,JIGB,"JPMorgan Corporate Bond Research Enh ETF"
United States,ETF,JJA,"iPath B Bloomberg Agltr Ttl Ret ETN"
United States,ETF,JJAB,"iPath B Bloomberg Agltr Ttl Ret ETN"
United States,ETF,JJC,"iPath B Bloomberg Copper Ttl Ret ETN"
United States,ETF,JJCB,"iPath B Bloomberg Copper Ttl Ret ETN"
United States,ETF,JJEB,"iPath B Bloomberg Engy Ttl Ret ETN"
United States,ETF,JJG,"iPath B Bloomberg Grains Ttl Ret ETN"
United States,ETF,JJGB,"iPath B Bloomberg Grains Ttl Ret ETN"
United States,ETF,JJM,"iPath B Bloomberg Indl Mtls Ttl Ret ETN"
United States,ETF,JJMB,"iPath B Bloomberg Indl Mtls Ttl Ret ETN"
United States,ETF,JJN,"iPath B Bloomberg Nickel Ttl Ret ETN"
United States,ETF,JJP,"iPath B Bloomberg Prec Mtls Ttl Ret ETN"
United States,ETF,JJPB,"iPath B Bloomberg Prec Mtls Ttl Ret ETN"
United States,ETF,JJS,"iPath B Bloomberg Softs Ttl Ret ETN"
United States,ETF,JJSB,"iPath B Bloomberg Softs Ttl Ret ETN"
United States,ETF,JJT,"iPath B Bloomberg Tin Ttl Ret ETN"
United States,ETF,JJTB,"iPath B Bloomberg Tin Ttl Ret ETN"
United States,ETF,JJU,"iPath B Bloomberg Aluminum Ttl Ret ETN"
United States,ETF,JJUB,"iPath B Bloomberg Aluminum Ttl Ret ETN"
United States,ETF,JKD,"iShares Morningstar Large-Cap ETF"
United States,ETF,JKE,"iShares Morningstar Large-Cap Growth ETF"
United States,ETF,JKF,"iShares Morningstar Large-Cap Value ETF"
United States,ETF,JKG,"iShares Morningstar Mid-Cap ETF"
United States,ETF,JKH,"iShares Morningstar Mid-Cap Growth ETF"
United States,ETF,JKI,"iShares Morningstar Mid-Cap Value ETF"
United States,ETF,JKJ,"iShares Morningstar Small-Cap ETF"
United States,ETF,JKK,"iShares Morningstar Small-Cap Growth ETF"
United States,ETF,JMBS,"Janus Henderson Mortgage-Backed Sec ETF"
United States,ETF,JMOM,"JPMorgan US Momentum Factor ETF"
United States,ETF,JMST,"JPMorgan Ultra-Short Municipal ETF"
United States,ETF,JMUB,"JPMorgan Municipal ETF"
United States,ETF,JNK,"SPDR Blmbg Barclays High Yield Bd ETF"
United States,ETF,JNUG,"Direxion Daily Jr Gld Mnrs Bull 3X ETF"
United States,ETF,JO,"iPath B Bloomberg Coffee Ttl Ret ETN"
United States,ETF,JPBI,"James Purpose Based Inv ETF"
United States,ETF,JPED,"JPMorgan Event Driven ETF"
United States,ETF,JPEH,"JPMorgan Divers Ret Eurp Ccy Hdgd ETF"
United States,ETF,JPEM,"JPMorgan Diversified Return EMkts Eq ETF"
United States,ETF,JPEU,"JPMorgan Diversified Return Eurp Eq ETF"
United States,ETF,JPGB,"JPMorgan Global Bond Opportunities ETF"
United States,ETF,JPGE,"JPMorgan Diversified Return Glbl Eq ETF"
United States,ETF,JPHF,"JPMorgan Diversified Alternative ETF"
United States,ETF,JPHY,"JPMorgan Disciplined High Yield ETF"
United States,ETF,JPLS,"JPMorgan Long-Short ETF"
United States,ETF,JPMB,"JPMorgan USD Emerging Mkts Svr Bd ETF"
United States,ETF,JPN,"Xtrackers Japan JPX-Nikkei 400 Eq ETF"
United States,ETF,JPNL,"Direxion Daily Japan Bull 3X ETF"
United States,ETF,JPSE,"JPMorgan Divers Ret US Small Cap Eq ETF"
United States,ETF,JPST,"JPMorgan Ultra-Short Income ETF"
United States,ETF,JPUS,"JPMorgan Diversified Return US Eq ETF"
United States,ETF,JPXN,"iShares JPX-Nikkei 400 ETF"
United States,ETF,JQUA,"JPMorgan US Quality Factor ETF"
United States,ETF,JSMD,"Janus Henderson Small-Md Cp Gr Alpha ETF"
United States,ETF,JSML,"Janus Henderson Small Cap Gr Alpha ETF"
United States,ETF,JUST,"Goldman Sachs JUST US Large Cap Eq ETF"
United States,ETF,JVAL,"JPMorgan US Value Factor ETF"
United States,ETF,JXI,"iShares Global Utilities ETF"
United States,ETF,KARS,"KraneShares Eltc Vhl and Ft Mbly Index ETF"
United States,ETF,KBA,"KraneShares Bosera MSCI China A ETF"
United States,ETF,KBE,"SPDR S&P Bank ETF"
United States,ETF,KBWB,"Invesco KBW Bank ETF"
United States,ETF,KBWD,"Invesco KBW High Dividend Yield Fincl ETF"
United States,ETF,KBWP,"Invesco KBW Property & Casualty Ins ETF"
United States,ETF,KBWR,"Invesco KBW Regional Banking ETF"
United States,ETF,KBWY,"Invesco KBW Premium Yield Eq REIT ETF"
United States,ETF,KCCB,"KraneShares CCBS China Corp HY Bd USDETF"
United States,ETF,KCE,"SPDR S&P Capital Markets ETF"
United States,ETF,KCNY,"KraneShares E China Comrcl Paper ETF"
United States,ETF,KEMQ,"KraneShares Em Mkts Cnsmr Tech ETF"
United States,ETF,KFYP,"KraneShares CICC China Ldrs 100 Ind ETF"
United States,ETF,KGRN,"KraneShares MSCI China Environment ETF"
United States,ETF,KIE,"SPDR S&P Insurance ETF"
United States,ETF,KLDW,"Knowledge Leaders Developed World ETF"
United States,ETF,KMED,"KraneShares Emerging Mkts Hlthcare ETF"
United States,ETF,KNG,"CBOE VestS&P500 Dividend Arstcrts Tgt Inc ETF"
United States,ETF,KNOW,"Direxion All Cap Insider Sentiment ETF"
United States,ETF,KOL,"VanEck Vectors Coal ETF"
United States,ETF,KOLD,"ProShares UltraShort Bloomberg Natrl Gas"
United States,ETF,KOMP,"SPDR Kensho New Economies Composite ETF"
United States,ETF,KORP,"American Century Dvrs Corp Bd ETF"
United States,ETF,KORU,"Direxion Daily South Korea Bull 3X ETF"
United States,ETF,KRE,"SPDR S&P Regional Banking ETF"
United States,ETF,KRMA,"Global X Conscious Companies ETF"
United States,ETF,KSA,"iShares MSCI Saudi Arabia ETF"
United States,ETF,KURE,"KraneShares MSCI All China Hlth Care ETF"
United States,ETF,KWEB,"KraneShares CSI China Internet ETF"
United States,ETF,KXI,"iShares Global Consumer Staples ETF"
United States,ETF,LABD,"Direxion Daily S&P Biotech Bear 3X ETF"
United States,ETF,LABU,"Direxion Daily S&P Biotech Bull 3X ETF"
United States,ETF,LACK,"Direxion Daily Cnsmr Staples Bear 3X ETF"
United States,ETF,LBJ,"Direxion Daily Latin America Bull 3X ETF"
United States,ETF,LBTA,"Russell 1000 Low Beta ETF"
United States,ETF,LDRI,"Invesco LadderRite 0-5 Year Corp Bd ETF"
United States,ETF,LDRS,"Innovator IBD ETF Leaders"
United States,ETF,LDUR,"PIMCO Enhanced Low Duration Active ETF"
United States,ETF,LEAD,"Reality Shares Divcon Leaders Dividend ETF"
United States,ETF,LEGR,"First Trust Indxx Invtv Tnsctn&Prcs ETF"
United States,ETF,LEMB,"iShares JP Morgan EM Local Ccy Bd ETF"
United States,ETF,LFEQ,"VanEck Vectors NDR CMG Lg-FlatAllc ETF"
United States,ETF,LGLBF,"Gold Bullion Securities Limited - Gold Bullion Securities"
United States,ETF,LGLV,"SPDR SSGA US Large Cap Low Volatil ETF"
United States,ETF,LHB,"Direxion Daily Latin America 3x"
United States,ETF,LIT,"Global X Lithium & Battery Tech ETF"
United States,ETF,LKOR,"FlexShares Crdt-Scrd US Lng Corp Bd ETF"
United States,ETF,LLQD,"iShares 10+ Year Invmt Grd Corp Bd ETF"
United States,ETF,LMBS,"First Trust Low Duration Oppos ETF"
United States,ETF,LMLP,"UBS ETRACS M Py 2xLvg WF MLP Ex-Engy ETN"
United States,ETF,LOUP,"Innovator Loup Frontier Tech ETF"
United States,ETF,LOWC,"SPDR MSCI ACWI Low Carbon Target ETF"
United States,ETF,LQD,"iShares iBoxx $ Invmt Grade Corp Bd ETF"
United States,ETF,LQDH,"iShares Interest Rate Hedged Corp Bd ETF"
United States,ETF,LQDI,"iShares Inflation Hedged Corp Bd ETF"
United States,ETF,LRET,"UBS ETRACS MonPay 2xLvg MSCI US REIT ETN"
United States,ETF,LRGE,"ClearBridge Large Cap Growth ESG ETF"
United States,ETF,LRGF,"iShares Edge MSCI Multifactor USA ETF"
United States,ETF,LSAF,"LeaderSharesTM AlphaFactor US Cr Eq ETF"
United States,ETF,LTL,"ProShares Ultra Telecommunications"
United States,ETF,LTPZ,"PIMCO 15+ Year US TIPS ETF"
United States,ETF,LVHB,"Innovator Lunt Low Vol-High Beta Tact"
United States,ETF,LVHD,"Legg Mason Low Volatility High Dividend ETF"
United States,ETF,LVHE,"Legg Mason Emerg Mkts Low Vol Hi Dividend ETF"
United States,ETF,LVHI,"Legg Mason Intl Low Volatil Hi Dividend ETF"
United States,ETF,LVIN,"Hartford Multifactor Lw Vltl Intl Eq ETF"
United States,ETF,LVL,"Invesco S&P Global Dividend Opps ETF"
United States,ETF,LVUS,"Hartford Multifactor LowVolatil US EqETF"
United States,ETF,LWPE,"Russell Low P E  ETF"
United States,ETF,LYXRF,"LYXOR INTL AM"
United States,ETF,MAGA,"Point Bridge GOP Stock Tracker ETF"
United States,ETF,MBB,"iShares MBS ETF"
United States,ETF,MBSD,"FlexShares Disciplined Duration MBS ETF"
United States,ETF,MCEF,"First Trust Municipal CEF Income Opp ETF"
United States,ETF,MCHI,"iShares MSCI China ETF"
United States,ETF,MCRO,"IQ Hedge Macro Tracker ETF"
United States,ETF,MDIV,"Multi-Asset Diversified Income ETF"
United States,ETF,MDY,"SPDR S&P MidCap 400 ETF"
United States,ETF,MEAR,"iShares Short Maturity Municipal Bd ETF"
United States,ETF,MEXX,"Direxion Dly MSCI Mexico Bull 3X ShsETF"
United States,ETF,MFEM,"PIMCO RAFI Dyn Mlt-Fctr Emrg Mkts Eq ETF"
United States,ETF,MFMS,"Motley Fool Small-Cap Growth ETF"
United States,ETF,MFUS,"PIMCO RAFI Dyn Multi-Factor US Eq ETF"
United States,ETF,MGC,"Vanguard Mega Cap ETF"
United States,ETF,MGK,"Vanguard Mega Cap Growth ETF"
United States,ETF,MGV,"Vanguard Mega Cap Value ETF"
United States,ETF,MINT,"PIMCO Enhanced Short Maturity Active ETF"
United States,ETF,MJ,"ETFMG Alternative Harvest ETF"
United States,ETF,MLN,"VanEck Vectors AMT-Free Long Muni ETF"
United States,ETF,MLPA,"Global X MLP ETF"
United States,ETF,MLPC,"C-Tracks ETN Bsd on Perf of M-H MLP Fdmt"
United States,ETF,MLPE,"C-Tracks ETNs on the Miller-Howard MLP Fundamental Index, Series B"
United States,ETF,MLPQ,"UBS ETRACS 2xMLvgAlerianMLPIfr ETN SerB"
United States,ETF,MLPX,"Global X MLP & Energy Infrastructure ETF"
United States,ETF,MLPZ,"UBS ETRACS 2x M Lvg S&P MLP ETN SerB"
United States,ETF,MLQD,"iShares 5-10 Year Invmt Grd Corp Bd ETF"
United States,ETF,MLTI,"Credit Suisse X-Links Mlt-Ast Hi Inc ETN"
United States,ETF,MMIN,"IQ MacKay Shields Muncpl Insrd ETF"
United States,ETF,MMIT,"IQ MacKay Shields Muncpl Intern ETF"
United States,ETF,MMTM,"SPDR S&P 1500 Momentum Tilt ETF"
United States,ETF,MNA,"IQ Merger Arbitrage ETF"
United States,ETF,MOAT,"VanEck Vectors Morningstar Wide Moat ETF"
United States,ETF,MOM,"AGFiQ US Market Neutral Momentum"
United States,ETF,MOO,"VanEck Vectors Agribusiness ETF"
United States,ETF,MORL,"UBS ETRACS Mthly Py 2xLvg Mortg REIT ETN"
United States,ETF,MOTI,"VanEck Vectors Morningstar Intl Moat ETF"
United States,ETF,MPCT,"iShares MSCI Global Impact ETF"
United States,ETF,MRGR,"ProShares Merger"
United States,ETF,MRJOF,"PURPOSE MARIJUANA"
United States,ETF,MRRL,"UBS ETRACS M Py 2xLvg MortgREIT ETN SerB"
United States,ETF,MSUS,"LHA Market State Tactical US Equity ETF"
United States,ETF,MTUM,"iShares Edge MSCI USA Momentum Fctr ETF"
United States,ETF,MUAA,"iShares 2012 S&P AMT-Free Munic"
United States,ETF,MUAB,"iShares 2013 AMT-Free Muni Term"
United States,ETF,MUB,"iShares National Muni Bond ETF"
United States,ETF,MVIN,"Natixis Seeyond Intl Mnmm Volatil ETF"
United States,ETF,MVV,"ProShares Ultra MidCap400"
United States,ETF,MWJ,"Direxion Mid Cap Bull 3X Shares"
United States,ETF,MXDE,"Nationwide Max Divrs Emrg Mkts Cr Eq ETF"
United States,ETF,MXDU,"Nationwide Max Divers US Cor Eq ETF"
United States,ETF,MYY,"ProShares Short MidCap400"
United States,ETF,MZZ,"ProShares UltraShort MidCap400"
United States,ETF,NACP,"Impact Shares NAACP Minority Empwrmt ETF"
United States,ETF,NAIL,"Direxion Daily Hmbldrs&Supls Bull 3X ETF"
United States,ETF,NEAR,"iShares Short Maturity Bond ETF"
United States,ETF,NEED,"Direxion Daily Cnsmr Staples Bull 3X ETF"
United States,ETF,NFO,"Invesco Insider Sentiment ETF"
United States,ETF,NFRA,"FlexShares STOXX Global Broad Infras ETF"
United States,ETF,NFTY,"First Trust India NIFTY 50 Equal Wtd ETF"
United States,ETF,NGE,"Global X MSCI Nigeria ETF"
United States,ETF,NIB,"iPath Bloomberg Cocoa SubTR ETN"
United States,ETF,NLR,"VanEck Vectors Uranium+Nuclear Engy ETF"
United States,ETF,NOBL,"ProShares S&P 500 Dividend Aristocrats"
United States,ETF,NTETF,"Nikkei 225 Exchange Traded Fund"
United States,ETF,NUAG,"NuShares Enhanced Yield US Aggt Bd ETF"
United States,ETF,NUBD,"Nuveen ESG US Aggregate Bond ETF"
United States,ETF,NUDM,"NuShares ESG Intl Dev Mkts Eq ETF"
United States,ETF,NUEM,"NuShares ESG Emerging Markets Equity ETF"
United States,ETF,NUGT,"Direxion Daily Gold Miners Bull 3X ETF"
United States,ETF,NULG,"NuShares ESG Large-Cap Growth ETF"
United States,ETF,NULV,"NuShares ESG Large-Cap Value ETF"
United States,ETF,NUMG,"NuShares ESG Mid-Cap Growth ETF"
United States,ETF,NUMV,"NuShares ESG Mid-Cap Value ETF"
United States,ETF,NURE,"NuShares Short-Term REIT ETF"
United States,ETF,NUSA,"NuShares EY 1-5 Year US Aggt Bd ETF"
United States,ETF,NUSC,"Nuveen ESG Small-Cap ETF"
United States,ETF,OASI,"O'Shares FTSE Asia Pacific Qual Dividend ETF"
United States,ETF,OBOR,"KraneShares MSCI One Belt One Road ETF"
United States,ETF,OCIO,"ClearShares OCIO ETF"
United States,ETF,OEF,"iShares S&P 100 ETF"
United States,ETF,OEUR,"O'Shares FTSE Europe Quality Dividend ETF"
United States,ETF,OEW,"Invesco S&P 100 Equal Weight ETF"
United States,ETF,OGIG,"O'Shares Global Internet Giants ETF"
United States,ETF,OIH,"VanEck Vectors Oil Services ETF"
United States,ETF,OIL,"iPath B S&P GSCI Crude Oil TR ETN"
United States,ETF,OILB,"iPath B S&P GSCI Crude Oil TR ETN"
United States,ETF,OILD,"ProShares UltraPro 3x Shrt Crude Oil ETF"
United States,ETF,OILU,"ProShares UltraPro 3x Crude Oil ETF"
United States,ETF,OLEM,"iPath Pure Beta Crude Oil ETN"
United States,ETF,OLO,"DB Crude Oil Long ETN"
United States,ETF,OMFL,"Oppenheimer Russell 1000 Dyn Mltfctr ETF"
United States,ETF,OMFS,"Oppenheimer Russell 2000 Dyn Mltfctr ETF"
United States,ETF,OMOM,"Oppenheimer Russell 1000 Momt Fac ETF"
United States,ETF,ONEQ,"Fidelity NASDAQ Composite Tr Stk ETF"
United States,ETF,ONLN,"ProShares Online Retail ETF"
United States,ETF,ONTL,"O'Shares FTSE Russell Intl Qual Div"
United States,ETF,OQAL,"Oppenheimer Russell 1000 Qual Fac ETF"
United States,ETF,ORG,"The Organics ETF"
United States,ETF,OSCV,"Opus Small Cap Value Plus ETF"
United States,ETF,OSIZ,"Oppenheimer Russell 1000 Size Factor ETF"
United States,ETF,OTR,"Guggenheim Ocean Tomo Growth ET"
United States,ETF,OUNZ,"VanEck Merk Gold Trust"
United States,ETF,OUSA,"O'Shares FTSE US Quality Dividend ETF"
United States,ETF,OUSM,"O'Shares FTSE Russell Sm Cp Qual Div"
United States,ETF,OVLC,"Invesco US Large Cap Optimized Vol ETF"
United States,ETF,OVLU,"Oppenheimer Russell 1000 Value Fac ETF"
United States,ETF,OVOL,"Oppenheimer Russell 1000 Low Vol Fac ETF"
United States,ETF,OYLD,"Oppenheimer Russell 1000 Yield Fac ETF"
United States,ETF,PACA,"Xtrackers MSCI Latin A Pac Alliance ETF"
United States,ETF,PAF,"Invesco FTSE RAFI Asia Pac ex-Jpn ETF"
United States,ETF,PAK,"Global X MSCI Pakistan ETF"
United States,ETF,PALL,"Aberdeen Standard Phys PalladiumShrs ETF"
United States,ETF,PAVE,"Global X US Infrastructure Dev ETF"
United States,ETF,PAWZ,"ProShares Pet Care ETF"
United States,ETF,PBD,"Invesco Global Clean Energy ETF"
United States,ETF,PBDM,"Invesco PureBeta FTSE Dev ex-NrthAmr ETF"
United States,ETF,PBE,"Invesco Dynamic Biotech & Genome ETF"
United States,ETF,PBEE,"Invesco PureBeta FTSE Emerging Mkts ETF"
United States,ETF,PBJ,"Invesco Dynamic Food & Beverage ETF"
United States,ETF,PBND,"Invesco PureBeta US Aggregate Bond ETF"
United States,ETF,PBP,"Invesco S&P 500 BuyWrite ETF"
United States,ETF,PBS,"Invesco Dynamic Media ETF"
United States,ETF,PBSM,"Invesco PureBeta MSCI USA Small Cap ETF"
United States,ETF,PBUS,"Invesco PureBeta MSCI USA ETF"
United States,ETF,PBW,"Invesco WilderHill Clean Energy ETF"
United States,ETF,PCEF,"Invesco CEF Income Composite ETF"
United States,ETF,PDBC,"Invesco Optm Yd Dvrs Cdty Stra No K1 ETF"
United States,ETF,PDN,"Invesco FTSE RAFI Dev Mkts ex-US S-M ETF"
United States,ETF,PDP,"Invesco DWA Momentum ETF"
United States,ETF,PEJ,"Invesco Dynamic Leisure and Entmnt ETF"
United States,ETF,PEK,"VanEck Vectors ChinaAMC CSI 300 ETF"
United States,ETF,PEX,"ProShares Global Listed Private Equity"
United States,ETF,PEXL,"Pacer US Export Leaders ETF"
United States,ETF,PEY,"Invesco High Yield Eq Dividend Achiev ETF"
United States,ETF,PEZ,"Invesco DWA Consumer Cyclicals Mom ETF"
United States,ETF,PFA,"PowerShares Dynamic Developed I"
United States,ETF,PFF,"iShares US Preferred Stock ETF"
United States,ETF,PFFA,"Virtus InfraCap US Preferred Stock ETF"
United States,ETF,PFFD,"Global X US Preferred ETF"
United States,ETF,PFFR,"InfraCap REIT Preferred ETF"
United States,ETF,PFI,"Invesco DWA Financial Momentum ETF"
United States,ETF,PFIG,"Invesco Fdmtl Invmt Grd Corp Bd ETF"
United States,ETF,PFM,"Invesco Dividend Achievers ETF"
United States,ETF,PFXF,"VanEck Vectors Pref Secs ex Fincls ETF"
United States,ETF,PGAL,"Global X MSCI Portugal ETF"
United States,ETF,PGF,"Invesco Financial Preferred ETF"
United States,ETF,PGHY,"Invesco Global Short Term Hi Yield Bd ETF"
United States,ETF,PGJ,"Invesco Golden Dragon China ETF"
United States,ETF,PGM,"iPath B Bloomberg Platinum Ttl Ret ETN"
United States,ETF,PGMB,"iPath B Bloomberg Platinum Ttl Ret ETN"
United States,ETF,PGX,"Invesco Preferred ETF"
United States,ETF,PHB,"Invesco Fundamental Hi Yield Corp Bd ETF"
United States,ETF,PHO,"Invesco Water Resources ETF"
United States,ETF,PICB,"Invesco International Corporate Bond ETF"
United States,ETF,PICK,"iShares MSCI Global Mtls&Mng Prdcrs ETF"
United States,ETF,PID,"Invesco International Dividend Achiev ETF"
United States,ETF,PIE,"Invesco DWA Emerging Markets Mom ETF"
United States,ETF,PILL,"Direxion Daily Phrmctcl&MdclBl3XShrsETF"
United States,ETF,PIN,"Invesco India ETF"
United States,ETF,PIO,"Invesco Global Water ETF"
United States,ETF,PIZ,"Invesco DWA Developed Markets Mom ETF"
United States,ETF,PJB,"PowerShares Dynamic Banking"
United States,ETF,PJF,"PowerShares Dynamic Large Cap"
United States,ETF,PJG,"PowerShares Dynamic Mid Cap"
United States,ETF,PJM,"PowerShares Dynamic Small Cap"
United States,ETF,PJP,"Invesco Dynamic Pharmaceuticals ETF"
United States,ETF,PJUL,"Innovator S&P 500 Power Buffer ETF July"
United States,ETF,PKB,"Invesco Dynamic Building & Const ETF"
United States,ETF,PKW,"Invesco BuyBack Achievers ETF"
United States,ETF,PLCY,"EventShares US Policy Alpha ETF"
United States,ETF,PLK,"PowerShares Active Low Duration"
United States,ETF,PLND,"VanEck Vectors Poland ETF"
United States,ETF,PLTM,"GraniteShares Platinum Trust"
United States,ETF,PLW,"Invesco 1-30 Laddered Treasury ETF"
United States,ETF,PMOM,"Principal Sustainable Momentum ETF"
United States,ETF,PMR,"Invesco Dynamic Retail ETF"
United States,ETF,PNQI,"Invesco NASDAQ Internet ETF"
United States,ETF,POCT,"Innovator S&P 500 Power Buffer ETF Oct"
United States,ETF,PPA,"Invesco Aerospace & Defense ETF"
United States,ETF,PPEM,"PortfolioPlus Emerging Markets ETF"
United States,ETF,PPH,"VanEck Vectors Pharmaceutical ETF"
United States,ETF,PPLC,"PortfolioPlus S&P 500 ETF"
United States,ETF,PPLT,"Aberdeen Standard Phys Platinum Shrs ETF"
United States,ETF,PPMC,"PortfolioPlus S&P Mid Cap ETF"
United States,ETF,PPSC,"PortfolioPlus S&P Small Cap ETF"
United States,ETF,PPTY,"PPTY US Dversfd Rl Est ETF"
United States,ETF,PQLC,"PGIM QMA Strategic Alpha Lrg-Cp Cor ETF"
United States,ETF,PQSG,"PGIM QMA Strategic Alpha Sm-Cp Gr ETF"
