symbol,name,type,region,marketOpen,marketClose,timezone,currency,matchScore
ABM,ABM Industries Incorporated,Equity,United States,09:30,16:00,UTC-05,USD,1.0000
ABMD,ABIOMED Inc.,Equity,United States,09:30,16:00,UTC-05,USD,0.8571
ABMIX,AMG Managers Fairpointe Mid Cap I,Mutual Fund,United States,09:30,16:00,UTC-05,USD,0.8571
ABMC,American Bio Medica Corporation,Equity,United States,09:30,16:00,UTC-05,USD,0.8571
ABMBF,Abcourt Mines Inc.,Equity,United States,09:30,16:00,UTC-05,USD,0.7500
ABMT,Advanced Biomedical Technologies Inc.,Equity,United States,09:30,16:00,UTC-05,USD,0.7500
ABMRF,ABN AMRO Group N.V.,Equity,United States,09:30,16:00,UTC-05,USD,0.7500
ABMAX,American Beacon Mid-Cap Value A,Mutual Fund,United States,09:30,16:00,UTC-05,USD,0.7500
ABM.TRV,Athabasca Minerals Inc.,Equity,Toronto Venture,09:30,16:00,UTC-05,CAD,0.7500
ABM.LON,African Battery Metals Plc,Equity,United Kingdom,08:00,16:30,UTC+00,GBP,0.7500
