symbol,name,type,region,marketOpen,marketClose,timezone,currency,matchScore
AEP,American Electric Power Company Inc.,Equity,United States,09:30,16:00,UTC-05,USD,1.0000
AEPGX,American Funds Europacific Growth A,Mutual Fund,United States,09:30,16:00,UTC-05,USD,0.8571
AEPFX,American Funds Europacific Growth F2,Mutual Fund,United States,09:30,16:00,UTC-05,USD,0.7500
AEPCX,American Funds Europacific Growth C,Mutual Fund,United States,09:30,16:00,UTC-05,USD,0.7500
AEPT,American Energy Partners Inc.,Equity,United States,09:30,16:00,UTC-05,USD,0.7500
AEP.TRV,Atlas Engineered Products Ltd.,Equity,Toronto Venture,09:30,16:00,UTC-05,CAD,0.7500
