symbol,name,type,region,marketOpen,marketClose,timezone,currency,matchScore
AGHI,Agora Holdings Inc.,Equity,United States,09:30,16:00,UTC-05,USD,0.8571
AGHC,Aeon Global Health Corp.,Equity,United States,09:30,16:00,UTC-05,USD,0.8571
AGHPX,AllianzGI Global High Yield P,Mutual Fund,United States,09:30,16:00,UTC-05,USD,0.7500
AGHEF,Agility Health Inc.,Equity,United States,09:30,16:00,UTC-05,USD,0.7500
AGHAX,Meeder Aggressive Allocation Adviser,Mutual Fund,United States,09:30,16:00,UTC-05,USD,0.7500
AGHIX,Meeder Aggressive Allocation Instl,Mutual Fund,United States,09:30,16:00,UTC-05,USD,0.7500
AGH.AUS,Althea Group Holdings Limited,Equity,Australia,10:00,16:00,UTC+11,AUD,0.7500
AGH.FRK,Allegiant Travel Company,Equity,Frankfurt,08:00,20:00,UTC+01,EUR,0.6667
