symbol,name,type,region,marketOpen,marketClose,timezone,currency,matchScore
AOM,iShares Core Moderate Allocation ETF,ETF,United States,09:30,16:00,UTC-05,USD,1.0000
AOMIX,American Century One Choice Mod Inv,Mutual Fund,United States,09:30,16:00,UTC-05,USD,0.7500
AOMFF,Alstom SA,Equity,United States,09:30,16:00,UTC-05,USD,0.7500
AOMAX,AlphaOne Small Cap Opportunities Inv,Mutual Fund,United States,09:30,16:00,UTC-05,USD,0.7500
AOMCX,AlphaOne Small Cap Opportunities Instl,Mutual Fund,United States,09:30,16:00,UTC-05,USD,0.7500
