symbol,name,type,region,marketOpen,marketClose,timezone,currency,matchScore
AZKLF,Aziana Limited,Equity,United States,09:30,16:00,UTC-05,USD,0.7500
AZK.FRK,Hertz Global Holdings Inc.,Equity,Frankfurt,08:00,20:00,UTC+01,EUR,0.7500
AKK.BER,"AZKOYEN SA INH.  EO 0,60",Equity,Berlin,08:00,20:00,UTC+01,EUR,0.6667
AKK.STG,AZKOYEN S.A. Acciones Port.EO 0,Equity,Stuttgart,08:00,20:00,UTC+01,EUR,0.6667
AZK.BER,HERTZ GLOBAL HOLDING INC.,Equity,Berlin,08:00,20:00,UTC+01,EUR,0.6667
AZK.MUN,HERTZ GLOBAL HOLDING INC.,Equity,Munich,08:00,20:00,UTC+01,EUR,0.4444
AZK.STG,Hertz Global Holdings Inc. Regi,Equity,Stuttgart,08:00,20:00,UTC+01,EUR,0.4444
AZKARANINVER.BCL,Azkaran Inversiones SICAV,Mutual Fund,Barcelona,09:00,17:30,UTC+01,EUR,0.3333
