symbol,name,type,region,marketOpen,marketClose,timezone,currency,matchScore
BATAX,BlackRock Allocation Target Shrs Ser A,Mutual Fund,United States,09:30,16:00,UTC-05,USD,0.8889
BATAINDIA.NSE,Bata India Limited,Equity,India/NSE,09:15,15:30,UTC+5.5,INR,0.7273
BATA.JKT,PT Sepatu Bata tbk,Equity,Jakarta,09:00,16:00,UTC+07,IDR,0.5000
BPII.JKT,PT Batavia Prosperindo Internasional Tbk,Equity,Jakarta,09:00,16:00,UTC+07,IDR,0.5000
XBLQ.JKT,Reksa Dana Batavia Smart Liquid,Mutual Fund,Jakarta,09:00,16:00,UTC+07,IDR,0.3636
BPFI.JKT,PT Batavia Prosperindo Finance Tbk,Equity,Jakarta,09:00,16:00,UTC+07,IDR,0.2286
BPTR.JKT,PT Batavia Prosperindo Trans Tbk,Equity,Jakarta,09:00,16:00,UTC+07,IDR,0.2105
BATAINDIA.BSE,Bata India Limited,Equity,India/Bombay,09:15,15:30,UTC+5.5,INR,0.1818
