symbol,name,type,region,marketOpen,marketClose,timezone,currency,matchScore
BIS,ProShares UltraShort Nasdaq Biotech,ETF,United States,09:30,16:00,UTC-05,USD,1.0000
BSLIX,Bishop Street Dividend Value I,Mutual Fund,United States,09:30,16:00,UTC-05,USD,0.7500
BISOX,BlackRock Short Obligations Instl,Mutual Fund,United States,09:30,16:00,UTC-05,USD,0.7500
BCAC,Bison Capital Acquisition Corp.,Equity,United States,09:30,16:00,UTC-05,USD,0.7500
BHIAX,Bishop Street HI Muni Bond A,Mutual Fund,United States,09:30,16:00,UTC-05,USD,0.7500
BISCX,UBS US Small Cap Growth P,Mutual Fund,United States,09:30,16:00,UTC-05,USD,0.7500
BISGX,BMO Pyrford International Stock R6,Mutual Fund,United States,09:30,16:00,UTC-05,USD,0.5000
BISBX,BMO Pyrford International Stock F3,Mutual Fund,United States,09:30,16:00,UTC-05,USD,0.5000
BISAX,Brandes International Small Cap Equity A,Mutual Fund,United States,09:30,16:00,UTC-05,USD,0.2857
