symbol,name,type,region,marketOpen,marketClose,timezone,currency,matchScore
BOH,Bank of Hawaii Corporation,Equity,United States,09:30,16:00,UTC-05,USD,1.0000
BOPH,Bohai Pharmaceuticals Group Inc.,Equity,United States,09:30,16:00,UTC-05,USD,0.8571
300318.SHZ,Beijing Bohui Innovation Biotechnology Co. Ltd.,Equity,Shenzhen,09:30,15:00,UTC+08,CNY,0.2308
603167.SHH,Bohai Ferry Group Co. Ltd.,Equity,Shanghai,09:30,15:00,UTC+08,CNY,0.2308
600966.SHH,Shandong Bohui Paper Industry Co. Ltd.,Equity,Shanghai,09:30,15:00,UTC+08,CNY,0.2000
000415.SHZ,Bohai Leasing Co. Ltd.,Equity,Shenzhen,09:30,15:00,UTC+08,CNY,0.1935
000605.SHZ,Bohai Water Industry Co. Ltd.,Equity,Shenzhen,09:30,15:00,UTC+08,CNY,0.1429
000890.KOR,Bohae Brewery Co. Ltd.,Equity,Korea,09:00,15:30,UTC+09,KRW,0.1176
