symbol,name,type,region,marketOpen,marketClose,timezone,currency,matchScore
CCI,Crown Castle International Corp. (REIT),Equity,United States,09:30,16:00,UTC-05,USD,1.0000
CCIH,ChinaCache International Holdings Ltd.,Equity,United States,09:30,16:00,UTC-05,USD,0.8571
CCIZX,Columbia Seligman Comms & Info Inst,Mutual Fund,United States,09:30,16:00,UTC-05,USD,0.7500
CCI-PA,Crown Castle International Corp,Equity,United States,09:30,16:00,UTC-05,USD,0.7500
CCITX,American Funds 2050 Trgt Date Retire C,Mutual Fund,United States,09:30,16:00,UTC-05,USD,0.7500
CCICX,Columbia AMT-Free CA Interm MuniBd C,Mutual Fund,United States,09:30,16:00,UTC-05,USD,0.7500
CCIRX,Columbia Acorn International Adv,Mutual Fund,United States,09:30,16:00,UTC-05,USD,0.6667
CCI-UN.TRT,Canadian Convertibles Plus Fund,Equity,Toronto,09:30,16:00,UTC-05,CAD,0.5000
