symbol,name,type,region,marketOpen,marketClose,timezone,currency,matchScore
CCS,Century Communities Inc.,Equity,United States,09:30,16:00,UTC-05,USD,1.0000
CCSB,Community Savings Bancorp Inc.,Equity,United States,09:30,16:00,UTC-05,USD,0.8571
CCSCX,Columbia Commodity Strategy C,Mutual Fund,United States,09:30,16:00,UTC-05,USD,0.7500
CCSGX,Conestoga SMid Cap Institutional,Mutual Fund,United States,09:30,16:00,UTC-05,USD,0.7500
CCSMX,Conestoga SMid Cap Investors,Mutual Fund,United States,09:30,16:00,UTC-05,USD,0.7500
CCSAX,Columbia Commodity Strategy A,Mutual Fund,United States,09:30,16:00,UTC-05,USD,0.7500
CCSZX,Columbia Commodity Strategy Inst,Mutual Fund,United States,09:30,16:00,UTC-05,USD,0.7500
CCSTX,Capital Group CA Short-Term Municipal,Mutual Fund,United States,09:30,16:00,UTC-05,USD,0.7500
CCFC,CCSB Financial Corp.,Equity,United States,09:30,16:00,UTC-05,USD,0.7500
CCSWX,Columbia Commodity Strategy T,Mutual Fund,United States,09:30,16:00,UTC-05,USD,0.5714
