symbol,name,type,region,marketOpen,marketClose,timezone,currency,matchScore
CDHAX,Calvert International Responsible Index A,Mutual Fund,United States,09:30,16:00,UTC-05,USD,0.7500
CDHIX,Calvert International Responsible Index I,Mutual Fund,United States,09:30,16:00,UTC-05,USD,0.7500
CDH.TRT,Corridor Resources Inc.,Equity,Toronto,09:30,16:00,UTC-05,CAD,0.6667
CDH.AUS,Chongherr Investments Ltd,Equity,Australia,10:00,16:00,UTC+11,AUD,0.6667
CDH1.FRK,Cedar Realty Trust Inc.,Equity,Frankfurt,08:00,20:00,UTC+01,EUR,0.6667
CDH1.STG,Cedar Realty Trust Inc. Registe,Equity,Stuttgart,08:00,20:00,UTC+01,EUR,0.6000
