symbol,name,type,region,marketOpen,marketClose,timezone,currency,matchScore
CEXE,Circle Entertainment Inc.,Equity,United States,09:30,16:00,UTC-05,USD,0.8571
CEXPF,Cache Exploration Inc.,Equity,United States,09:30,16:00,UTC-05,USD,0.7500
CEXIX,Camelot Excalibur Small Cap Income I,Mutual Fund,United States,09:30,16:00,UTC-05,USD,0.7500
CEXCX,Camelot Excalibur Small Cap Income C,Mutual Fund,United States,09:30,16:00,UTC-05,USD,0.7500
CEXAX,Camelot Excalibur Small Cap Income A,Mutual Fund,United States,09:30,16:00,UTC-05,USD,0.7500
CEXA.FRK,"CEMEX, S.A.B. de C.V.",Equity,Frankfurt,08:00,20:00,UTC+01,EUR,0.6667
CEXB.FRK,"CEMEX, S.A.B. de C.V.",Equity,Frankfurt,08:00,20:00,UTC+01,EUR,0.6667
