symbol,name,type,region,marketOpen,marketClose,timezone,currency,matchScore
CAI.BER,CIBC,Equity,Berlin,08:00,20:00,UTC+01,EUR,1.0000
CIBCX,American Funds Capital Income Bldr C,Mutual Fund,United States,09:30,16:00,UTC-05,USD,0.8889
AWMIX,CIBC Atlas Mid Cap Equity Institutional,Mutual Fund,United States,09:30,16:00,UTC-05,USD,0.2222
AWEIX,CIBC Atlas Disciplined Equity Instl,Mutual Fund,United States,09:30,16:00,UTC-05,USD,0.2222
AWYIX,CIBC Atlas Equity Income Institutional,Mutual Fund,United States,09:30,16:00,UTC-05,USD,0.2222
AWGIX,CIBC Atlas All Cap Growth Institutional,Mutual Fund,United States,09:30,16:00,UTC-05,USD,0.2222
AWIIX,CIBC Atlas Income Opportunities Instl,Mutual Fund,United States,09:30,16:00,UTC-05,USD,0.2222
