symbol,name,type,region,marketOpen,marketClose,timezone,currency,matchScore
CBRL,Cracker Barrel Old Country Store Inc.,Equity,United States,09:30,16:00,UTC-05,USD,0.8889
CRACX,Columbia Adaptive Risk Allocation C,Mutual Fund,United States,09:30,16:00,UTC-05,USD,0.5000
OLD.FRK,Cracker Barrel Old Country Store Inc.,Equity,Frankfurt,08:00,20:00,UTC+01,EUR,0.2759
OLD.MUN,"CRACKER BARREL OLD DL-,01",Equity,Munich,08:00,20:00,UTC+01,EUR,0.2286
OLD.STG,Cracker Barrel Old Coun.St.IncR,Equity,Stuttgart,08:00,20:00,UTC+01,EUR,0.1905
