symbol,name,type,region,marketOpen,marketClose,timezone,currency,matchScore
CSKD,China Skyrise Digital Service Inc.,Equity,United States,09:30,16:00,UTC-05,USD,0.8571
CSKL,Catskill Hudson Bancorp Inc.,Equity,United States,09:30,16:00,UTC-05,USD,0.8571
CSKR.LON,iShares MSCI Korea ETF USD Acc,ETF,United Kingdom,08:00,16:30,UTC+00,GBP,0.6667
CSKR.MIL,iShares MSCI Korea ETF USD Acc,ETF,Milan,09:00,17:30,UTC+01,EUR,0.6000
CSKR.SWI,iShares MSCI Korea ETF USD Acc,ETF,Switzerland,09:00,17:30,UTC+01,CHF,0.6000
