symbol,name,type,region,marketOpen,marketClose,timezone,currency,matchScore
CSUAY,China Shenhua Energy Company Limited,Equity,United States,09:30,16:00,UTC-05,USD,0.8889
CSUAX,Cohen & Steers Global Infrastructure A,Mutual Fund,United States,09:30,16:00,UTC-05,USD,0.8889
CSUA.BER,"CORBION N.V. NAM.  EO-,25",Equity,Berlin,08:00,20:00,UTC+01,EUR,0.8000
CSUA.DUS,"CORBION N.V. NAM.  EO-,25",Equity,Dusseldorf,08:30,20:00,UTC+01,EUR,0.7273
CSUA.MUN,"CORBION N.V. NAM.  EO-,25",Equity,Munich,08:00,20:00,UTC+01,EUR,0.7273
CSUA.STG,Corbion N.V. Aandelen op naam E,Equity,Stuttgart,08:00,20:00,UTC+01,EUR,0.7273
CSUA.FRK,Corbion N.V.,Equity,Frankfurt,08:00,20:00,UTC+01,EUR,0.7273
