symbol,name,type,region,marketOpen,marketClose,timezone,currency,matchScore
CWAI,CWA Income ETF,ETF,United States,09:30,16:00,UTC-05,USD,0.8571
CWAFF,China Water Affairs Group Limited,Equity,United States,09:30,16:00,UTC-05,USD,0.7500
CWAA.BER,CHEMESIS INTL INC.  O.N.,Equity,Berlin,08:00,20:00,UTC+01,EUR,0.6667
CWAA.STG,Chemesis International Inc. Reg,Equity,Stuttgart,08:00,20:00,UTC+01,EUR,0.6000
CWAA.FRK,Chemesis International Inc.,Equity,Frankfurt,08:00,20:00,UTC+01,EUR,0.6000
CWAT.SWI,ETFS Swiss Franc Dly Hdg Wheat ETC,ETF,Switzerland,09:00,17:30,UTC+01,CHF,0.6000
