symbol,name,type,region,marketOpen,marketClose,timezone,currency,matchScore
CWVLF,Crown Point Energy Inc.,Equity,United States,09:30,16:00,UTC-05,USD,0.7500
CWVWF,Lithoquest Diamonds Inc.,Equity,United States,09:30,16:00,UTC-05,USD,0.7500
CWVGX,Calvert International Equity A,Mutual Fund,United States,09:30,16:00,UTC-05,USD,0.7500
CWVIX,Calvert International Equity I,Mutual Fund,United States,09:30,16:00,UTC-05,USD,0.7500
CWVCX,Calvert International Equity C,Mutual Fund,United States,09:30,16:00,UTC-05,USD,0.7500
CWV.TRV,Crown Point Energy Inc.,Equity,Toronto Venture,09:30,16:00,UTC-05,CAD,0.7500
