symbol,name,type,region,marketOpen,marketClose,timezone,currency,matchScore
DGEIX,DFA Global Equity I,Mutual Fund,United States,09:30,16:00,UTC-05,USD,0.8571
DGEFX,Destinations Equity Income I,Mutual Fund,United States,09:30,16:00,UTC-05,USD,0.7500
DGEAF,Diageo plc,Equity,United States,09:30,16:00,UTC-05,USD,0.7500
DGEN,Deltagen Inc.,Equity,United States,09:30,16:00,UTC-05,USD,0.7500
DGECX,Dreyfus Global Emerging Markets C,Mutual Fund,United States,09:30,16:00,UTC-05,USD,0.7500
DGEAX,Dreyfus Global Emerging Markets A,Mutual Fund,United States,09:30,16:00,UTC-05,USD,0.7500
DGEZX,Destinations Equity Income Z,Mutual Fund,United States,09:30,16:00,UTC-05,USD,0.7500
DGERX,DFA Global Equity R2,Mutual Fund,United States,09:30,16:00,UTC-05,USD,0.7500
