symbol,name,type,region,marketOpen,marketClose,timezone,currency,matchScore
DOS.TRV,Dios Exploration Inc.,Equity,Toronto Venture,09:30,16:00,UTC-05,CAD,0.7500
DOSSAUDEINVE.BCL,Dossau de Inversiones SICAV,Mutual Fund,Barcelona,09:00,17:30,UTC+01,EUR,0.6667
7483.TOK,Doshisha Co. Ltd..,Equity,Tokyo,09:00,15:00,UTC+09,JPY,0.3333
DOSH.LON,Lyxor FTSE UK QualLow Vol Dd(DR)ETF DGBP,ETF,United Kingdom,08:00,16:30,UTC+00,GBP,0.3000
SBLPA.MEX,Fondo BBVA Bancomer Deuda Flexible Dos SA de CV S.I.I.D.,Mutual Fund,Mexico,08:30,15:00,UTC-06,MXP,0.1818
BEST2GB.MEX,Fondo BBVA Bancomer Estructurado Variable Dos SA de CV S.I.R.V.,Mutual Fund,Mexico,08:30,15:00,UTC-06,MXP,0.1538
BNMDIAM0D.MEX,Horizonte Banamex Dos SA de CV S.I.I.D.,Mutual Fund,Mexico,08:30,15:00,UTC-06,MXP,0.1429
IPLAZOBF3.MEX,Compass Investments Dos SA de CV S.I.I.D.,Mutual Fund,Mexico,08:30,15:00,UTC-06,MXP,0.1364
