symbol,name,type,region,marketOpen,marketClose,timezone,currency,matchScore
EHI,Western Asset Global High Income Fund Inc.,Equity,United States,09:30,16:00,UTC-05,USD,1.0000
EHIC,eHi Car Services Limited,Equity,United States,09:30,16:00,UTC-05,USD,0.8571
EHITF,EDINBURGH INV TST,Equity,United States,09:30,16:00,UTC-05,USD,0.7500
EHIIX,Eaton Vance Hexavest International Eq I,Mutual Fund,United States,09:30,16:00,UTC-05,USD,0.7500
EHIAX,Eaton Vance Hexavest International Eq A,Mutual Fund,United States,09:30,16:00,UTC-05,USD,0.7500
1EHA.BER,EHI CAR SP.ADR A 2 DL-001,Equity,Berlin,08:00,20:00,UTC+01,EUR,0.4444
1EHA.STG,eHi Car Services Ltd. R.Shs Cl.,Equity,Stuttgart,08:00,20:00,UTC+01,EUR,0.4000
MKS.FRK,AS Merko Ehitus,Equity,Frankfurt,08:00,20:00,UTC+01,EUR,0.4000
1EHA.FRK,EHI CAR SP.ADR A 2 DL-001,Equity,Frankfurt,08:00,20:00,UTC+01,EUR,0.3333
