symbol,name,type,region,marketOpen,marketClose,timezone,currency,matchScore
ISVPF,iShares VII Public Limited Company - iShares MSCI EMU USD Hedged UCITS ETF (Acc),Equity,United States,09:30,16:00,UTC-05,USD,0.4444
^INZPRP,SPDR MSCI EMU UCITS ETF (GBP),ETF,United States,09:30,16:00,UTC-05,USD,0.2500
^INZPRC,SPDR MSCI EMU UCITS ETF (CHF),ETF,United States,09:30,16:00,UTC-05,USD,0.1875
^ZPRE,SPDR MSCI EMU UCITS ETF,ETF,United States,09:30,16:00,UTC-05,USD,0.1875
VAL.PAR,Lyxor UCITS ETF MSCI EMU Value,ETF,Paris,09:00,17:30,UTC+01,EUR,0.1818
SMUD.LON,iShares MSCI EMU ESG Scrn ETF EUR Dist,ETF,United Kingdom,08:00,16:30,UTC+00,GBP,0.0723
