symbol,name,type,region,marketOpen,marketClose,timezone,currency,matchScore
ENTR,ERShares Entrepreneur 30 ETF,ETF,United States,09:30,16:00,UTC-05,USD,0.7500
ERSMX,Eaton Vance Atlanta Capital SMID-Cap R,Mutual Fund,United States,09:30,16:00,UTC-05,USD,0.7500
EBKDY,Erste Group Bank AG,Equity,United States,09:30,16:00,UTC-05,USD,0.7500
EBKOF,Erste Group Bank AG,Equity,United States,09:30,16:00,UTC-05,USD,0.7500
ERSIX,Eaton Vance Short Duration Strat Inc R,Mutual Fund,United States,09:30,16:00,UTC-05,USD,0.5714
ERSTX,Eaton Vance Large-Cap Value R,Mutual Fund,United States,09:30,16:00,UTC-05,USD,0.4444
ERSGX,Eaton Vance Small-Cap R,Mutual Fund,United States,09:30,16:00,UTC-05,USD,0.2727
EBS.VIE,Erste Group Bank AG,Equity,Vienna,08:55,17:35,UTC+01,EUR,0.2727
AT0000A03N37.VIE,ERSTE WWF STOCK ENVIRONMENT EUR,Mutual Fund,Vienna,08:55,17:35,UTC+01,EUR,0.1765
