symbol,name,type,region,marketOpen,marketClose,timezone,currency,matchScore
FCO,Aberdeen Global Income Fund Inc.,Equity,United States,09:30,16:00,UTC-05,USD,1.0000
FCOM,Fidelity MSCI Communication ServicesETF,ETF,United States,09:30,16:00,UTC-05,USD,0.8571
FCONX,Fidelity Conservative Income Bond,Mutual Fund,United States,09:30,16:00,UTC-05,USD,0.8571
FCOR,Fidelity Corporate Bond ETF,ETF,United States,09:30,16:00,UTC-05,USD,0.8571
FCORX,Nuveen CO Municipal Bond I,Mutual Fund,United States,09:30,16:00,UTC-05,USD,0.7500
FCOB,1st Colonial Bancorp Inc.,Equity,United States,09:30,16:00,UTC-05,USD,0.7500
FCOZX,Franklin CO Tax Free Income Adv,Mutual Fund,United States,09:30,16:00,UTC-05,USD,0.7500
FCOCX,Nuveen CO Municipal Bond C2,Mutual Fund,United States,09:30,16:00,UTC-05,USD,0.7500
