symbol,name,type,region,marketOpen,marketClose,timezone,currency,matchScore
FESGX,First Eagle Global C,Mutual Fund,United States,09:30,16:00,UTC-05,USD,0.7500
FESOX,First Eagle Overseas C,Mutual Fund,United States,09:30,16:00,UTC-05,USD,0.7500
FESNF,First Real Estate Investment Trust,Equity,United States,09:30,16:00,UTC-05,USD,0.7500
FESIX,Fidelity SAI Real Estate Index,Mutual Fund,United States,09:30,16:00,UTC-05,USD,0.7500
FESWAX,"FT 7508: AI, Robotics & Technol",Mutual Fund,United States,09:30,16:00,UTC-05,USD,0.6667
FESA4.SAO,Companhia de Ferro Ligas da Bahia - FERBASA,Equity,Brazil/Sao Paolo,10:00,17:30,UTC-02,BRL,0.6000
2736.TOK,Festaria Holdings Co. Ltd.,Equity,Tokyo,09:00,15:00,UTC+09,JPY,0.5455
FESH.MOS,Far-Eastern Shipping Company PLC.,Equity,Moscow,10:00,18:45,UTC+03,RUB,0.5455
FESA3.SAO,Companhia de Ferro Ligas da Bahia - FERBASA,Equity,Brazil/Sao Paolo,10:00,17:30,UTC-02,BRL,0.2000
