symbol,name,type,region,marketOpen,marketClose,timezone,currency,matchScore
FEU,SPDR STOXX Europe 50 ETF,ETF,United States,09:30,16:00,UTC-05,USD,1.0000
FEUPX,American Funds Europacific Growth F3,Mutual Fund,United States,09:30,16:00,UTC-05,USD,0.8571
FEUZ,First Trust Eurozone AlphaDEX ETF,ETF,United States,09:30,16:00,UTC-05,USD,0.8571
FEUGX,Federated Adjustable Rate Secs Instl,Mutual Fund,United States,09:30,16:00,UTC-05,USD,0.7500
FEUL,Credit Suisse FI Enh Eurp 50 ETN FEUL,Equity,United States,09:30,16:00,UTC-05,USD,0.7500
FEUIX,Fidelity Advisor Glbl Capital Apprec I,Mutual Fund,United States,09:30,16:00,UTC-05,USD,0.7500
