symbol,name,type,region,marketOpen,marketClose,timezone,currency,matchScore
FLF,Federal Life Group Inc.,Equity,United States,09:30,16:00,UTC-05,USD,1.0000
FLFAX,Fidelity Advisor Latin America A,Mutual Fund,United States,09:30,16:00,UTC-05,USD,0.8571
FLFIX,Fidelity Advisor Latin America I,Mutual Fund,United States,09:30,16:00,UTC-05,USD,0.7500
FLFCX,Fidelity Advisor Latin America C,Mutual Fund,United States,09:30,16:00,UTC-05,USD,0.7500
FLFGX,Meeder Global Allocation Retail,Mutual Fund,United States,09:30,16:00,UTC-05,USD,0.7500
FLFR,Franklin FTSE France ETF,ETF,United States,09:30,16:00,UTC-05,USD,0.7500
FLFTX,Fidelity Advisor Latin America M,Mutual Fund,United States,09:30,16:00,UTC-05,USD,0.7500
