symbol,name,type,region,marketOpen,marketClose,timezone,currency,matchScore
FUT,ProShares Managed Futures Strategy,ETF,United States,09:30,16:00,UTC-05,USD,1.0000
UVXY,ProShares Ultra VIX Short-Term Futures,ETF,United States,09:30,16:00,UTC-05,USD,0.8571
VXX,iPath S&P 500 VIX ST Futures ETN,ETF,United States,09:30,16:00,UTC-05,USD,0.5714
SVXY,ProShares Short VIX Short-Term Futures,ETF,United States,09:30,16:00,UTC-05,USD,0.4000
VIXY,ProShares VIX Short-Term Futures,ETF,United States,09:30,16:00,UTC-05,USD,0.2857
FFRMF,Future Farm Technologies Inc.,Equity,United States,09:30,16:00,UTC-05,USD,0.2500
FUTY,Fidelity MSCI Utilities ETF,ETF,United States,09:30,16:00,UTC-05,USD,0.1714
FTFT,Future FinTech Group Inc.,Equity,United States,09:30,16:00,UTC-05,USD,0.1714
FF,FutureFuel Corp.,Equity,United States,09:30,16:00,UTC-05,USD,0.1463
