symbol,name,type,region,marketOpen,marketClose,timezone,currency,matchScore
FVAL,Fidelity Value Factor ETF,ETF,United States,09:30,16:00,UTC-05,USD,0.8571
FVADX,Franklin Small Cap Value Adv,Mutual Fund,United States,09:30,16:00,UTC-05,USD,0.7500
FVATX,Nuveen VA Municipal Bond A,Mutual Fund,United States,09:30,16:00,UTC-05,USD,0.7500
FVASX,FA 529 VALUE STRATEGIES PORT-CL,Mutual Fund,United States,09:30,16:00,UTC-05,USD,0.7500
FVALX,Forester Value N,Mutual Fund,United States,09:30,16:00,UTC-05,USD,0.7500
FVANBX,FT 6988: Dividend Strength Port,Mutual Fund,United States,09:30,16:00,UTC-05,USD,0.7500
FVAQX,Franklin VA Tax Free Income A,Mutual Fund,United States,09:30,16:00,UTC-05,USD,0.7500
FVACX,Nuveen VA Municipal Bond C2,Mutual Fund,United States,09:30,16:00,UTC-05,USD,0.7500
FVAIX,Franklin VA Tax Free Income C,Mutual Fund,United States,09:30,16:00,UTC-05,USD,0.6667
