symbol,name,type,region,marketOpen,marketClose,timezone,currency,matchScore
FXR,First Trust Indtls/PrdcrDurbAlphaDEXETF,ETF,United States,09:30,16:00,UTC-05,USD,1.0000
FXRVF,Fox River Resources Corporation,Equity,United States,09:30,16:00,UTC-05,USD,0.8571
FXRU,CurrencyShares Russian Ruble Tr,ETF,United States,09:30,16:00,UTC-05,USD,0.7500
FXRU.LON,FinEx Tradable Russian Corp Bds ETF USD,ETF,United Kingdom,08:00,16:30,UTC+00,GBP,0.6667
FXRB.MOS,FinEx Funds Public Limited Company - FinEx Tradable Russian Corporate Bonds UCITS ETF,ETF,Moscow,10:00,18:45,UTC+03,RUB,0.6000
