symbol,name,type,region,marketOpen,marketClose,timezone,currency,matchScore
GBF,iShares Government/Credit Bond ETF,ETF,United States,09:30,16:00,UTC-05,USD,1.0000
GBFAX,VanEck Emerging Markets A,Mutual Fund,United States,09:30,16:00,UTC-05,USD,0.7500
GBFPX,GMO Benchmark-Free Allocation Ser PS,Mutual Fund,United States,09:30,16:00,UTC-05,USD,0.7500
GBFFX,GMO Benchmark-Free III,Mutual Fund,United States,09:30,16:00,UTC-05,USD,0.7500
GBF.FRK,Bilfinger SE,Equity,Frankfurt/XETRA,08:00,20:00,UTC+01,EUR,0.6667
