symbol,name,type,region,marketOpen,marketClose,timezone,currency,matchScore
GHG,GreenTree Hospitality Group Ltd.,Equity,United States,09:30,16:00,UTC-05,USD,1.0000
GHG.LON,Georgia Healthcare Group PLC,Equity,United Kingdom,08:00,16:30,UTC+00,GBP,0.7500
GHG.BER,GLOBAL HEMP GROUP INC.,Equity,Berlin,08:00,20:00,UTC+01,EUR,0.7500
GHG.FRK,GLOBAL HEMP GROUP INC.,Equity,Frankfurt,08:00,20:00,UTC+01,EUR,0.6667
GHG.MUN,GLOBAL HEMP GROUP INC.,Equity,Munich,08:00,20:00,UTC+01,EUR,0.6667
GHG.STG,Global Hemp Group Inc. Register,Equity,Stuttgart,08:00,20:00,UTC+01,EUR,0.6667
