symbol,name,type,region,marketOpen,marketClose,timezone,currency,matchScore
GIJAX,Guggenheim Municipal Income A,Mutual Fund,United States,09:30,16:00,UTC-05,USD,0.7500
GIJPX,Guggenheim Municipal Income P,Mutual Fund,United States,09:30,16:00,UTC-05,USD,0.7500
GIJIX,Guggenheim Municipal Income Instl,Mutual Fund,United States,09:30,16:00,UTC-05,USD,0.7500
GIJCX,Guggenheim Municipal Income C,Mutual Fund,United States,09:30,16:00,UTC-05,USD,0.7500
F000001Z10.BCL,Cia. de Tranv?as de Gij?n SICAV,Mutual Fund,Barcelona,09:00,17:30,UTC+01,EUR,0.1765
CIADETRANVAS.BCL,Cia. de Tranv?as de Gij?n SICAV,Mutual Fund,Barcelona,09:00,17:30,UTC+01,EUR,0.1765
