symbol,name,type,region,marketOpen,marketClose,timezone,currency,matchScore
GSD,WisdomTree Global SmallCap Dividend ETF,ETF,United States,09:30,16:00,UTC-05,USD,1.0000
GSDIX,Goldman Sachs Emerging Markets Dbt Instl,Mutual Fund,United States,09:30,16:00,UTC-05,USD,0.8571
GSDC,Goldsands Development Company,Equity,United States,09:30,16:00,UTC-05,USD,0.7500
GSDUX,Goldman Sachs Short Dur T/F Instl,Mutual Fund,United States,09:30,16:00,UTC-05,USD,0.7500
GSDSX,Goldman Sachs Short Dur Govt Svc,Mutual Fund,United States,09:30,16:00,UTC-05,USD,0.7500
GSDPX,Goldman Sachs US Tax-Managed Eq P,Mutual Fund,United States,09:30,16:00,UTC-05,USD,0.7500
GSDAX,Goldman Sachs Emerging Markets Dbt A,Mutual Fund,United States,09:30,16:00,UTC-05,USD,0.7500
GSDTX,Goldman Sachs Short Dur T/F A,Mutual Fund,United States,09:30,16:00,UTC-05,USD,0.7500
GSDCX,Goldman Sachs Short Dur Govt C,Mutual Fund,United States,09:30,16:00,UTC-05,USD,0.7500
