symbol,name,type,region,marketOpen,marketClose,timezone,currency,matchScore
GSG,iShares S&P GSCI Commodity-Indexed Trust,ETF,United States,09:30,16:00,UTC-05,USD,1.0000
GSGRX,Goldman Sachs Equity Income A,Mutual Fund,United States,09:30,16:00,UTC-05,USD,0.7500
GSGPX,Goldman Sachs Absolute Ret Trckr P,Mutual Fund,United States,09:30,16:00,UTC-05,USD,0.7500
GSGLX,Goldman Sachs Global Income Instl,Mutual Fund,United States,09:30,16:00,UTC-05,USD,0.7500
GSGSX,Goldman Sachs Equity Income Svc,Mutual Fund,United States,09:30,16:00,UTC-05,USD,0.7500
GSGCX,Goldman Sachs Equity Income C,Mutual Fund,United States,09:30,16:00,UTC-05,USD,0.7500
GSGAX,Goldman Sachs Investment Grd Crdt A,Mutual Fund,United States,09:30,16:00,UTC-05,USD,0.7500
