symbol,name,type,region,marketOpen,marketClose,timezone,currency,matchScore
GSRX,GSRX Industries Inc.	,Equity,United States,09:30,16:00,UTC-05,USD,0.8571
GSRAX,Goldman Sachs Rising Dividend Gr A,Mutual Fund,United States,09:30,16:00,UTC-05,USD,0.7500
GSRIX,Goldman Sachs Rising Dividend Gr Inv,Mutual Fund,United States,09:30,16:00,UTC-05,USD,0.7500
GSRCX,Goldman Sachs Rising Dividend Gr C,Mutual Fund,United States,09:30,16:00,UTC-05,USD,0.7500
GSRPX,Goldman Sachs Infl Protected Secs R,Mutual Fund,United States,09:30,16:00,UTC-05,USD,0.7500
GSRKX,Goldman Sachs International Eq Inc R,Mutual Fund,United States,09:30,16:00,UTC-05,USD,0.7500
GSRUX,Goldman Sachs Infl Protected Secs R6,Mutual Fund,United States,09:30,16:00,UTC-05,USD,0.7500
GSRLX,Goldman Sachs Rising Dividend Gr Instl,Mutual Fund,United States,09:30,16:00,UTC-05,USD,0.7500
GSROX,Goldman Sachs Small Cap Gr Insghts R,Mutual Fund,United States,09:30,16:00,UTC-05,USD,0.7500
