symbol,name,type,region,marketOpen,marketClose,timezone,currency,matchScore
HDV,iShares Core High Dividend ETF,ETF,United States,09:30,16:00,UTC-05,USD,1.0000
HDVY,Health Discovery Corporation,Equity,United States,09:30,16:00,UTC-05,USD,0.8571
HDVAX,Hartford International Equity A,Mutual Fund,United States,09:30,16:00,UTC-05,USD,0.8571
HDVCX,Hartford International Equity C,Mutual Fund,United States,09:30,16:00,UTC-05,USD,0.7500
HDVVX,Hartford International Equity R6,Mutual Fund,United States,09:30,16:00,UTC-05,USD,0.7500
HDVTX,Hartford International Equity R5,Mutual Fund,United States,09:30,16:00,UTC-05,USD,0.7500
HDVRX,Hartford International Equity R3,Mutual Fund,United States,09:30,16:00,UTC-05,USD,0.7500
HDVW,HD View 360 Inc.,Equity,United States,09:30,16:00,UTC-05,USD,0.7500
