symbol,name,type,region,marketOpen,marketClose,timezone,currency,matchScore
HCLP,Hi-Crush Partners LP,Equity,United States,09:30,16:00,UTC-05,USD,0.5714
DVHIX,Delaware National Hi-Yld Muni Bd Instl,Mutual Fund,United States,09:30,16:00,UTC-05,USD,0.5000
CXHYX,Delaware National Hi-Yld Muni Bd A,Mutual Fund,United States,09:30,16:00,UTC-05,USD,0.5000
CHBAX,City National Rochdale Hi-Yld Bond N,Mutual Fund,United States,09:30,16:00,UTC-05,USD,0.3158
CHYIX,City National Rochdale Hi-Yld Bond Svc,Mutual Fund,United States,09:30,16:00,UTC-05,USD,0.2857
CNIHX,City National Rochdale Hi-Yld Bond Instl,Mutual Fund,United States,09:30,16:00,UTC-05,USD,0.2500
DVHCX,Delaware National Hi-Yld Muni Bd C,Mutual Fund,United States,09:30,16:00,UTC-05,USD,0.2500
HIGR,Hi-Great Group Holding Co.,Equity,United States,09:30,16:00,UTC-05,USD,0.2500
JBH.AUS,JB Hi-Fi Limited,Equity,Australia,10:00,16:00,UTC+11,AUD,0.2500
