symbol,name,type,region,marketOpen,marketClose,timezone,currency,matchScore
IART,Integra LifeSciences Holdings Corporation,Equity,United States,09:30,16:00,UTC-05,USD,0.8571
IARAX,Invesco Real Estate A,Mutual Fund,United States,09:30,16:00,UTC-05,USD,0.8571
IARE,InvenTrust Properties Corp.,Equity,United States,09:30,16:00,UTC-05,USD,0.7500
IARIX,Invesco Real Estate R5,Mutual Fund,United States,09:30,16:00,UTC-05,USD,0.7500
IARCX,Invesco Real Estate C,Mutual Fund,United States,09:30,16:00,UTC-05,USD,0.7500
IARFX,Invesco Real Estate R6,Mutual Fund,United States,09:30,16:00,UTC-05,USD,0.7500
IARRX,Invesco Real Estate R,Mutual Fund,United States,09:30,16:00,UTC-05,USD,0.7500
IARYX,Invesco Real Estate Y,Mutual Fund,United States,09:30,16:00,UTC-05,USD,0.7500
