symbol,name,type,region,marketOpen,marketClose,timezone,currency,matchScore
IHPCF,iShares Public Limited Company - iShares S&P 500 UCITS ETF,Equity,United States,09:30,16:00,UTC-05,USD,0.7500
IHPSX,Voya Hang Seng Index Port S,Mutual Fund,United States,09:30,16:00,UTC-05,USD,0.7500
IHPIX,Voya Hang Seng Index Port I,Mutual Fund,United States,09:30,16:00,UTC-05,USD,0.7500
IHPXF,ISHARES,Equity,United States,09:30,16:00,UTC-05,USD,0.7500
IHP.FRK,Dine Brands Global Inc.,Equity,Frankfurt,08:00,20:00,UTC+01,EUR,0.7500
IHP.LON,IntegraFin Holdings plc,Equity,United Kingdom,08:00,16:30,UTC+00,GBP,0.7500
