symbol,name,type,region,marketOpen,marketClose,timezone,currency,matchScore
IIGCX,VanEck International Investors Gold C,Mutual Fund,United States,09:30,16:00,UTC-05,USD,0.8571
IIGD,Invesco Investment Grade Defensive ETF,ETF,United States,09:30,16:00,UTC-05,USD,0.7500
IIGGX,VY Templeton Global Growth I,Mutual Fund,United States,09:30,16:00,UTC-05,USD,0.7500
IIGMSX,Investment Grade Municipal Trus,Mutual Fund,United States,09:30,16:00,UTC-05,USD,0.6667
IIGMTX,Investment Grade Municipal Trus,Mutual Fund,United States,09:30,16:00,UTC-05,USD,0.6667
IIGINX,"Investment Grade Income Trust, ",Mutual Fund,United States,09:30,16:00,UTC-05,USD,0.6667
IIGCTX,Investment Grade Corporate Trus,Mutual Fund,United States,09:30,16:00,UTC-05,USD,0.6667
