symbol,name,type,region,marketOpen,marketClose,timezone,currency,matchScore
ISD,PGIM Short Duration High Yield Fund Inc.,Equity,United States,09:30,16:00,UTC-05,USD,1.0000
ISDR,Issuer Direct Corporation,Equity,United States,09:30,16:00,UTC-05,USD,0.8571
ISDS,Invesco Strategic Dvlpd ex-US Sm Com ETF,Equity,United States,09:30,16:00,UTC-05,USD,0.8571
ISDSF,iSIGN Media Solutions Inc.,Equity,United States,09:30,16:00,UTC-05,USD,0.8571
ISDX,Invesco Strategic Dvlpd ex-US ETF,Equity,United States,09:30,16:00,UTC-05,USD,0.7500
ISDAY,Israel Discount Bank Limited,Equity,United States,09:30,16:00,UTC-05,USD,0.7500
ISDIX,Voya Index Solution 2025 Port I,Mutual Fund,United States,09:30,16:00,UTC-05,USD,0.7500
ISDCF,Inside Secure S.A.,Equity,United States,09:30,16:00,UTC-05,USD,0.7500
ISDAAX,ADT 1854 Inflation Sensitive Di,Mutual Fund,United States,09:30,16:00,UTC-05,USD,0.6667
ISDMUX,Insured Municipals Income Trust,Mutual Fund,United States,09:30,16:00,UTC-05,USD,0.6667
