symbol,name,type,region,marketOpen,marketClose,timezone,currency,matchScore
IWD,iShares Russell 1000 Value ETF,ETF,United States,09:30,16:00,UTC-05,USD,1.0000
IWDEX,Voya Diversified Emerging Markets Debt W,Mutual Fund,United States,09:30,16:00,UTC-05,USD,0.7500
IWDA.AMS,iShares III Public Limited Company - iShares Core MSCI World UCITS ETF,ETF,Amsterdam,09:00,17:40,UTC+01,EUR,0.6667
IWDA.LON,iShares Core MSCI World ETF USD Acc,ETF,United Kingdom,08:00,16:30,UTC+00,GBP,0.6667
IWDE.MIL,iShares MSCI World EUR Hedged ETF Acc,ETF,Milan,09:00,17:30,UTC+01,EUR,0.6000
IWDP.LON,iShares Dev Mkts Prpty Yield ETF USD Dist,ETF,United Kingdom,08:00,16:30,UTC+00,GBP,0.6000
