symbol,name,type,region,marketOpen,marketClose,timezone,currency,matchScore
JDNAX,Janus Henderson Growth And Income A,Mutual Fund,United States,09:30,16:00,UTC-05,USD,0.7500
JDNRX,Janus Henderson Growth And Income R,Mutual Fund,United States,09:30,16:00,UTC-05,USD,0.7500
JDNNX,Janus Henderson Growth And Income N,Mutual Fund,United States,09:30,16:00,UTC-05,USD,0.7500
JDN.MEX,JD.com Inc.,Equity,Mexico,08:30,15:00,UTC-06,MXP,0.7500
JDN.TRV,Jayden Resources Inc.,Equity,Toronto Venture,09:30,16:00,UTC-05,CAD,0.6667
