symbol,name,type,region,marketOpen,marketClose,timezone,currency,matchScore
JDWAX,Janus Worldwide A,Mutual Fund,United States,09:30,16:00,UTC-05,USD,0.7500
JDWPY,J D Wetherspoon plc,Equity,United States,09:30,16:00,UTC-05,USD,0.7500
JDWNX,Janus Henderson Global Research N,Mutual Fund,United States,09:30,16:00,UTC-05,USD,0.7500
JDWRX,Janus Henderson Global Research R,Mutual Fund,United States,09:30,16:00,UTC-05,USD,0.7500
JDWPF,J D Wetherspoon plc,Equity,United States,09:30,16:00,UTC-05,USD,0.7500
JDW.LON,J D Wetherspoon plc,Equity,United Kingdom,08:00,16:30,UTC+00,GBP,0.7500
