symbol,name,type,region,marketOpen,marketClose,timezone,currency,matchScore
JGACX,JPMorgan Growth Advantage C,Mutual Fund,United States,09:30,16:00,UTC-05,USD,0.7500
JGASX,JPMorgan Growth Advantage I,Mutual Fund,United States,09:30,16:00,UTC-05,USD,0.7500
JGAUX,JPMorgan Small Cap Core R3,Mutual Fund,United States,09:30,16:00,UTC-05,USD,0.7500
JGAQX,JPMorgan Value Advantage R2,Mutual Fund,United States,09:30,16:00,UTC-05,USD,0.7500
JGAVX,JPMorgan Growth and Income R3,Mutual Fund,United States,09:30,16:00,UTC-05,USD,0.7500
JGARX,PGIM Growth Allocation R,Mutual Fund,United States,09:30,16:00,UTC-05,USD,0.7500
JGA.FRK,Jiangnan Group Limited,Equity,Frankfurt,08:00,20:00,UTC+01,EUR,0.7500
