symbol,name,type,region,marketOpen,marketClose,timezone,currency,matchScore
JHUAX,JHancock US Growth A,Mutual Fund,United States,09:30,16:00,UTC-05,USD,0.7500
JHUCX,JHancock US Growth C,Mutual Fund,United States,09:30,16:00,UTC-05,USD,0.7500
JHUIX,JHancock US Growth I,Mutual Fund,United States,09:30,16:00,UTC-05,USD,0.7500
JHUPX,JHancock US Growth 1,Mutual Fund,United States,09:30,16:00,UTC-05,USD,0.7500
JHUKX,JPMorgan Emerging Markets Equity R4,Mutual Fund,United States,09:30,16:00,UTC-05,USD,0.7500
JHUJX,JPMorgan Emerging Markets Equity R2,Mutual Fund,United States,09:30,16:00,UTC-05,USD,0.7500
JHURX,JPMorgan Emerging Markets Equity R3,Mutual Fund,United States,09:30,16:00,UTC-05,USD,0.7500
JHU1.FRK,Jinhui Holdings Company Limited,Equity,Frankfurt,08:00,20:00,UTC+01,EUR,0.6667
JHU1.STG,Jinhui Holdings Co. Ltd. Reg.Su,Equity,Stuttgart,08:00,20:00,UTC+01,EUR,0.6000
