symbol,name,type,region,marketOpen,marketClose,timezone,currency,matchScore
JNRFX,Janus Henderson Research D,Mutual Fund,United States,09:30,16:00,UTC-05,USD,0.7500
JNRRX,PGIM Jennison Natural Resources R,Mutual Fund,United States,09:30,16:00,UTC-05,USD,0.7500
JNRIX,JHancock Natural Resources I,Mutual Fund,United States,09:30,16:00,UTC-05,USD,0.7500
JNRAX,JHancock Natural Resources A,Mutual Fund,United States,09:30,16:00,UTC-05,USD,0.7500
JNRFY,Japan Retail Fund Investment Corporation,Equity,United States,09:30,16:00,UTC-05,USD,0.7500
