symbol,name,type,region,marketOpen,marketClose,timezone,currency,matchScore
JTHIX,James Alpha Total Hedge I,Mutual Fund,United States,09:30,16:00,UTC-05,USD,0.7500
JTHAX,James Alpha Total Hedge A,Mutual Fund,United States,09:30,16:00,UTC-05,USD,0.7500
JTHSX,James Alpha Total Hedge S,Mutual Fund,United States,09:30,16:00,UTC-05,USD,0.7500
JTHCX,James Alpha Total Hedge C,Mutual Fund,United States,09:30,16:00,UTC-05,USD,0.7500
JTH.MUN,Gesundheitswelt Chiemgau AG,Equity,Munich,08:00,20:00,UTC+01,EUR,0.6667
