symbol,name,type,region,marketOpen,marketClose,timezone,currency,matchScore
KYSEY,"Kyushu Electric Power Company, Incorporated",Equity,United States,09:30,16:00,UTC-05,USD,0.5000
9142.TOK,Kyushu Railway Company,Equity,Tokyo,09:00,15:00,UTC+09,JPY,0.3000
000050.KOR,Kyungbang Co. Ltd.,Equity,Korea,09:00,15:30,UTC+09,KRW,0.2500
002100.KOR,Kyung Nong Corporation,Equity,Korea,09:00,15:30,UTC+09,KRW,0.2400
2653.TOK,Aeon Kyushu Co. Ltd.,Equity,Tokyo,09:00,15:00,UTC+09,JPY,0.2400
6485.TOK,Maezawa Kyuso Industries Co. Ltd.,Equity,Tokyo,09:00,15:00,UTC+09,JPY,0.2143
8596.TOK,Kyushu Leasing Service Co. Ltd.,Equity,Tokyo,09:00,15:00,UTC+09,JPY,0.2000
009450.KOR,Kyung Dong Navien Co. Ltd.,Equity,Korea,09:00,15:30,UTC+09,KRW,0.1714
012320.KOR,Kyungdong Invest Co. Ltd.,Equity,Korea,09:00,15:30,UTC+09,KRW,0.1622
