symbol,name,type,region,marketOpen,marketClose,timezone,currency,matchScore
LAOSX,Western Asset Macro Opportunities IS,Mutual Fund,United States,09:30,16:00,UTC-05,USD,0.7500
LAOIX,Western Asset Macro Opportunities I,Mutual Fund,United States,09:30,16:00,UTC-05,USD,0.7500
LAOCX,BrandywineGLOBAL Global Unconst Bond C,Mutual Fund,United States,09:30,16:00,UTC-05,USD,0.7500
LAOPALA.NSE,La Opala RG Limited,Equity,India/NSE,09:15,15:30,UTC+5.5,INR,0.6667
8202.TOK,Laox CO. Ltd.,Equity,Tokyo,09:00,15:00,UTC+09,JPY,0.4615
000568.SHZ,Luzhou Laojiao Co. Ltd.,Equity,Shenzhen,09:30,15:00,UTC+08,CNY,0.4615
600559.SHH,Hebei Hengshui Laobaigan Liquor Co. Ltd.,Equity,Shanghai,09:30,15:00,UTC+08,CNY,0.3529
LAOPALA.BSE,La Opala RG Limited,Equity,India/Bombay,09:15,15:30,UTC+5.5,INR,0.2400
LAO.BER,"LABAT AFRICA LTD  RC-,04",Equity,Berlin,08:00,20:00,UTC+01,EUR,0.1364
