symbol,name,type,region,marketOpen,marketClose,timezone,currency,matchScore
LTM,LATAM Airlines Group S.A.,Equity,United States,09:30,16:00,UTC-05,USD,0.8889
LATAX,Lord Abbett AMT Free Municipal Bond A,Mutual Fund,United States,09:30,16:00,UTC-05,USD,0.5714
BONO,Market Vectors LatAm Aggregate ,ETF,United States,09:30,16:00,UTC-05,USD,0.4000
LTM.SAN,LATAM Airlines Group S.A.,Equity,Chile/Santiago,09:30,16:00,UTC-03,CLP,0.4000
LFL.FRK,LATAM Airlines Group S.A.,Equity,Frankfurt,08:00,20:00,UTC+01,EUR,0.3077
MLD-UN.TRT,Moneda LatAm Corporate Bond Fund,Equity,Toronto,09:30,16:00,UTC-05,CAD,0.2759
XMLA.LON,db x-trackers - MSCI EM LatAm Index UCITS ETF,ETF,United Kingdom,08:00,16:30,UTC+00,GBP,0.2286
