symbol,name,type,region,marketOpen,marketClose,timezone,currency,matchScore
LSGRX,Loomis Sayles Growth Y,Mutual Fund,United States,09:30,16:00,UTC-05,USD,0.7500
LSGBX,Loomis Sayles Global Bond Instl,Mutual Fund,United States,09:30,16:00,UTC-05,USD,0.7500
LSGNX,Loomis Sayles Global Bond N,Mutual Fund,United States,09:30,16:00,UTC-05,USD,0.7500
LSGSX,Loomis Sayles Inflation Protected Secs I,Mutual Fund,United States,09:30,16:00,UTC-05,USD,0.7500
LSGOF,Land Securities Group plc,Equity,United States,09:30,16:00,UTC-05,USD,0.7500
LSGGX,Loomis Sayles Global Growth Y,Mutual Fund,United States,09:30,16:00,UTC-05,USD,0.7500
LSGLX,Loomis Sayles Global Bond Retail,Mutual Fund,United States,09:30,16:00,UTC-05,USD,0.7500
