symbol,name,type,region,marketOpen,marketClose,timezone,currency,matchScore
EDM1.BER,ISHSV-SPAIN GOVT BD LSHD,ETF,Berlin,08:00,20:00,UTC+01,EUR,0.2963
EUNB.MUN,ISHSII-JPM DL EM BD LSHD,ETF,Munich,08:00,20:00,UTC+01,EUR,0.2857
EUNC.MUN,ISHSII-US AGGREG.BD LSHD,ETF,Munich,08:00,20:00,UTC+01,EUR,0.2857
QDVZ.MUN,ISHSII-DL FR BD ETF LSHD,ETF,Munich,08:00,20:00,UTC+01,EUR,0.2857
2B7P.BER,ISHSIII-GL.GOV.BD LSHDIS.,ETF,Berlin,08:00,20:00,UTC+01,EUR,0.2857
2B7W.BER,IS GBL CORP BD U.ETF LSHD,ETF,Berlin,08:00,20:00,UTC+01,EUR,0.2759
EUND.MUN,ISHSII-DLHY CORP BD LSHDD,ETF,Munich,08:00,20:00,UTC+01,EUR,0.2759
IS0J.MUN,ISHSV-ITAL.GOVT BD LSHD,ETF,Munich,08:00,20:00,UTC+01,EUR,0.2759
