symbol,name,type,region,marketOpen,marketClose,timezone,currency,matchScore
LTC,LTC Properties Inc.,Equity,United States,09:30,16:00,UTC-05,USD,1.0000
LTCP,Life's Time Capsule Services Inc.,Equity,United States,09:30,16:00,UTC-05,USD,0.8571
LTCAX,Thornburg CA Limited-Term Muni A,Mutual Fund,United States,09:30,16:00,UTC-05,USD,0.7500
LTCFX,Alternative Strategies Fund Cla,Mutual Fund,United States,09:30,16:00,UTC-05,USD,0.7500
LTCCF,Lite Access Technologies Inc.,Equity,United States,09:30,16:00,UTC-05,USD,0.7500
LTCCX,Thornburg CA Limited-Term Muni C,Mutual Fund,United States,09:30,16:00,UTC-05,USD,0.7500
LTCIX,Thornburg CA Limited-Term Muni Instl,Mutual Fund,United States,09:30,16:00,UTC-05,USD,0.7500
