symbol,name,type,region,marketOpen,marketClose,timezone,currency,matchScore
NVMI,Nova Measuring Instruments Ltd.,Equity,United States,09:30,16:00,UTC-05,USD,0.8571
MEASX,Matthews Emerging Asia Investor,Mutual Fund,United States,09:30,16:00,UTC-05,USD,0.7500
MEAR,iShares Short Maturity Municipal Bd ETF,ETF,United States,09:30,16:00,UTC-05,USD,0.5000
MAYGF,Meadow Bay Gold Corporation,Equity,United States,09:30,16:00,UTC-05,USD,0.2857
MRPIX,Measured Risk Strategy I,Mutual Fund,United States,09:30,16:00,UTC-05,USD,0.2500
