symbol,name,type,region,marketOpen,marketClose,timezone,currency,matchScore
MEHQX,BlackRock Total Return Inv A1,Mutual Fund,United States,09:30,16:00,UTC-05,USD,0.7500
600056.SHH,China Meheco Group Co. Ltd.,Equity,Shanghai,09:30,15:00,UTC+08,CNY,0.6667
MEHAI.BSE,Mehai Technology Limited,Equity,India/Bombay,09:15,15:30,UTC+5.5,INR,0.5455
530723.BSE,Asit C. Mehta Financial Services Limited,Equity,India/Bombay,09:15,15:30,UTC+5.5,INR,0.4000
A1J3WK.FRK,DVAM Mehr Werte AMI,Mutual Fund,Frankfurt/XETRA,08:00,20:00,UTC+01,EUR,0.2727
MEH.PAR,Lyxor FTSE EPRA/NAREIT Dev EurpETFDisEUR,ETF,Paris,09:00,17:30,UTC+01,EUR,0.2143
MEDN.TAV,Mehadrin Ltd.,Equity,Tel Aviv,09:45,17:25,UTC+02,ILS,0.1935
YFP6.HAM,MEHRWERTPHASEN BALA.UI PT,ETF,Hamburg,08:00,20:00,UTC+01,EUR,0.1395
