symbol,name,type,region,marketOpen,marketClose,timezone,currency,matchScore
MEVIX,Lazard Managed Equity Volatility Instl,Mutual Fund,United States,09:30,16:00,UTC-05,USD,0.7500
MEVOX,Lazard Managed Equity Volatility Open,Mutual Fund,United States,09:30,16:00,UTC-05,USD,0.7500
M3V.STG,MeVis Medical Solutions AG Name,Equity,Stuttgart,08:00,20:00,UTC+01,EUR,0.5000
M3V.FRK,MeVis Medical Solutions AG,Equity,Frankfurt/XETRA,08:00,20:00,UTC+01,EUR,0.4444
M3V.DUS,MEVIS MEDICAL SOL.NA O.N.,Equity,Dusseldorf,08:30,20:00,UTC+01,EUR,0.4444
M3V.FRK,MeVis Medical Solutions AG,Equity,Frankfurt,08:00,20:00,UTC+01,EUR,0.4444
M3V.BER,MEVIS MEDICAL SOL.NA O.N.,Equity,Berlin,08:00,20:00,UTC+01,EUR,0.4444
M3V.MUN,MEVIS MEDICAL SOL.NA O.N.,Equity,Munich,08:00,20:00,UTC+01,EUR,0.4444
