symbol,name,type,region,marketOpen,marketClose,timezone,currency,matchScore
MIBLX,BNY Mellon Asset Allocation Inv,Mutual Fund,United States,09:30,16:00,UTC-05,USD,0.7500
MIBDX,BNY Mellon Bond Inv,Mutual Fund,United States,09:30,16:00,UTC-05,USD,0.7500
XBRMIB.MIL,Lyxor FTSE MIB Dly -2x Inv XBear ETF Acc,ETF,Milan,09:00,17:30,UTC+01,EUR,0.6667
CMB1.LON,iShares FTSE MIB ETF EUR Acc,ETF,United Kingdom,08:00,16:30,UTC+00,GBP,0.5000
CMIB.LON,iShares FTSE MIB ETF EUR Acc,ETF,United Kingdom,08:00,16:30,UTC+00,GBP,0.4444
ITBL.LON,Boost FTSE MIB Banks ETP,ETF,United Kingdom,08:00,16:30,UTC+00,GBP,0.4444
IT3S.MIL,ETFS 3x Daily Short FTSE MIB ETC,ETF,Milan,09:00,17:30,UTC+01,EUR,0.4000
