symbol,name,type,region,marketOpen,marketClose,timezone,currency,matchScore
MSHYX,Morgan Stanley Inst High Yield IS,Mutual Fund,United States,09:30,16:00,UTC-05,USD,0.8571
MSHLX,Morgan Stanley Inst Growth L,Mutual Fund,United States,09:30,16:00,UTC-05,USD,0.7500
MSHQX,BlackRock Total Return Svc,Mutual Fund,United States,09:30,16:00,UTC-05,USD,0.7500
MSHDX,Morgan Stanley Inst High Yield C,Mutual Fund,United States,09:30,16:00,UTC-05,USD,0.7500
MSHE,MSH Entertainment Corp.,Equity,United States,09:30,16:00,UTC-05,USD,0.7500
MSHEX,MainStay Absolute Return Multi-Strat C,Mutual Fund,United States,09:30,16:00,UTC-05,USD,0.7500
MSHAX,MassMutual Premier Short-Duration Bd A,Mutual Fund,United States,09:30,16:00,UTC-05,USD,0.7500
