symbol,name,type,region,marketOpen,marketClose,timezone,currency,matchScore
NCPCF,Nickel Creek Platinum Corp.,Equity,United States,09:30,16:00,UTC-05,USD,0.7500
NCPIX,Neuberger Berman Core Plus Institutional,Mutual Fund,United States,09:30,16:00,UTC-05,USD,0.7500
NCPAX,Neuberger Berman Core Plus A,Mutual Fund,United States,09:30,16:00,UTC-05,USD,0.7500
NCPRX,Neuberger Berman Core Plus R6,Mutual Fund,United States,09:30,16:00,UTC-05,USD,0.7500
NCPCX,Neuberger Berman Core Plus C,Mutual Fund,United States,09:30,16:00,UTC-05,USD,0.7500
NCP.TRT,Nickel Creek Platinum Corp.,Equity,Toronto,09:30,16:00,UTC-05,CAD,0.6667
NCPL-P.TRV,9 Capital Corp.,Equity,Toronto Venture,09:30,16:00,UTC-05,CAD,0.5455
