symbol,name,type,region,marketOpen,marketClose,timezone,currency,matchScore
NGJAX,Nuveen Global Real Estate Securities A,Mutual Fund,United States,09:30,16:00,UTC-05,USD,0.7500
NGJCX,Nuveen Global Real Estate Securities C,Mutual Fund,United States,09:30,16:00,UTC-05,USD,0.7500
NGJFX,Nuveen Global Real Estate Securities R6,Mutual Fund,United States,09:30,16:00,UTC-05,USD,0.7500
NGJIX,Nuveen Global Real Estate Securities I,Mutual Fund,United States,09:30,16:00,UTC-05,USD,0.7500
NGJ.FRK,NETGEAR Inc.,Equity,Frankfurt,08:00,20:00,UTC+01,EUR,0.7500
