symbol,name,type,region,marketOpen,marketClose,timezone,currency,matchScore
NIRAJ.BSE,Niraj Cement Structurals Limited,Equity,India/Bombay,09:15,15:30,UTC+5.5,INR,0.7273
1245.HKG,Niraku GC Holdings Inc.,Equity,Hong Kong,09:30,16:00,UTC+08,HKD,0.6667
NIRA.STG,PT Nippon Indosari Corpindo Tbk,Equity,Stuttgart,08:00,20:00,UTC+01,EUR,0.5333
512425.BSE,Nirav Commercials Limited,Equity,India/Bombay,09:15,15:30,UTC+5.5,INR,0.2857
532986.BSE,Niraj Cement Structurals Limited,Equity,India/Bombay,09:15,15:30,UTC+5.5,INR,0.2759
NIRAVCOM.BSE,Nirav Commercials Limited,Equity,India/Bombay,09:15,15:30,UTC+5.5,INR,0.2222
