symbol,name,type,region,marketOpen,marketClose,timezone,currency,matchScore
NMT,Nuveen Massachusetts Quality Mu,Equity,United States,09:30,16:00,UTC-05,USD,1.0000
NMTC,NeuroOne Medical Technologies Corporation,Equity,United States,09:30,16:00,UTC-05,USD,0.8571
NMTRX,Nuveen Municipal Total Return Mgd Accts,Mutual Fund,United States,09:30,16:00,UTC-05,USD,0.7500
NMTFX,Wells Fargo Minnesota Tx-Fr A,Mutual Fund,United States,09:30,16:00,UTC-05,USD,0.7500
NMTLF,New Age Metals Inc.,Equity,United States,09:30,16:00,UTC-05,USD,0.7500
NMT.AUS,Neometals Ltd,Equity,Australia,10:00,16:00,UTC+11,AUD,0.6667
NMTP.MOS,Public Joint Stock Company Novorossiysk Commercial Sea Port,Equity,Moscow,10:00,18:45,UTC+03,RUB,0.6000
