symbol,name,type,region,marketOpen,marketClose,timezone,currency,matchScore
NVHIX,Nuveen Short Duration Hi Yield Muni Bd I,Mutual Fund,United States,09:30,16:00,UTC-05,USD,0.7500
NVHAX,Nuveen Short Duration Hi Yield Muni Bd A,Mutual Fund,United States,09:30,16:00,UTC-05,USD,0.7500
NVHCX,Nuveen Short Duration Hi Yield Muni Bd C2,Mutual Fund,United States,09:30,16:00,UTC-05,USD,0.7500
NVH.TRV,Novoheart Holdings Inc.,Equity,Toronto Venture,09:30,16:00,UTC-05,CAD,0.7500
NVHO11.SAO,NOVO HORIZONTE FD,Equity,Brazil/Sao Paolo,10:00,17:30,UTC-02,BRL,0.5000
