symbol,name,type,region,marketOpen,marketClose,timezone,currency,matchScore
NWARF,Norwegian Air Shuttle ASA,Equity,United States,09:30,16:00,UTC-05,USD,0.8571
NWAIX,Nuveen Winslow International Sm Cp A,Mutual Fund,United States,09:30,16:00,UTC-05,USD,0.7500
NWAFX,Nationwide Destination 2020 A,Mutual Fund,United States,09:30,16:00,UTC-05,USD,0.7500
NWADX,Nationwide Loomis All Cap Gr Eagle,Mutual Fund,United States,09:30,16:00,UTC-05,USD,0.7500
NWABX,Nationwide R6,Mutual Fund,United States,09:30,16:00,UTC-05,USD,0.7500
NWAU,Consumer Automotive Finance Inc.,Equity,United States,09:30,16:00,UTC-05,USD,0.7500
NWAEX,Nationwide Dynamic US Growth Eagle,Mutual Fund,United States,09:30,16:00,UTC-05,USD,0.7500
