symbol,name,type,region,marketOpen,marketClose,timezone,currency,matchScore
ODP,Office Depot Inc.,Equity,United States,09:30,16:00,UTC-05,USD,0.8000
OMEX,Odyssey Marine Exploration Inc.,Equity,United States,09:30,16:00,UTC-05,USD,0.8000
ODFL,Old Dominion Freight Line Inc.,Equity,United States,09:30,16:00,UTC-05,USD,0.8000
ODMAX,Oppenheimer Developing Markets A,Mutual Fund,United States,09:30,16:00,UTC-05,USD,0.6667
ODC,Oil-Dri Corporation of America,Equity,United States,09:30,16:00,UTC-05,USD,0.5714
ODVYX,Oppenheimer Developing Markets Y,Mutual Fund,United States,09:30,16:00,UTC-05,USD,0.5714
ODT,Odonate Therapeutics Inc.,Equity,United States,09:30,16:00,UTC-05,USD,0.5714
ODVIX,Oppenheimer Developing Markets I,Mutual Fund,United States,09:30,16:00,UTC-05,USD,0.5714
ODVNX,Oppenheimer Developing Markets R,Mutual Fund,United States,09:30,16:00,UTC-05,USD,0.5714
ODIYX,Oppenheimer Discovery Y,Mutual Fund,United States,09:30,16:00,UTC-05,USD,0.3333
