symbol,name,type,region,marketOpen,marketClose,timezone,currency,matchScore
OUT,Outfront Media Inc.,Equity,United States,09:30,16:00,UTC-05,USD,0.8000
OUSA,O'Shares FTSE US Quality Dividend ETF,ETF,United States,09:30,16:00,UTC-05,USD,0.6667
OUSM,O'Shares FTSE Russell Sm Cp Qual Div,ETF,United States,09:30,16:00,UTC-05,USD,0.6667
OPCO,OurPet's Company,Equity,United States,09:30,16:00,UTC-05,USD,0.6667
OUNZ,VanEck Merk Gold Trust,ETF,United States,09:30,16:00,UTC-05,USD,0.5714
OUSGX,Oppenheimer Limited-Term Bond A,Mutual Fund,United States,09:30,16:00,UTC-05,USD,0.5714
OUSCX,Oppenheimer Limited-Term Bond C,Mutual Fund,United States,09:30,16:00,UTC-05,USD,0.5714
OUSYX,Oppenheimer Limited-Term Bond Y,Mutual Fund,United States,09:30,16:00,UTC-05,USD,0.5714
OUTKY,Outokumpu Oyj,Equity,United States,09:30,16:00,UTC-05,USD,0.5714
OUSIX,Oppenheimer Limited Term Bond I,Mutual Fund,United States,09:30,16:00,UTC-05,USD,0.3333
