symbol,name,type,region,marketOpen,marketClose,timezone,currency,matchScore
PBA,Pembina Pipeline Corporation,Equity,United States,09:30,16:00,UTC-05,USD,1.0000
PBAM,Private Bancorp of America Inc.,Equity,United States,09:30,16:00,UTC-05,USD,0.8571
PBAPX,Principal SAM Balanced R3,Mutual Fund,United States,09:30,16:00,UTC-05,USD,0.7500
PBAIX,BlackRock Tactical Opportunities Instl,Mutual Fund,United States,09:30,16:00,UTC-05,USD,0.7500
PBAKX,BlackRock Tactical Opportunities K,Mutual Fund,United States,09:30,16:00,UTC-05,USD,0.7500
PBAAX,PNC Balanced Allocation A,Mutual Fund,United States,09:30,16:00,UTC-05,USD,0.7500
PBA25.ARG,Buenos Aires (Province of) FRN 04/2025 ARS,Equity,Argentina,11:00,17:00,UTC-03,ARS,0.5455
PBAINFRA.BSE,PBA Infrastructure Limited,Equity,India/Bombay,09:15,15:30,UTC+5.5,INR,0.4286
5041.KLA,PBA Holdings Bhd,Equity,Malaysia,09:00,17:00,UTC+08,MYR,0.3158
