symbol,name,type,region,marketOpen,marketClose,timezone,currency,matchScore
PBD,Invesco Global Clean Energy ETF,ETF,United States,09:30,16:00,UTC-05,USD,1.0000
PBDAX,PIMCO Investment Grade Credit Bond A,Mutual Fund,United States,09:30,16:00,UTC-05,USD,0.8571
PBDCX,PIMCO Investment Grade Credit Bond C,Mutual Fund,United States,09:30,16:00,UTC-05,USD,0.7500
PBDPX,PIMCO Investment Grade Credit Bond I-2,Mutual Fund,United States,09:30,16:00,UTC-05,USD,0.7500
PBDIX,T. Rowe Price US Bond Enhanced Index,Mutual Fund,United States,09:30,16:00,UTC-05,USD,0.7500
PBDM,Invesco PureBeta FTSE Dev ex-NrthAmr ETF,ETF,United States,09:30,16:00,UTC-05,USD,0.7500
