symbol,name,type,region,marketOpen,marketClose,timezone,currency,matchScore
PCDAF,Postmedia Network Canada Corp.,Equity,United States,09:30,16:00,UTC-05,USD,0.7500
PCDAX,PIMCO CA Sh Dur Municipal Income A,Mutual Fund,United States,09:30,16:00,UTC-05,USD,0.7500
PCDIX,PIMCO CA Sh Dur Municipal Income Instl,Mutual Fund,United States,09:30,16:00,UTC-05,USD,0.7500
PCDPX,PIMCO CA Sh Dur Municipal Income I2,Mutual Fund,United States,09:30,16:00,UTC-05,USD,0.7500
PCDVF,Pacific Century Regional Developments Limited,Equity,United States,09:30,16:00,UTC-05,USD,0.7500
PCDGX,Pinnacle Dynamic Growth C,Mutual Fund,United States,09:30,16:00,UTC-05,USD,0.7500
PCD1.FRK,Encana Corporation,Equity,Frankfurt,08:00,20:00,UTC+01,EUR,0.6667
PCD1.STG,EnCana Corp. Registered Shares ,Equity,Stuttgart,08:00,20:00,UTC+01,EUR,0.6000
PCD1.BER,ENCANA CORP.,Equity,Berlin,08:00,20:00,UTC+01,EUR,0.6000
