symbol,name,type,region,marketOpen,marketClose,timezone,currency,matchScore
PEWIX,PNC Multi-Factor Large Cap Growth I,Mutual Fund,United States,09:30,16:00,UTC-05,USD,0.7500
PEWAX,PNC Multi-Factor Large Cap Growth A,Mutual Fund,United States,09:30,16:00,UTC-05,USD,0.7500
PEWCX,PNC Multi-Factor Large Cap Growth C,Mutual Fund,United States,09:30,16:00,UTC-05,USD,0.7500
PEW.LON,Premier Energy and Water Ord/Inc,Mutual Fund,United Kingdom,08:00,16:30,UTC+00,GBP,0.7500
PEW.FRK,PCTEL Inc.,Equity,Frankfurt,08:00,20:00,UTC+01,EUR,0.7500
PEW.BER,"PC-TEL INC.  DL-,001",Equity,Berlin,08:00,20:00,UTC+01,EUR,0.6667
PEW.MUN,"PC-TEL INC.  DL-,001",Equity,Munich,08:00,20:00,UTC+01,EUR,0.6667
PEW.STG,PC-TEL INC. Registered Shares D,Equity,Stuttgart,08:00,20:00,UTC+01,EUR,0.6667
