symbol,name,type,region,marketOpen,marketClose,timezone,currency,matchScore
PFTI,Puradyn Filter Technologies Inc.,Equity,United States,09:30,16:00,UTC-05,USD,0.8571
PFTPX,PIMCO Low Duration Income I2,Mutual Fund,United States,09:30,16:00,UTC-05,USD,0.7500
PFTEX,RiskPro Tactical 0-30 R,Mutual Fund,United States,09:30,16:00,UTC-05,USD,0.7500
PFTCX,PIMCO Short-Term C,Mutual Fund,United States,09:30,16:00,UTC-05,USD,0.7500
CGIICX,Claymore Sec Def Pft Srs 588 Cl,Mutual Fund,United States,09:30,16:00,UTC-05,USD,0.6667
CGIITX,"Claymore Sec Def Pft,Srs 656 Cl",Mutual Fund,United States,09:30,16:00,UTC-05,USD,0.2222
CGIISX,Claymore Sec Def Pft Srs 655 Cl,Mutual Fund,United States,09:30,16:00,UTC-05,USD,0.1765
PFT.MIL,Invesco FTSE RAFI US 1000 ETF,ETF,Milan,09:00,17:30,UTC+01,EUR,0.1765
