symbol,name,type,region,marketOpen,marketClose,timezone,currency,matchScore
PMHCX,PIMCO EqS Long/Short C,Mutual Fund,United States,09:30,16:00,UTC-05,USD,0.8571
PMHBX,PIMCO EqS Long/Short I2,Mutual Fund,United States,09:30,16:00,UTC-05,USD,0.7500
PMHAX,PIMCO EqS Long/Short A,Mutual Fund,United States,09:30,16:00,UTC-05,USD,0.7500
PMHG,Prime Meridian Holding Company,Equity,United States,09:30,16:00,UTC-05,USD,0.7500
PMHIX,PIMCO EqS Long/Short Institutional,Mutual Fund,United States,09:30,16:00,UTC-05,USD,0.7500
PMHYX,PGIM Muni High Income B,Mutual Fund,United States,09:30,16:00,UTC-05,USD,0.7500
PMHNX,PIMCO EqS Long/Short I-3,Mutual Fund,United States,09:30,16:00,UTC-05,USD,0.7500
PMH.BER,"SPAR GROUP INC.  DL-,01",Equity,Berlin,08:00,20:00,UTC+01,EUR,0.6667
