symbol,name,type,region,marketOpen,marketClose,timezone,currency,matchScore
PNPL,Pineapple Express Inc.,Equity,United States,09:30,16:00,UTC-05,USD,0.8571
PNPFF,Pinetree Capital Ltd.,Equity,United States,09:30,16:00,UTC-05,USD,0.7500
PNPRX,Putnam International Growth R,Mutual Fund,United States,09:30,16:00,UTC-05,USD,0.7500
PNP.TRT,Pinetree Capital Ltd.,Equity,Toronto,09:30,16:00,UTC-05,CAD,0.7500
PNP.STG,PNC FINANCIAL SERVICES GROUP Re,Equity,Stuttgart,08:00,20:00,UTC+01,EUR,0.6667
PNP.BER,PNC FINL SERVICES GRP DL5,Equity,Berlin,08:00,20:00,UTC+01,EUR,0.6667
PNP.MUN,PNC FINL SERVICES GRP DL5,Equity,Munich,08:00,20:00,UTC+01,EUR,0.6667
PNP.FRK,The PNC Financial Services Group Inc.,Equity,Frankfurt,08:00,20:00,UTC+01,EUR,0.6667
PNP.DUS,PNC FINL SERVICES GRP DL5,Equity,Dusseldorf,08:30,20:00,UTC+01,EUR,0.6667
