symbol,name,type,region,marketOpen,marketClose,timezone,currency,matchScore
120030.KOR,CHOSUN WELDING POHANG Co. Ltd.,Equity,Korea,09:00,15:30,UTC+09,KRW,0.2353
F00000NUMJ.KOR,KB Pohang Water Recycling Project Private Special Asset Money Bond,Mutual Fund,Korea,09:00,15:30,UTC+09,KRW,0.1176
KR5206AX5830.KOR,Kiwoom Pohang Clean Water Love Private Special Asset Infra Business,Mutual Fund,Korea,09:00,15:30,UTC+09,KRW,0.1143
KR5223A81086.KOR,KB Pohang Water Recycling Project Private Special Asset Money Bond,Mutual Fund,Korea,09:00,15:30,UTC+09,KRW,0.1143
F00000UPR3.KOR,Kiwoom Pohang Clean Water Love Private Special Asset Infra Business,Mutual Fund,Korea,09:00,15:30,UTC+09,KRW,0.1127
