symbol,name,type,region,marketOpen,marketClose,timezone,currency,matchScore
PPSIX,Principal Preferred Securities Inst,Mutual Fund,United States,09:30,16:00,UTC-05,USD,0.8571
PPSI,Pioneer Power Solutions Inc.,Equity,United States,09:30,16:00,UTC-05,USD,0.8571
PPSTF,Pepsi-Cola Products Philippines Inc.,Equity,United States,09:30,16:00,UTC-05,USD,0.8571
PPSAX,Principal Preferred Securities A,Mutual Fund,United States,09:30,16:00,UTC-05,USD,0.7500
PPSC,PortfolioPlus S&P Small Cap ETF,ETF,United States,09:30,16:00,UTC-05,USD,0.7500
PPSF,Peoples-Sidney Financial Corporation,Equity,United States,09:30,16:00,UTC-05,USD,0.7500
PPSJX,Principal Preferred Securities J,Mutual Fund,United States,09:30,16:00,UTC-05,USD,0.7500
PPSSX,Principal Large Cap Value III R4,Mutual Fund,United States,09:30,16:00,UTC-05,USD,0.7500
PPSRX,Principal Large Cap Value III R5,Mutual Fund,United States,09:30,16:00,UTC-05,USD,0.7500
