symbol,name,type,region,marketOpen,marketClose,timezone,currency,matchScore
PPUPX,Principal LargeCap Growth I R5,Mutual Fund,United States,09:30,16:00,UTC-05,USD,0.7500
PPUMX,Principal LargeCap Growth I R3,Mutual Fund,United States,09:30,16:00,UTC-05,USD,0.7500
PPUCX,PIMCO StocksPLUS Intl (Unhedged) C,Mutual Fund,United States,09:30,16:00,UTC-05,USD,0.7500
PPUNX,Principal LargeCap Growth I R2,Mutual Fund,United States,09:30,16:00,UTC-05,USD,0.7500
PPUSX,Principal LargeCap Growth I R4,Mutual Fund,United States,09:30,16:00,UTC-05,USD,0.7500
PPUAX,PIMCO StocksPLUS Intl (Unhedged) A,Mutual Fund,United States,09:30,16:00,UTC-05,USD,0.7500
