symbol,name,type,region,marketOpen,marketClose,timezone,currency,matchScore
PSF,Cohen & Steers Select Preferred and Income Fund Inc.,Equity,United States,09:30,16:00,UTC-05,USD,1.0000
PSFYX,PACE Strategic Fixed Income Y,Mutual Fund,United States,09:30,16:00,UTC-05,USD,0.7500
PSFIX,Virtus Newfleet Senior Floating Rate I,Mutual Fund,United States,09:30,16:00,UTC-05,USD,0.7500
PSFAX,PIMCO Short-Term Admin,Mutual Fund,United States,09:30,16:00,UTC-05,USD,0.7500
PSFRX,Virtus Newfleet Senior Floating Rate A,Mutual Fund,United States,09:30,16:00,UTC-05,USD,0.7500
PSFE.FRK,IMII-I.EUR.CORPORATE BD A,ETF,Frankfurt,08:00,20:00,UTC+01,EUR,0.6667
PSFE.FRK,Invesco Euro Corporate Bond ETF,ETF,Frankfurt/XETRA,08:00,20:00,UTC+01,EUR,0.6667
PSF.MIL,Poligrafica S. Faustino S.p.A.,Equity,Milan,09:00,17:30,UTC+01,EUR,0.6000
PSFE.MIL,INVESCO EURO CORPORATE BOND UCI,ETF,Milan,09:00,17:30,UTC+01,EUR,0.6000
