symbol,name,type,region,marketOpen,marketClose,timezone,currency,matchScore
PSL,Invesco DWA Consumer Staples Mom ETF,ETF,United States,09:30,16:00,UTC-05,USD,1.0000
PSLV,Sprott Physical Silver Trust,ETF,United States,09:30,16:00,UTC-05,USD,0.8571
PSLDX,PIMCO StocksPLUS Long Duration Instl,Mutual Fund,United States,09:30,16:00,UTC-05,USD,0.7500
PSLAX,Putnam Small Cap Value A,Mutual Fund,United States,09:30,16:00,UTC-05,USD,0.7500
PSLMX,Putnam Small Cap Value M,Mutual Fund,United States,09:30,16:00,UTC-05,USD,0.7500
PSLGX,Putnam Sustainable Leaders R6,Mutual Fund,United States,09:30,16:00,UTC-05,USD,0.7500
PSLIX,Principal SmallCap Inst,Mutual Fund,United States,09:30,16:00,UTC-05,USD,0.7500
PSLRX,Putnam Small Cap Value R5,Mutual Fund,United States,09:30,16:00,UTC-05,USD,0.7500
