symbol,name,type,region,marketOpen,marketClose,timezone,currency,matchScore
RLCBX,Ryan Labs Core Bond,Mutual Fund,United States,09:30,16:00,UTC-05,USD,0.7500
RLCAX,Columbia Disciplined Value A,Mutual Fund,United States,09:30,16:00,UTC-05,USD,0.7500
RLCOX,Columbia Disciplined Value R,Mutual Fund,United States,09:30,16:00,UTC-05,USD,0.7500
RLCIX,Lazard US Corporate Income R6,Mutual Fund,United States,09:30,16:00,UTC-05,USD,0.7500
RLCWX,Columbia Disciplined Value T,Mutual Fund,United States,09:30,16:00,UTC-05,USD,0.7500
RLC.AUS,Reedy Lagoon Corporation Limited,Equity,Australia,10:00,16:00,UTC+11,AUD,0.6667
