symbol,name,type,region,marketOpen,marketClose,timezone,currency,matchScore
RMOCX,Victory RS Mid Cap Growth C,Mutual Fund,United States,09:30,16:00,UTC-05,USD,0.7500
RMOYX,Victory RS Mid Cap Growth Y,Mutual Fund,United States,09:30,16:00,UTC-05,USD,0.7500
RMORX,Victory RS Mid Cap Growth R6,Mutual Fund,United States,09:30,16:00,UTC-05,USD,0.7500
RMOAX,RiverFront Asset Allocation Moderate A,Mutual Fund,United States,09:30,16:00,UTC-05,USD,0.7500
RMO.TRV,Rainy Mountain Royalty Corp,Equity,Toronto Venture,09:30,16:00,UTC-05,CAD,0.7500
RMO.DUS,RM Rheiner Management AG,Equity,Dusseldorf,08:30,20:00,UTC+01,EUR,0.6667
