symbol,name,type,region,marketOpen,marketClose,timezone,currency,matchScore
RTFAX,Rational Income Opportunities A,Mutual Fund,United States,09:30,16:00,UTC-05,USD,0.7500
RTFCX,Rational Income Opportunities C,Mutual Fund,United States,09:30,16:00,UTC-05,USD,0.7500
RTFIX,Rational Income Opportunities Instl,Mutual Fund,United States,09:30,16:00,UTC-05,USD,0.7500
RTFL.BSE,Real Touch Finance Limited,Equity,India/Bombay,09:15,15:30,UTC+5.5,INR,0.6000
LYYV.BER,LYXOR RTF ST.E.600 P.H. A,ETF,Berlin,08:00,20:00,UTC+01,EUR,0.2143
LYYV.DUS,LYXOR RTF ST.E.600 P.H. A,ETF,Dusseldorf,08:30,20:00,UTC+01,EUR,0.2143
LYYV.HAM,LYXOR RTF ST.E.600 P.H. A,ETF,Hamburg,08:00,20:00,UTC+01,EUR,0.2143
LYYV.MUN,LYXOR RTF ST.E.600 P.H. A,ETF,Munich,08:00,20:00,UTC+01,EUR,0.2143
