symbol,name,type,region,marketOpen,marketClose,timezone,currency,matchScore
SGFFX,Sparrow Growth A,Mutual Fund,United States,09:30,16:00,UTC-05,USD,0.7500
SGFAX,Strategic Global Long/Short A,Mutual Fund,United States,09:30,16:00,UTC-05,USD,0.7500
SGFCX,Sparrow Growth C,Mutual Fund,United States,09:30,16:00,UTC-05,USD,0.7500
SGF.BAK,SGF Capital Public Company Limited,Equity,Thailand,10:00,16:30,UTC+07,THB,0.6667
SGF.AUS,SG Fleet Group Limited,Equity,Australia,10:00,16:00,UTC+11,AUD,0.6667
SGFL-EQ.NSE,SHREE GANESH FORG,Equity,India/NSE,09:15,15:30,UTC+5.5,INR,0.6000
SGFL.BSE,Shree Ganesh Forgings Limited,Equity,India/Bombay,09:15,15:30,UTC+5.5,INR,0.6000
SGFL.NSE,Shree Ganesh Forgings Limited,Equity,India/NSE,09:15,15:30,UTC+5.5,INR,0.5455
SGF-R.BAK,SGF Capital Public Company Limited,Equity,Thailand,10:00,16:30,UTC+07,THB,0.4615
