symbol,name,type,region,marketOpen,marketClose,timezone,currency,matchScore
SGGDX,First Eagle Gold A,Mutual Fund,United States,09:30,16:00,UTC-05,USD,0.8889
SGGDF,Sage Gold Inc.,Equity,United States,09:30,16:00,UTC-05,USD,0.8889
SGGD.LON,Surgutneftegas Public Joint Stock Company,Equity,United Kingdom,08:00,16:30,UTC+00,GBP,0.8000
SGGD.ILN,SURGUTNEFTEGAS PUBLIC JOINT STO,Equity,United Kingdom,08:00,16:30,UTC+00,GBP,0.7273
SGGD.VIE,Surgutneftegas Public Joint Stock Company,Equity,Vienna,08:55,17:35,UTC+01,EUR,0.7273
