symbol,name,type,region,marketOpen,marketClose,timezone,currency,matchScore
SHPHF,Sihuan Pharmaceutical Holdings Group Ltd.,Equity,United States,09:30,16:00,UTC-05,USD,0.7500
SIHAX,Guggenheim High Yield A,Mutual Fund,United States,09:30,16:00,UTC-05,USD,0.7500
SIHPX,Guggenheim High Yield P,Mutual Fund,United States,09:30,16:00,UTC-05,USD,0.7500
SIHSX,Guggenheim High Yield C,Mutual Fund,United States,09:30,16:00,UTC-05,USD,0.7500
SIHL.LON,Symphony International Holdings Limited,Equity,United Kingdom,08:00,16:30,UTC+00,GBP,0.6667
0460.HKG,Sihuan Pharmaceutical Holdings Group Ltd.,Equity,Hong Kong,09:30,16:00,UTC+08,HKD,0.5000
SIH.FRK,Saracen Mineral Holdings Limited,Equity,Frankfurt,08:00,20:00,UTC+01,EUR,0.3333
ORY.HAM,SIHAYO GOLD LTD,Equity,Hamburg,08:00,20:00,UTC+01,EUR,0.2000
