symbol,name,type,region,marketOpen,marketClose,timezone,currency,matchScore
SKYZF,SKYCITY Entertainment Group Limited,Equity,United States,09:30,16:00,UTC-05,USD,0.8889
SKYCX,SkyBridge Dividend Value C,Mutual Fund,United States,09:30,16:00,UTC-05,USD,0.6667
SCT.TRV,Skychain Technologies Inc.,Equity,Toronto Venture,09:30,16:00,UTC-05,CAD,0.6000
SKC.AUS,SKYCITY Entertainment Group Limited,Equity,Australia,10:00,16:00,UTC+11,AUD,0.4444
RX4.STG,Skycity Entertainment Grp Ltd.R,Equity,Stuttgart,08:00,20:00,UTC+01,EUR,0.2759
RX4.BER,SKYCITY ENTERTAINM.GR.LTD,Equity,Berlin,08:00,20:00,UTC+01,EUR,0.2286
