symbol,name,type,region,marketOpen,marketClose,timezone,currency,matchScore
SUUIF,Superior Plus Corp.,Equity,United States,09:30,16:00,UTC-05,USD,0.7500
SUUS.LON,iShares IV Public Limited Company - iShares Sustainable MSCI USA SRI UCITS ETF,ETF,United Kingdom,08:00,16:30,UTC+00,GBP,0.7500
SUU.FRK,SunTrust Banks Inc.,Equity,Frankfurt,08:00,20:00,UTC+01,EUR,0.6667
SUU.DUS,SUNTRUST BANKS INC.  DL 1,Equity,Dusseldorf,08:30,20:00,UTC+01,EUR,0.6667
SUU.BER,SUNTRUST BANKS INC.  DL 1,Equity,Berlin,08:00,20:00,UTC+01,EUR,0.6667
SUU.MUN,SUNTRUST BANKS INC.  DL 1,Equity,Munich,08:00,20:00,UTC+01,EUR,0.6667
SUU.STG,SUNTRUST BANKS INC. Registered ,Equity,Stuttgart,08:00,20:00,UTC+01,EUR,0.6667
SUUB.BER,SUNTRUST BANKS DEP. PFD G,Equity,Berlin,08:00,20:00,UTC+01,EUR,0.6000
SUULD-SM.NSE,SUUMAYA LIFESTYLE,Equity,India/NSE,09:15,15:30,UTC+5.5,INR,0.4286
