symbol,name,type,region,marketOpen,marketClose,timezone,currency,matchScore
TKTCY,TalkTalk Telecom Group PLC,Equity,United States,09:30,16:00,UTC-05,USD,0.7500
TKTT.PAR,Tarkett S.A.,Equity,Paris,09:00,17:30,UTC+01,EUR,0.7500
TKT.BAK,T.Krungthai Industries Public Company Limited,Equity,Thailand,10:00,16:30,UTC+07,THB,0.6667
TKT.FRK,"Tohoku Electric Power Company, Incorporated",Equity,Frankfurt,08:00,20:00,UTC+01,EUR,0.6000
TKT-R.BAK,T.Krungthai Industries Public Company Limited,Equity,Thailand,10:00,16:30,UTC+07,THB,0.5455
TKTTN.MEX,Tarkett S.A.,Equity,Mexico,08:30,15:00,UTC-06,MXP,0.5455
