symbol,name,type,region,marketOpen,marketClose,timezone,currency,matchScore
TLEH,FlexShares Ccy Hdgd MS EM Fct TiltIdx,ETF,United States,09:30,16:00,UTC-05,USD,0.8571
TLED,Light Engine Design Corp.,Equity,United States,09:30,16:00,UTC-05,USD,0.8571
TLEIX,AMG Trilogy Emerging Markets Equity Z,Mutual Fund,United States,09:30,16:00,UTC-05,USD,0.7500
TLESX,AMG Trilogy Emerging Markets Equity I,Mutual Fund,United States,09:30,16:00,UTC-05,USD,0.7500
TLEQX,TIAA-CREF Life Small-Cap Equity,Mutual Fund,United States,09:30,16:00,UTC-05,USD,0.7500
TLEVX,AMG Trilogy Emerging Markets Equity N,Mutual Fund,United States,09:30,16:00,UTC-05,USD,0.7500
