symbol,name,type,region,marketOpen,marketClose,timezone,currency,matchScore
TQMVX,T. Rowe Price QM US Value Equity,Mutual Fund,United States,09:30,16:00,UTC-05,USD,0.7500
TQMIX,AMG TimesSquare Mid Cap Growth I,Mutual Fund,United States,09:30,16:00,UTC-05,USD,0.7500
TQM.FRK,Tanami Gold NL,Equity,Frankfurt,08:00,20:00,UTC+01,EUR,0.7500
TQM.HAM,TANAMI GOLD,Equity,Hamburg,08:00,20:00,UTC+01,EUR,0.6667
TQM.STG,TANAMI GOLD N.L. Registered Sha,Equity,Stuttgart,08:00,20:00,UTC+01,EUR,0.6667
TQM.BAK,TQM Corporation Public Company Limited,Equity,Thailand,10:00,16:30,UTC+07,THB,0.6667
TQM-R.BAK,TQM Corporation Public Company Limited,Equity,Thailand,10:00,16:30,UTC+07,THB,0.5455
