symbol,name,type,region,marketOpen,marketClose,timezone,currency,matchScore
TWM,ProShares UltraShort Russell2000,ETF,United States,09:30,16:00,UTC-05,USD,1.0000
TWMC,Trans World Entertainment Corporation,Equity,United States,09:30,16:00,UTC-05,USD,0.8571
TWMIX,American Century Emerging Markets Inv,Mutual Fund,United States,09:30,16:00,UTC-05,USD,0.7500
TWMIF,Tidewater Midstream and Infrastructure Ltd.,Equity,United States,09:30,16:00,UTC-05,USD,0.7500
TWMTX,Transamerica US Growth T,Mutual Fund,United States,09:30,16:00,UTC-05,USD,0.7500
