symbol,name,type,region,marketOpen,marketClose,timezone,currency,matchScore
F00000T0TA.KOR,TongYang MD Sgrp LT TxDct Fdr Eq Bal 1 C,Mutual Fund,Korea,09:00,15:30,UTC+09,KRW,0.2000
F00000T0TU.KOR,SHBNPP Goodmrng Hope TxDct Fdr Eq C1,Mutual Fund,Korea,09:00,15:30,UTC+09,KRW,0.1951
KR5105AP8596.KOR,Samsung Kor SM50 LT TxDct Fdr Bd Bal1 Ce,Mutual Fund,Korea,09:00,15:30,UTC+09,KRW,0.1905
KR5105AP8604.KOR,Samsung Kor SM50 LT TxDct Fdr Bd Bal1 ST,Mutual Fund,Korea,09:00,15:30,UTC+09,KRW,0.1860
KR5105AP9529.KOR,Samsung Kor LT TxDct Fdr Eq-Deriv 1 C,Mutual Fund,Korea,09:00,15:30,UTC+09,KRW,0.1860
KR5105AP9545.KOR,Samsung Kor LT TxDct Fdr Eq-Deriv 1 ST,Mutual Fund,Korea,09:00,15:30,UTC+09,KRW,0.1818
KR5107AP9634.KOR,TongYang SM HD LT TxDct Fdr Eq Bal 1 Ce,Mutual Fund,Korea,09:00,15:30,UTC+09,KRW,0.1818
KR5107AP9642.KOR,TongYang SM HD LT TxDct Fdr Eq Bal 1 ST,Mutual Fund,Korea,09:00,15:30,UTC+09,KRW,0.1818
KR5107AP9667.KOR,TongYang MD Sgrp LT TxDct Fdr Eq Bal 1 C,Mutual Fund,Korea,09:00,15:30,UTC+09,KRW,0.1818
