symbol,name,type,region,marketOpen,marketClose,timezone,currency,matchScore
ORIG,Ocean Rig UDW Inc.,Equity,United States,09:30,16:00,UTC-05,USD,0.6667
9ORN.DUS,OCEAN RIG UDW INC. A,Equity,Dusseldorf,08:30,20:00,UTC+01,EUR,0.6667
9ORN.FRK,Ocean Rig UDW Inc.,Equity,Frankfurt,08:00,20:00,UTC+01,EUR,0.2857
UDW.MUN,AB Vilkyskiu pienine,Equity,Munich,08:00,20:00,UTC+01,EUR,0.2857
UDW.STG,AB Vilkyskiu pienine Registered,Equity,Stuttgart,08:00,20:00,UTC+01,EUR,0.2609
9ORN.STG,Ocean Rig UDW Inc. Registered S,Equity,Stuttgart,08:00,20:00,UTC+01,EUR,0.1765
