symbol,name,type,region,marketOpen,marketClose,timezone,currency,matchScore
UFPI,Universal Forest Products Inc.,Equity,United States,09:30,16:00,UTC-05,USD,0.8571
UFPT,UFP Technologies Inc.,Equity,United States,09:30,16:00,UTC-05,USD,0.8571
UFPIX,ProFunds UltraShort Latin America Inv,Mutual Fund,United States,09:30,16:00,UTC-05,USD,0.7500
UFPSX,ProFunds UltraShort Latin America Svc,Mutual Fund,United States,09:30,16:00,UTC-05,USD,0.7500
UFP.BER,"UFP TECHS INC.  DL-,01",Equity,Berlin,08:00,20:00,UTC+01,EUR,0.6667
