symbol,name,type,region,marketOpen,marketClose,timezone,currency,matchScore
UKEM.BAK,Union Petrochemical Public Company Limited,Equity,Thailand,10:00,16:30,UTC+07,THB,0.6000
UKEM-R.BAK,Union Petrochemical Public Company Limited,Equity,Thailand,10:00,16:30,UTC+07,THB,0.5000
UKEUAH.SWI,UBS ETF MSCI United Kingdom H EUR A dis,ETF,Switzerland,09:00,17:30,UTC+01,CHF,0.5000
UKEUBH.MIL,UBS ETF MSCI United Kingdom H EUR A acc,ETF,Milan,09:00,17:30,UTC+01,EUR,0.5000
UKEUBH.SWI,UBS ETF MSCI United Kingdom H EUR A acc,ETF,Switzerland,09:00,17:30,UTC+01,CHF,0.5000
