symbol,name,type,region,marketOpen,marketClose,timezone,currency,matchScore
FRAK,VanEck Vectors Unconvnt Oil & Gas ETF,ETF,United States,09:30,16:00,UTC-05,USD,0.7500
CIUEX,Six Circles International Uncon Eq,Mutual Fund,United States,09:30,16:00,UTC-05,USD,0.7500
AGSIX,AB Unconstrained Bond Advisor,Mutual Fund,United States,09:30,16:00,UTC-05,USD,0.5000
UNCFF,UniCredit S.p.A.,Equity,United States,09:30,16:00,UTC-05,USD,0.5000
UNCHF,Unicharm Corporation,Equity,United States,09:30,16:00,UTC-05,USD,0.2500
JUCIX,Janus Henderson Global Uncons Bd I,Mutual Fund,United States,09:30,16:00,UTC-05,USD,0.2500
AGSBX,AB Unconstrained Bond B,Mutual Fund,United States,09:30,16:00,UTC-05,USD,0.2500
CRUPX,Cedar Ridge Unconstrained Credit Inv,Mutual Fund,United States,09:30,16:00,UTC-05,USD,0.2308
PUCAX,PGIM Unconstrained Bond A,Mutual Fund,United States,09:30,16:00,UTC-05,USD,0.1875
MWCRX,Metropolitan West Unconstrained Bd M,Mutual Fund,United States,09:30,16:00,UTC-05,USD,0.1500
