symbol,name,type,region,marketOpen,marketClose,timezone,currency,matchScore
UTMD,Utah Medical Products Inc.,Equity,United States,09:30,16:00,UTC-05,USD,0.7500
PUB,People's Utah Bancorp,Equity,United States,09:30,16:00,UTC-05,USD,0.7500
UTACX,Aquila Tax-Free Fund For Utah C,Mutual Fund,United States,09:30,16:00,UTC-05,USD,0.7500
UTAHX,Aquila Tax-Free Fund For Utah A,Mutual Fund,United States,09:30,16:00,UTC-05,USD,0.7500
UTAFX,Aquila Tax-Free Fund For Utah F,Mutual Fund,United States,09:30,16:00,UTC-05,USD,0.5714
UTAYX,Aquila Tax-Free Fund For Utah Y,Mutual Fund,United States,09:30,16:00,UTC-05,USD,0.3333
SKRN.JKT,PT Superkrane Mitra Utama,Equity,Jakarta,09:00,16:00,UTC+07,IDR,0.2727
BUKK.JKT,PT Bukaka Teknik Utama Tbk,Equity,Jakarta,09:00,16:00,UTC+07,IDR,0.2143
MDKI.JKT,PT Emdeki Utama Tbk,Equity,Jakarta,09:00,16:00,UTC+07,IDR,0.2069
