symbol,name,type,region,marketOpen,marketClose,timezone,currency,matchScore
VAH.AUS,Virgin Australia Holdings Limited,Equity,Australia,10:00,16:00,UTC+11,AUD,0.6667
VAHN.SWI,Vaudoise Assurances Holding SA,Equity,Switzerland,09:00,17:30,UTC+01,CHF,0.6667
VAHB.STG,Vaudoise Assurances Holding SAN,Equity,Stuttgart,08:00,20:00,UTC+01,EUR,0.6667
VAH.TRT,Vanguard FTSE Dev Asia Pac All Cap ETF H,ETF,Toronto,09:30,16:00,UTC-05,CAD,0.6000
VAHB.FRK,Vaudoise Assurances Holding SA,Equity,Frankfurt,08:00,20:00,UTC+01,EUR,0.6000
