symbol,name,type,region,marketOpen,marketClose,timezone,currency,matchScore
VNYTX,Vanguard NY Long-Term Tax-Exempt Inv,Mutual Fund,United States,09:30,16:00,UTC-05,USD,0.7500
VNYUX,Vanguard NY Long-Term Tax-Exempt Admiral,Mutual Fund,United States,09:30,16:00,UTC-05,USD,0.7500
VNYYX,Invesco New York Tax Free Income Y,Mutual Fund,United States,09:30,16:00,UTC-05,USD,0.7500
VNYCX,Invesco New York Tax Free Income C,Mutual Fund,United States,09:30,16:00,UTC-05,USD,0.7500
VNYSX,Invesco New York Tax Free Income R6,Mutual Fund,United States,09:30,16:00,UTC-05,USD,0.7500
VNYAX,Invesco New York Tax Free Income A,Mutual Fund,United States,09:30,16:00,UTC-05,USD,0.7500
