symbol,name,type,region,marketOpen,marketClose,timezone,currency,matchScore
VQT,Barclays ETN+ S&P VEQTOR,ETF,United States,09:30,16:00,UTC-05,USD,1.0000
VQTPSX,Investors Quality Tax-Exempt Tr,Mutual Fund,United States,09:30,16:00,UTC-05,USD,0.7500
VQTSTX,Quality Municipals Income Trust,Mutual Fund,United States,09:30,16:00,UTC-05,USD,0.6667
VQTETX,Investors Quality Tax-Exempt Tr,Mutual Fund,United States,09:30,16:00,UTC-05,USD,0.6667
VQTXEX,Investors Quality Tax-Exempt Tr,Mutual Fund,United States,09:30,16:00,UTC-05,USD,0.6667
VQT.STG,VA-Q-TEC AG NAMENS-AKTIEN O.N.,Equity,Stuttgart,08:00,20:00,UTC+01,EUR,0.6667
VQT.FRK,va-Q-tec AG,Equity,Frankfurt,08:00,20:00,UTC+01,EUR,0.6667
VQT.FRK,va-Q-tec AG,Equity,Frankfurt/XETRA,08:00,20:00,UTC+01,EUR,0.6667
