symbol,name,type,region,marketOpen,marketClose,timezone,currency,matchScore
VVAR11.SAO,Via Varejo S.A. SHS DEP CERT,Equity,Brazil/Sao Paolo,10:00,17:30,UTC-02,BRL,0.6667
VVAR3.SAO,Via Varejo S.A.,Equity,Brazil/Sao Paolo,10:00,17:30,UTC-02,BRL,0.6000
VVAR4.SAO,Via Varejo S.A.,Equity,Brazil/Sao Paolo,10:00,17:30,UTC-02,BRL,0.6000
VVAL.LON,Vanguard Funds Public Limited Company - Vanguard Global Value Factor UCITS ETF,ETF,United Kingdom,08:00,16:30,UTC+00,GBP,0.5455
VVAL.AMS,Vanguard Funds Public Limited Company - Vanguard Global Value Factor UCITS ETF,ETF,Amsterdam,09:00,17:40,UTC+01,EUR,0.5455
VVAL.SWI,Vanguard Global Value Factor ETF USD Acc,ETF,Switzerland,09:00,17:30,UTC+01,CHF,0.5000
VVAITA.MIL,VARENNE VALEUR QUOTA IT,Mutual Fund,Milan,09:00,17:30,UTC+01,EUR,0.5000
