symbol,name,type,region,marketOpen,marketClose,timezone,currency,matchScore
VWELX,Vanguard Wellington Inv,Mutual Fund,United States,09:30,16:00,UTC-05,USD,0.7500
VWENX,Vanguard Wellington Admiral,Mutual Fund,United States,09:30,16:00,UTC-05,USD,0.7500
VWEHX,Vanguard High-Yield Corporate Inv,Mutual Fund,United States,09:30,16:00,UTC-05,USD,0.7500
VWEAX,Vanguard High-Yield Corporate Admiral,Mutual Fund,United States,09:30,16:00,UTC-05,USD,0.7500
VWESX,Vanguard Long-Term Investment-Grade Inv,Mutual Fund,United States,09:30,16:00,UTC-05,USD,0.7500
VWETX,Vanguard Long-Term Investment-Grade Admiral,Mutual Fund,United States,09:30,16:00,UTC-05,USD,0.7500
