symbol,name,type,region,marketOpen,marketClose,timezone,currency,matchScore
VYRMX,Voya Solution Aggressive R6,Mutual Fund,United States,09:30,16:00,UTC-05,USD,0.7500
VYRLX,Voya Solution Balanced Port R6,Mutual Fund,United States,09:30,16:00,UTC-05,USD,0.7500
VYRPX,Voya Solution Conservative Port R6,Mutual Fund,United States,09:30,16:00,UTC-05,USD,0.7500
VYRIX,VY T. Rowe Price Divers Mid Cap Gr R6,Mutual Fund,United States,09:30,16:00,UTC-05,USD,0.7500
VYRDX,VY Columbia Small Cap Value II R6,Mutual Fund,United States,09:30,16:00,UTC-05,USD,0.7500
VYROX,Voya Solution Moderately Agrsv Port R6,Mutual Fund,United States,09:30,16:00,UTC-05,USD,0.7500
VYRBX,VY Baron Growth R6,Mutual Fund,United States,09:30,16:00,UTC-05,USD,0.7500
VYRNX,Voya Solution Moderately Cnsrv Port R6,Mutual Fund,United States,09:30,16:00,UTC-05,USD,0.7500
