symbol,name,type,region,marketOpen,marketClose,timezone,currency,matchScore
WLTW,Willis Towers Watson Public Limited Company,Equity,United States,09:30,16:00,UTC-05,USD,0.8571
WLTGQ,Walter Energy Inc.,Equity,United States,09:30,16:00,UTC-05,USD,0.7500
WLTNF,Wilton Resources Inc.,Equity,United States,09:30,16:00,UTC-05,USD,0.7500
WLTYX,Ivy Limited-Term Bond Y,Mutual Fund,United States,09:30,16:00,UTC-05,USD,0.7500
WLTAX,Ivy Limited-Term Bond A,Mutual Fund,United States,09:30,16:00,UTC-05,USD,0.7500
WLTTX,Wilshire International Equity Instl,Mutual Fund,United States,09:30,16:00,UTC-05,USD,0.7500
WLTBX,Ivy Limited-Term Bond B,Mutual Fund,United States,09:30,16:00,UTC-05,USD,0.7500
101816.BSE,Birla Sun Life MIP II Wlth 25 Reg Mn Div,Mutual Fund,India/Bombay,09:15,15:30,UTC+5.5,INR,0.1395
