symbol,name,type,region,marketOpen,marketClose,timezone,currency,matchScore
WST,West Pharmaceutical Services Inc.,Equity,United States,09:30,16:00,UTC-05,USD,1.0000
WSTL,Westell Technologies Inc.,Equity,United States,09:30,16:00,UTC-05,USD,0.8571
WSTRF,Western Uranium & Vanadium Corp.,Equity,United States,09:30,16:00,UTC-05,USD,0.8571
WSTG,Wayside Technology Group Inc.,Equity,United States,09:30,16:00,UTC-05,USD,0.8571
WSTI,WindStream Technologies Inc.,Equity,United States,09:30,16:00,UTC-05,USD,0.7500
WSTAX,Ivy Science And Technology A,Mutual Fund,United States,09:30,16:00,UTC-05,USD,0.7500
WAMBX,WSTCM Credit Select Risk Managed Inv,Mutual Fund,United States,09:30,16:00,UTC-05,USD,0.7500
WSTCX,Ivy Science And Technology C,Mutual Fund,United States,09:30,16:00,UTC-05,USD,0.7500
WSTYX,Ivy Science And Technology Y,Mutual Fund,United States,09:30,16:00,UTC-05,USD,0.7500
WSTRX,Ivy Science And Technology R,Mutual Fund,United States,09:30,16:00,UTC-05,USD,0.2500
