symbol,name,type,region,marketOpen,marketClose,timezone,currency,matchScore
XCCAX,MFS California Municipal Fund,Mutual Fund,United States,09:30,16:00,UTC-05,USD,0.7500
XCCDX,Calamos Dynamic Convertible and,Mutual Fund,United States,09:30,16:00,UTC-05,USD,0.7500
603667.SHH,Zhejiang XCC Group Co. Ltd.,Equity,Shanghai,09:30,15:00,UTC+08,CNY,0.7500
XCC.FRK,CSE Global Limited,Equity,Frankfurt,08:00,20:00,UTC+01,EUR,0.6667
XCC.STG,CSE Global Ltd. Registered Shar,Equity,Stuttgart,08:00,20:00,UTC+01,EUR,0.2069
