symbol,name,type,region,marketOpen,marketClose,timezone,currency,matchScore
XRO,Guggenheim Sector Rotation ETF,ETF,United States,09:30,16:00,UTC-05,USD,1.0000
XROLF,Xero Limited,Equity,United States,09:30,16:00,UTC-05,USD,0.7500
XROFDX,Raymond James Oil Focus Equity ,Mutual Fund,United States,09:30,16:00,UTC-05,USD,0.6667
XROFEX,Raymond James Oil Focus Series ,Mutual Fund,United States,09:30,16:00,UTC-05,USD,0.6667
XROFBX,Raymond James Oil Focus Equity ,Mutual Fund,United States,09:30,16:00,UTC-05,USD,0.6667
XROFCX,Raymond James Oil Focus Equity ,Mutual Fund,United States,09:30,16:00,UTC-05,USD,0.6667
XRO.AUS,Xero Limited,Equity,Australia,10:00,16:00,UTC+11,AUD,0.6667
