symbol,name,type,region,marketOpen,marketClose,timezone,currency,matchScore
XSFD.LON,X S&P Select Frontier Swap ETF 1C,ETF,United Kingdom,08:00,16:30,UTC+00,GBP,0.6667
XSFN.LON,XTRACKERS (IE) PUBLIC LIMITED C,ETF,United Kingdom,08:00,16:30,UTC+00,GBP,0.6667
XSFR.MIL,X S&P Select Frontier Swap ETF 1C,ETF,Milan,09:00,17:30,UTC+01,EUR,0.6667
XSFR.LON,db x-trackers - S&P Select Frontier UCITS ETF,ETF,United Kingdom,08:00,16:30,UTC+00,GBP,0.6000
XSFA.BER,"SENECA FOODS A  DL-,25",Equity,Berlin,08:00,20:00,UTC+01,EUR,0.6000
