symbol,name,type,region,marketOpen,marketClose,timezone,currency,matchScore
XVZ,iPath S&P 500 Dynamic VIX ETN,ETF,United States,09:30,16:00,UTC-05,USD,0.8000
XVLTX,Invesco High Income Trust II Co,Mutual Fund,United States,09:30,16:00,UTC-05,USD,0.5714
XVCFX,Delaware Colorado Municipal Inc,Mutual Fund,United States,09:30,16:00,UTC-05,USD,0.5714
XVGIX,Virtus Global Multi-Sector Inco,Mutual Fund,United States,09:30,16:00,UTC-05,USD,0.5714
XVAMX,Vivaldi Opportunities Fund,Mutual Fund,United States,09:30,16:00,UTC-05,USD,0.5714
XVTAX,Invesco Dynamic Credit Opportun,Mutual Fund,United States,09:30,16:00,UTC-05,USD,0.5714
XVKIX,Invesco Advantage Muni Income T,Mutual Fund,United States,09:30,16:00,UTC-05,USD,0.5714
XVGMX,Invesco Trust for Investment Gr,Mutual Fund,United States,09:30,16:00,UTC-05,USD,0.5714
XVVRX,Invesco Senior Income Trust,Mutual Fund,United States,09:30,16:00,UTC-05,USD,0.5714
