symbol,name,type,region,marketOpen,marketClose,timezone,currency,matchScore
XWEB,SPDR S&P Internet ETF,ETF,United States,09:30,16:00,UTC-05,USD,0.6667
XWIAX,Western Asset/Claymore Inflatio,Mutual Fund,United States,09:30,16:00,UTC-05,USD,0.5714
XWAMX,Western Asset Middle Market Debt F,Mutual Fund,United States,09:30,16:00,UTC-05,USD,0.5714
XWEAX,Western Asset Premier Bond Fund,Mutual Fund,United States,09:30,16:00,UTC-05,USD,0.5714
XWMFX,Western Asset Middle Markets In,Mutual Fund,United States,09:30,16:00,UTC-05,USD,0.5714
XWIWX,Western Asset/Claymore Inflatio,Mutual Fund,United States,09:30,16:00,UTC-05,USD,0.5714
