symbol,name,type,region,marketOpen,marketClose,timezone,currency,matchScore
YIN,Yintech Investment Holdings Limited,Equity,United States,09:30,16:00,UTC-05,USD,1.0000
YINN,Direxion Daily FTSE China Bull 3X ETF,ETF,United States,09:30,16:00,UTC-05,USD,0.8571
YGEHY,Yingli Green Energy Holding Company Limited,Equity,United States,09:30,16:00,UTC-05,USD,0.5714
UBLI,Yinghong Guangda Technology Limited,Equity,United States,09:30,16:00,UTC-05,USD,0.2857
YITD,Yinhang Internet Technologies Development Inc.,Equity,United States,09:30,16:00,UTC-05,USD,0.2500
ELRE,Yinfu Gold Corporation,Equity,United States,09:30,16:00,UTC-05,USD,0.2400
