symbol,name,type,region,marketOpen,marketClose,timezone,currency,matchScore
CYD,China Yuchai International Limited,Equity,United States,09:30,16:00,UTC-05,USD,0.4444
CYD.BER,"CHINA YUCHAI INTL  DL-,01",Equity,Berlin,08:00,20:00,UTC+01,EUR,0.3333
CYD.STG,CHINA YUCHAI INTERNATIONAL LTDR,Equity,Stuttgart,08:00,20:00,UTC+01,EUR,0.2500
CYD.FRK,China Yuchai International Limited,Equity,Frankfurt,08:00,20:00,UTC+01,EUR,0.2222
CYD.MUN,"CHINA YUCHAI INTL  DL-,01",Equity,Munich,08:00,20:00,UTC+01,EUR,0.2222
