symbol,name,type,region,marketOpen,marketClose,timezone,currency,matchScore
FZROX,Fidelity ZERO Total Market Index,Mutual Fund,United States,09:30,16:00,UTC-05,USD,0.5714
FZILX,Fidelity ZERO International Index,Mutual Fund,United States,09:30,16:00,UTC-05,USD,0.5000
FNILX,Fidelity ZERO Large Cap Index,Mutual Fund,United States,09:30,16:00,UTC-05,USD,0.2857
FZIPX,Fidelity ZERO Extended Market Index,Mutual Fund,United States,09:30,16:00,UTC-05,USD,0.2500
ZROZ,PIMCO 25+ Year Zero Coupon US Trs ETF,ETF,United States,09:30,16:00,UTC-05,USD,0.2500
BTTRX,American Century Zero Coupon 2025 Inv,Mutual Fund,United States,09:30,16:00,UTC-05,USD,0.2500
ZGSI,Zero Gravity Solutions Inc.,Equity,United States,09:30,16:00,UTC-05,USD,0.2500
BTTTX,American Century Zero Coupon 2020 Inv,Mutual Fund,United States,09:30,16:00,UTC-05,USD,0.1875
ACTEX,American Century Zero Coupon 2020 Adv,Mutual Fund,United States,09:30,16:00,UTC-05,USD,0.1500
