symbol,name,type,region,marketOpen,marketClose,timezone,currency,matchScore
ZJPN,SPDR Solactive Japan ETF,ETF,United States,09:30,16:00,UTC-05,USD,0.8571
ZJP4.HAM,SISF GREATER CHINA A ACC,ETF,Hamburg,08:00,20:00,UTC+01,EUR,0.6000
ZJP8.DUS,SISF AS.BD TOT.RET. A1A,ETF,Dusseldorf,08:30,20:00,UTC+01,EUR,0.6000
ZJP9.BER,SISF AS.BD TOT.RET. ADMV,ETF,Berlin,08:00,20:00,UTC+01,EUR,0.6000
ZJP2.HAM,SCHR.ISF-ASIAN OPP.A ACC,ETF,Hamburg,08:00,20:00,UTC+01,EUR,0.6000
ZJP6.DUS,SISF E.M.D.A.R.C ACC,ETF,Dusseldorf,08:30,20:00,UTC+01,EUR,0.6000
