symbol,name,type,region,marketOpen,marketClose,timezone,currency,matchScore
ZMSPF,Zecotek Photonics Inc.,Equity,United States,09:30,16:00,UTC-05,USD,0.7500
ZMS.TRV,Zecotek Photonics Inc.,Equity,Toronto Venture,09:30,16:00,UTC-05,CAD,0.7500
ZMSSP1.MIL,ZENIT STOCK PICKING PIR CLASSE ,Mutual Fund,Milan,09:00,17:30,UTC+01,EUR,0.6000
ZMSB.TRT,BMO Global Multi-Sector Bond ETF,ETF,Toronto,09:30,16:00,UTC-05,CAD,0.5000
ZMSGO1.MIL,ZENIT GLOBAL OPPORTUNITIES CLAS,Mutual Fund,Milan,09:00,17:30,UTC+01,EUR,0.5000
ZMSST1.MIL,ZENIT STABILITY CLASSE Q,Mutual Fund,Milan,09:00,17:30,UTC+01,EUR,0.5000
